name	nt_name	aa_name	multi_aa_name	multiaa_mutation_split_names	start	vcf_gene	chrom_region	mutation_type	dp	obs_sample_size	variant_pop_size	ps_filter	ps_exc	mat_pep_id	mat_pep_desc	mat_pep_acc	ro	ao_by_var_seq	ao	variant_seq	reference_seq	function_category	citation	citation_url	comb_mutation	function_description	heterozygosity	viral_lineages	clade_defining_status	status	voi_designation_date	voc_designation_date	vum_designation_date
p.K417T	c.A1250C	p.K417T			22812	S	S	MISSENSE	11372	172.0	11387						0	C=11372	11372	C	A	pharmaceutical effectiveness	Engelhart et al. (2021)	https://www.biorxiv.org/content/10.1101/2021.04.27.440939v1		COR-101 lost ~16x binding against this isolated mutation. Estesevimab lost ~16x binding against this isolated mutation. m396 lost ~8x binding against this isolated mutation.	False	P.1.12.1, P.1.17, P.1.14, P.1.15, P.1, P.1.12, P.1.10, P.1.7	P.1.12=True, P.1.14=True, P.1.7=True, P.1.10=True, P.1=True, P.1.12.1=True, P.1.17=True, P.1.15=True	VOC		11-Jan-2021	
p.K417T	c.A1250C	p.K417T			22812	S	S	MISSENSE	11372	172.0	11387						0	C=11372	11372	C	A	pharmaceutical effectiveness	Engelhart et al. (2021)	https://www.biorxiv.org/content/10.1101/2021.04.27.440939v1	'E484K', 'N501Y'	Tixagevimab, Regdanvimab and COR-101 display reduced binding affinity to virus pseudotyped as RBD from P.1.	False	P.1.12.1, P.1.17, P.1.14, P.1.15, P.1, P.1.12, P.1.10, P.1.7	P.1.12=True, P.1.14=True, P.1.7=True, P.1.10=True, P.1=True, P.1.12.1=True, P.1.17=True, P.1.15=True	VOC		11-Jan-2021	
p.K417T	c.A1250C	p.K417T			22812	S	S	MISSENSE	11372	172.0	11387						0	C=11372	11372	C	A	pharmaceutical effectiveness	Hoffman et al. (2021)	https://doi.org/10.1016/j.cell.2021.03.036	'L18F', 'T20N', 'P26S', 'D138Y', 'R190S', 'E484K', 'N501Y', 'H655Y', 'T1027I', 'V1176F'	VSV pseudotype P.1 entry mediated by the S proteins of the P.1 variant was completely resistant to blocking by REGN10989 and Bamlanivimab. Cell fusion proficiency was slight impaired. Entry driven by the S proteins of the B.1.351 was partially resistant against Casirivimab.	False	P.1.12.1, P.1.17, P.1.14, P.1.15, P.1, P.1.12, P.1.10, P.1.7	P.1.12=True, P.1.14=True, P.1.7=True, P.1.10=True, P.1=True, P.1.12.1=True, P.1.17=True, P.1.15=True	VOC		11-Jan-2021	
p.K417T	c.A1250C	p.K417T			22812	S	S	MISSENSE	11372	172.0	11387						0	C=11372	11372	C	A	reinfection	Malta Romano et al. (2021)	https://doi.org/10.1590/s1678-9946202163036	'L18F', 'T20N', 'P26S', 'D138Y', 'R190S', 'E484K', 'N501Y', 'D614G', 'H655Y', 'T1027I'	After a 128 day interval, a patient in Sao Paulo State, Brazil reinfected with P.1 (first episode likely predates P.1 emergence). Both cases were fairly mild (difficulty breathing, tiredness, dizziness and fatigue).	False	P.1.12.1, P.1.17, P.1.14, P.1.15, P.1, P.1.12, P.1.10, P.1.7	P.1.12=True, P.1.14=True, P.1.7=True, P.1.10=True, P.1=True, P.1.12.1=True, P.1.17=True, P.1.15=True	VOC		11-Jan-2021	
p.K417T	c.A1250C	p.K417T			22812	S	S	MISSENSE	11372	172.0	11387						0	C=11372	11372	C	A	trafficking	Esclera et al. (2021)	https://www.biorxiv.org/content/10.1101/2021.08.05.455290v1	'L18F', 'T20N', 'P26S', 'D138Y', 'R190S', 'E484K', 'N501Y', 'D614G', 'H655Y', 'T1027I'	~6x cleavage of S2 relative to WA1 (D614G) wildtype by Gamma variant as measured by mass spectrometry of Vero-TMPRSS culture  [no mutations directly at furin cleavage site, but H655Y is upstream] Compare to 4.5x or less for variants of concern with  direct furin clevage site mutations.	False	P.1.12.1, P.1.17, P.1.14, P.1.15, P.1, P.1.12, P.1.10, P.1.7	P.1.12=True, P.1.14=True, P.1.7=True, P.1.10=True, P.1=True, P.1.12.1=True, P.1.17=True, P.1.15=True	VOC		11-Jan-2021	
p.K417T	c.A1250C	p.K417T			22812	S	S	MISSENSE	11372	172.0	11387						0	C=11372	11372	C	A	trafficking	Hoffman et al. (2021)	https://doi.org/10.1016/j.cell.2021.03.036	'L18F', 'T20N', 'P26S', 'D138Y', 'R190S', 'E484K', 'N501Y', 'H655Y', 'T1027I', 'V1176F'	VSV pseudotype P.1 showed slight decrease in cell entry relative to wild type in 262T and 263T-ACE2 (kidney) cell lines. Cell fusion proficiency was slight impaired.	False	P.1.12.1, P.1.17, P.1.14, P.1.15, P.1, P.1.12, P.1.10, P.1.7	P.1.12=True, P.1.14=True, P.1.7=True, P.1.10=True, P.1=True, P.1.12.1=True, P.1.17=True, P.1.15=True	VOC		11-Jan-2021	
p.K417T	c.A1250C	p.K417T			22812	S	S	MISSENSE	11372	172.0	11387						0	C=11372	11372	C	A	vaccine neutralization efficacy	Alenquer et al. (2021)	https://www.biorxiv.org/content/10.1101/2021.04.22.441007v1	'L18F', 'T20N', 'P26S', 'D138Y', 'R190S', 'E484K', 'N501Y', 'H655Y', 'T1027I'	Using P.1 defining mutations for Spike, observed 4x average decrease in neutralization efficiency  (but still relevant titres) for sera from 10 BNT162b2 vaccinees 12 days after second dose, but only one  relevant titre 12 days after first dose. Compares unfavorably to wild type or B.1.1.7 titres.	False	P.1.12.1, P.1.17, P.1.14, P.1.15, P.1, P.1.12, P.1.10, P.1.7	P.1.12=True, P.1.14=True, P.1.7=True, P.1.10=True, P.1=True, P.1.12.1=True, P.1.17=True, P.1.15=True	VOC		11-Jan-2021	
p.K417T	c.A1250C	p.K417T			22812	S	S	MISSENSE	11372	172.0	11387						0	C=11372	11372	C	A	vaccine neutralization efficacy	Andrade et al. (2021)	https://www.biorxiv.org/content/10.1101/2021.04.14.439719v1	'L18F', 'T20N', 'P26S', 'D138Y', 'R190S', 'E484K', 'N501Y', 'H655Y', 'T1027I'	In human sera 8 weeks post-vaccination with INO-4800, a ~2-fold reduction in P.1 neutralization was observed.	False	P.1.12.1, P.1.17, P.1.14, P.1.15, P.1, P.1.12, P.1.10, P.1.7	P.1.12=True, P.1.14=True, P.1.7=True, P.1.10=True, P.1=True, P.1.12.1=True, P.1.17=True, P.1.15=True	VOC		11-Jan-2021	
p.K417T	c.A1250C	p.K417T			22812	S	S	MISSENSE	11372	172.0	11387						0	C=11372	11372	C	A	vaccine neutralization efficacy	Chen et al. (2021)	https://www.nature.com/articles/s41591-021-01294-w 	'L18F', 'T20N', 'P26S', 'D138Y', 'R190S', 'E484K', 'N501Y', 'D614G', 'H655Y', 'T1027I', 'V1176F'	The neutralizing activity of vaccine was slightly lower against B.1.1.248 variant constellation in sera tested from most of the 15 patients with  the BNT162b2 mRNA vaccine. (Fig. 4)	False	P.1.12.1, P.1.17, P.1.14, P.1.15, P.1, P.1.12, P.1.10, P.1.7	P.1.12=True, P.1.14=True, P.1.7=True, P.1.10=True, P.1=True, P.1.12.1=True, P.1.17=True, P.1.15=True	VOC		11-Jan-2021	
p.K417T	c.A1250C	p.K417T			22812	S	S	MISSENSE	11372	172.0	11387						0	C=11372	11372	C	A	vaccine neutralization efficacy	Choi et al. (2021)	https://www.biorxiv.org/content/10.1101/2021.06.28.449914v1	'L18F', 'T20N', 'P26S', 'D138Y', 'R190S', 'E484K', 'N501Y', 'H655Y', 'T1027I', 'V1176F'	Neutralization efficiency (ID50) against P.1 reduced 3.2x relative to D614G wildtype using pseudotyped VSV assay on 8 Moderna vaccinee sera one week post-booster.	False	P.1.12.1, P.1.17, P.1.14, P.1.15, P.1, P.1.12, P.1.10, P.1.7	P.1.12=True, P.1.14=True, P.1.7=True, P.1.10=True, P.1=True, P.1.12.1=True, P.1.17=True, P.1.15=True	VOC		11-Jan-2021	
p.K417T	c.A1250C	p.K417T			22812	S	S	MISSENSE	11372	172.0	11387						0	C=11372	11372	C	A	vaccine neutralization efficacy	Gallagher et al. (2021)	https://www.biorxiv.org/content/10.1101/2021.05.03.442455v1	'L18F', 'T20N', 'P26S', 'D138Y', 'R190S', 'E484K', 'N501Y', 'D614G', 'H655Y', 'T1027I', 'V1176F'	ELISpot assays show T cell neutralization reduced by 16.6% in this B.1.1.248 pseudotype relative to wild type in 18-20 pooled patient samples post second mRNA vaccine dose, with no significant difference between Pfizer and Moderna cohorts. Reduction was stronger in the S1 subunit than S2 (separate peptide pools were used).	False	P.1.12.1, P.1.17, P.1.14, P.1.15, P.1, P.1.12, P.1.10, P.1.7	P.1.12=True, P.1.14=True, P.1.7=True, P.1.10=True, P.1=True, P.1.12.1=True, P.1.17=True, P.1.15=True	VOC		11-Jan-2021	
p.K417T	c.A1250C	p.K417T			22812	S	S	MISSENSE	11372	172.0	11387						0	C=11372	11372	C	A	vaccine neutralization efficacy	Garcia-Beltran et al. (2021)	https://doi.org/10.1016/j.cell.2021.03.013	'L18F', 'T20N', 'P26S', 'D138Y', 'R190S', 'E484K', 'N501Y', 'D614G', 'H655Y', 'T1027I', 'V1176F'	Pseudotyped P.1 virus has reduced neutralization activity vs wild type: 6.7x (30 sera Pfizer median 9 days post 2nd dose)  and 4.5x (35 sera Moderna median 18 days post 2nd dose). This was significant by ANOVA.	False	P.1.12.1, P.1.17, P.1.14, P.1.15, P.1, P.1.12, P.1.10, P.1.7	P.1.12=True, P.1.14=True, P.1.7=True, P.1.10=True, P.1=True, P.1.12.1=True, P.1.17=True, P.1.15=True	VOC		11-Jan-2021	
p.K417T	c.A1250C	p.K417T			22812	S	S	MISSENSE	11372	172.0	11387						0	C=11372	11372	C	A	vaccine neutralization efficacy	Gong et al. (2021)	https://www.biorxiv.org/content/10.1101/2021.08.04.455140v1	'L18F', 'T20N', 'P26S', 'D138Y', 'R190S', 'E484K', 'N501Y', 'H655Y', 'T1027I', 'V1176F'	1.15x *increase* in neutralization (ID50) in sera 3 weeks after one dose of Pfizer/BioNTech BNT162b2 (up to 5 naive and post infection vaccinees)	False	P.1.12.1, P.1.17, P.1.14, P.1.15, P.1, P.1.12, P.1.10, P.1.7	P.1.12=True, P.1.14=True, P.1.7=True, P.1.10=True, P.1=True, P.1.12.1=True, P.1.17=True, P.1.15=True	VOC		11-Jan-2021	
p.K417T	c.A1250C	p.K417T			22812	S	S	MISSENSE	11372	172.0	11387						0	C=11372	11372	C	A	vaccine neutralization efficacy	Hitchlings et al. (2021)	https://www.medrxiv.org/content/10.1101/2021.04.07.21255081v1	'L18F', 'T20N', 'P26S', 'D138Y', 'R190S', 'E484K', 'N501Y', 'H655Y', 'T1027I'	Among 46,884 HCWs in Manaus, Brazil vaccinated with at least one dose of CoronaVac, a 0.50-fold reduction (adjusted vaccine  effectiveness, 49.6%: 95% CI, 11.3 - 71.4) in the odds of  symptomatic SARS-CoV-2 infection was observed during the period 14 days or more after receiving the first dose. Estimated vaccine effectiveness of at least one dose against any SARS-CoV-2 infection was 35.1% (95% CI, −6.6 - 60.5) in the same time period.	False	P.1.12.1, P.1.17, P.1.14, P.1.15, P.1, P.1.12, P.1.10, P.1.7	P.1.12=True, P.1.14=True, P.1.7=True, P.1.10=True, P.1=True, P.1.12.1=True, P.1.17=True, P.1.15=True	VOC		11-Jan-2021	
p.K417T	c.A1250C	p.K417T			22812	S	S	MISSENSE	11372	172.0	11387						0	C=11372	11372	C	A	vaccine neutralization efficacy	Hoffman et al. (2021)	https://doi.org/10.1016/j.cell.2021.03.036	'L18F', 'T20N', 'P26S', 'D138Y', 'R190S', 'E484K', 'N501Y', 'H655Y', 'T1027I', 'V1176F'	VSV pseudotype P.1 showed 5.12-fold reduction in neutralization efficiency vs wild type in 15 Pfizer BNT162b2 vaccinee sera 13-15 days post second dose. Cell fusion proficiency was slight impaired.	False	P.1.12.1, P.1.17, P.1.14, P.1.15, P.1, P.1.12, P.1.10, P.1.7	P.1.12=True, P.1.14=True, P.1.7=True, P.1.10=True, P.1=True, P.1.12.1=True, P.1.17=True, P.1.15=True	VOC		11-Jan-2021	
p.K417T	c.A1250C	p.K417T			22812	S	S	MISSENSE	11372	172.0	11387						0	C=11372	11372	C	A	vaccine neutralization efficacy	Leier et al. (2021)	https://www.medrxiv.org/content/10.1101/2021.04.25.21256049v1	'L18F', 'T20N', 'P26S', 'D138Y', 'R190S', 'E484K', 'N501Y', 'D614G', 'H655Y', 'T1027I', 'V1176F'	Neutralizing antibody titers increased in previously infected vaccinees relative to uninfected vaccinees  4.3-fold against P.1 (contrast with 3.4 fold against original SARS-CoV-2).	False	P.1.12.1, P.1.17, P.1.14, P.1.15, P.1, P.1.12, P.1.10, P.1.7	P.1.12=True, P.1.14=True, P.1.7=True, P.1.10=True, P.1=True, P.1.12.1=True, P.1.17=True, P.1.15=True	VOC		11-Jan-2021	
p.K417T	c.A1250C	p.K417T			22812	S	S	MISSENSE	11372	172.0	11387						0	C=11372	11372	C	A	vaccine neutralization efficacy	Tarke et al. (2021)	https://www.biorxiv.org/content/10.1101/2021.02.27.433180v1	'L18F', 'T20N', 'P26S', 'D138Y', 'R190S', 'E484K', 'N501Y', 'H655Y', 'T1027I', 'V1176F'	PBMCs of Pfizer/BioNTech BNT162b2 (n	False	P.1.12.1, P.1.17, P.1.14, P.1.15, P.1, P.1.12, P.1.10, P.1.7	P.1.12=True, P.1.14=True, P.1.7=True, P.1.10=True, P.1=True, P.1.12.1=True, P.1.17=True, P.1.15=True	VOC		11-Jan-2021	
p.K417T	c.A1250C	p.K417T			22812	S	S	MISSENSE	11372	172.0	11387						0	C=11372	11372	C	A	vaccine neutralization efficacy	Wang et al. (2021)	https://dx.doi.org/10.1101%2F2021.03.01.433466	'L18F', 'T20N', 'P26S', 'D138Y', 'R190S', 'E484K', 'N501Y', 'D614G', 'H655Y'	In 12 Moderna vaccinee sera 15 days post second dose (43 days since first vaccination), an average 2.8x decrease in reciprocal ID50 value was observed  ten key point mutations in Spike in the P.1 lineage vs wildtype. A 4.8x decrease against the full P.1 type vs WA-1 was observed, though overall with  a higher ID50 reciprocal value. In 10 Pfizer vaccinee sera 7 days or more post second dose (28 days or more since first vaccination), an average 2.2x decrease in reciprocal ID50 value was observed  ten key point mutations in Spike in the P.1 lineage vs wildtype. A 3.8x decrease against the full P.1 type vs WA-1 was observed, with  similar variant ID50 reciprocal value.	False	P.1.12.1, P.1.17, P.1.14, P.1.15, P.1, P.1.12, P.1.10, P.1.7	P.1.12=True, P.1.14=True, P.1.7=True, P.1.10=True, P.1=True, P.1.12.1=True, P.1.17=True, P.1.15=True	VOC		11-Jan-2021	
p.K417T	c.A1250C	p.K417T			22812	S	S	MISSENSE	11372	172.0	11387						0	C=11372	11372	C	A	vaccinee plasma binding	Gong et al. (2021)	https://www.biorxiv.org/content/10.1101/2021.08.04.455140v1	'D614G'	1.04x increase in Spike binding (relative to D614G alone) by 5 plasma collected 3 weeks after one dose of Pfizer/BioNtech BNT162b2 vaccine in previously non-seroconverted subjects.  1.1x decrease in Spike binding (relative to D614G alone) by 5 plasma collected 3 weeks after one dose of Pfizer/BioNtech BNT162b2 vaccine in post-infection vaccinees.	False	P.1.12.1, P.1.17, P.1.14, P.1.15, P.1, P.1.12, P.1.10, P.1.7	P.1.12=True, P.1.14=True, P.1.7=True, P.1.10=True, P.1=True, P.1.12.1=True, P.1.17=True, P.1.15=True	VOC		11-Jan-2021	
p.K417T	c.A1250C	p.K417T			22812	S	S	MISSENSE	11372	172.0	11387						0	C=11372	11372	C	A	vaccinee plasma binding	Gong et al. (2021)	https://www.biorxiv.org/content/10.1101/2021.08.04.455140v1	'D614G', 'L18F', 'T20N', 'P26S', 'D138Y', 'R190S', 'E484K', 'N501Y', 'H655Y', 'T1027I'	This variant combination (representing P.1 aka Gamma)  showed a 1.14x decrease in Spike binding (relative to D614G alone) by 5 plasma 3 weeks after one dose of Pfizer/BioNtech BNT162b2 vaccine in previously non-seroconverted subjects.  1.27x decrease in Spike binding (relative to D614G alone) by 5 plasma collected 3 weeks after one dose of Pfizer/BioNtech BNT162b2 vaccine in post-infection vaccinees.	False	P.1.12.1, P.1.17, P.1.14, P.1.15, P.1, P.1.12, P.1.10, P.1.7	P.1.12=True, P.1.14=True, P.1.7=True, P.1.10=True, P.1=True, P.1.12.1=True, P.1.17=True, P.1.15=True	VOC		11-Jan-2021	
p.K417T	c.A1250C	p.K417T			22812	S	S	MISSENSE	11372	172.0	11387						0	C=11372	11372	C	A	virion structure	Spratt et al. (2021)	https://www.biorxiv.org/content/10.1101/2021.03.24.436850v1		Estimated free energy change (ddG) for this variant is -0.64 kcal/mol (i.e. destabilizing relative to wild type) 	False	P.1.12.1, P.1.17, P.1.14, P.1.15, P.1, P.1.12, P.1.10, P.1.7	P.1.12=True, P.1.14=True, P.1.7=True, P.1.10=True, P.1=True, P.1.12.1=True, P.1.17=True, P.1.15=True	VOC		11-Jan-2021	
p.K417T	c.A1250C	p.K417T			22812	S	S	MISSENSE	11372	172.0	11387						0	C=11372	11372	C	A	virion structure	Wang et al. (2021)	https://dx.doi.org/10.1101%2F2021.03.01.433466	'L18F', 'T20N', 'P26S', 'D138Y', 'R190S', 'E484K', 'N501Y', 'D614G', 'H655Y'	CryoEM reveals the P.1 trimer to adopt exclusively a conformation in which one of the receptor-binding domains is in the “up” position.	False	P.1.12.1, P.1.17, P.1.14, P.1.15, P.1, P.1.12, P.1.10, P.1.7	P.1.12=True, P.1.14=True, P.1.7=True, P.1.10=True, P.1=True, P.1.12.1=True, P.1.17=True, P.1.15=True	VOC		11-Jan-2021	
p.K4783R	c.A14348G	p.K4783R			14612	orf1ab	ORF1ab	MISSENSE	4	4.0	11387			RNA-dependent RNA polymerase	nsp12, NiRAN and RdRp, produced by pp1ab only	YP_009725307.1	3	G=1	1	G	A						False	P.1.10	P.1.10=False	VOC		11-Jan-2021	
p.L1621L	c.T4861C	p.L1621L			5126	orf1ab	ORF1ab	SILENT	26	26.0	11387			nsp3	former nsp1, conserved domains are: N-terminal acidic (Ac), predicted phosphoesterase, papain-like proteinase, Y-domain, transmembrane domain 1 (TM1), adenosine diphosphate-ribose 1''-phosphatase (ADRP), produced by both pp1a and pp1ab	YP_009725299.1	6	C=20	20	C	T						False	P.1.17	P.1.17=True	VOC		11-Jan-2021	
p.L18F	c.C52T	p.L18F			21614	S	S	MISSENSE	11383	172.0	11387						0	T=11383	11383	T	C	ACE2 receptor binding affinity	Gong et al. (2021)	https://www.biorxiv.org/content/10.1101/2021.08.04.455140v1	'D614G'	Using flow cytometry and ACE2 ectodomains-Fc portion IgG complex, this variant showed a 1.07x decrease in binding (KD) relative to D614G. Compare to increased binding in full Spike variant complements for major lineages containing this variant subset: 3.56x (B.1.351 aka Beta), 4.24x (P.1 aka Gamma).	False	P.1.12.1, P.1.17, P.1.14, P.1.15, P.1, P.1.12, P.1.10, P.1.7	P.1.12=True, P.1.14=True, P.1.7=True, P.1.10=True, P.1=True, P.1.12.1=True, P.1.17=True, P.1.15=True	VOC		11-Jan-2021	
p.L18F	c.C52T	p.L18F			21614	S	S	MISSENSE	11383	172.0	11387						0	T=11383	11383	T	C	ACE2 receptor binding affinity	Gong et al. (2021)	https://www.biorxiv.org/content/10.1101/2021.08.04.455140v1	'D614G', 'T20N', 'P26S', 'D138Y', 'R190S', 'K417T', 'E484K', 'N501Y', 'H655Y', 'T1027I'	Using flow cytometry and ACE2 ectodomains-Fc portion IgG complex, this variant combination (representing P.1 aka Gamma)  showed a 4.24x increase in binding (KD) relative to D614G.	False	P.1.12.1, P.1.17, P.1.14, P.1.15, P.1, P.1.12, P.1.10, P.1.7	P.1.12=True, P.1.14=True, P.1.7=True, P.1.10=True, P.1=True, P.1.12.1=True, P.1.17=True, P.1.15=True	VOC		11-Jan-2021	
p.L18F	c.C52T	p.L18F			21614	S	S	MISSENSE	11383	172.0	11387						0	T=11383	11383	T	C	anthropozoonotic events	Montagutelli et al. (2021)	https://www.biorxiv.org/content/10.1101/2021.03.18.436013v1	'T20N', 'P26S', 'D138Y', 'R190S', 'K417T', 'E484K', 'N501Y', 'D614G', 'H655Y', 'T1027I', 'V1176F'	Unlike wild type or B.1.1.7, P.1 lineage virus was able to infect and replicate in common lab mouse strains, with high titer.	False	P.1.12.1, P.1.17, P.1.14, P.1.15, P.1, P.1.12, P.1.10, P.1.7	P.1.12=True, P.1.14=True, P.1.7=True, P.1.10=True, P.1=True, P.1.12.1=True, P.1.17=True, P.1.15=True	VOC		11-Jan-2021	
p.L18F	c.C52T	p.L18F			21614	S	S	MISSENSE	11383	172.0	11387						0	T=11383	11383	T	C	antibody epitope effects	Chen et al. (2021)	https://www.nature.com/articles/s41591-021-01294-w 	'T20N', 'P26S', 'D138Y', 'R190S', 'K417T', 'E484K', 'N501Y', 'D614G', 'H655Y', 'T1027I', 'V1176F'	B.1.1.248 variant constellation ablates Class 1 receptor-binding-motif targeting antibodies COV2-2050, 1B07. B.1.1.248 variant constellation ablates Class 3 N-terminal domain targeting antibody COV2-2676.	False	P.1.12.1, P.1.17, P.1.14, P.1.15, P.1, P.1.12, P.1.10, P.1.7	P.1.12=True, P.1.14=True, P.1.7=True, P.1.10=True, P.1=True, P.1.12.1=True, P.1.17=True, P.1.15=True	VOC		11-Jan-2021	
p.L18F	c.C52T	p.L18F			21614	S	S	MISSENSE	11383	172.0	11387						0	T=11383	11383	T	C	antibody epitope effects	Dejnirattisai et al. (2021)	https://doi.org/10.1016/j.cell.2021.03.055	'T20N', 'P26S', 'D138Y', 'R190S'	"The neutralization titer of NTD-binding mAb159 was 133-fold reduced on P.1 compared to Victoria (~wild type), with only 64% neutralization at 10 μg/mL.  Residues 20, 18, and 138 form a cluster underlying the 245–259 loop, which inserts into a groove between the light and heavy chains of Fab 159. In addition, the N-terminal residues preceding residue 18 interact with the antibody and may be perturbed.  Given that there is likely a single supersite (""i"") for potent NTD-binding antibodies, the binding of many of these are likely affected. Using 20 potent (primaruly anti-RBD) antibodies, neutralization was measured by a focus reduction neutralization test (FRNT) and compared with  neutralization of Victoria (~wild type) and variants B.1.1.7 and B.1.351. Compared to Victoria neutralization by the mAbs was significantly impacted by P.1,  with 12/20 showing > 10-fold reduction in FRNT50 titer and a number showing complete knockout of activity. The results with P.1 showed a  greater impact compared to B.1.1.7 but were, as expected, similar to those with B.1.351."	False	P.1.12.1, P.1.17, P.1.14, P.1.15, P.1, P.1.12, P.1.10, P.1.7	P.1.12=True, P.1.14=True, P.1.7=True, P.1.10=True, P.1=True, P.1.12.1=True, P.1.17=True, P.1.15=True	VOC		11-Jan-2021	
p.L18F	c.C52T	p.L18F			21614	S	S	MISSENSE	11383	172.0	11387						0	T=11383	11383	T	C	antibody epitope effects	McCallum et al. (2021)	https://doi.org/10.1101/2021.01.14.426475		"Massive reduction in S2L28 monoclonal antibody EC50 (i.e. ablated recognition), within antigenic supersite ""i"", but no effect on other mAbs within that supersite"	False	P.1.12.1, P.1.17, P.1.14, P.1.15, P.1, P.1.12, P.1.10, P.1.7	P.1.12=True, P.1.14=True, P.1.7=True, P.1.10=True, P.1=True, P.1.12.1=True, P.1.17=True, P.1.15=True	VOC		11-Jan-2021	
p.L18F	c.C52T	p.L18F			21614	S	S	MISSENSE	11383	172.0	11387						0	T=11383	11383	T	C	antibody epitope effects	Wang et al. (2021)	https://www.nature.com/articles/s41586-021-03398-2		Ablates neutralization by N-terminal-domain-targeting mAbs 4-19. Impairs neutralization by N-terminal-domain-targeting mAbs 4A8 and 2-17.	False	P.1.12.1, P.1.17, P.1.14, P.1.15, P.1, P.1.12, P.1.10, P.1.7	P.1.12=True, P.1.14=True, P.1.7=True, P.1.10=True, P.1=True, P.1.12.1=True, P.1.17=True, P.1.15=True	VOC		11-Jan-2021	
p.L18F	c.C52T	p.L18F			21614	S	S	MISSENSE	11383	172.0	11387						0	T=11383	11383	T	C	antibody epitope effects	Wang et al. (2021)	https://dx.doi.org/10.1101%2F2021.03.01.433466	'T20N', 'P26S', 'D138Y', 'R190S', 'K417T', 'E484K', 'N501Y', 'D614G', 'H655Y'	Amongst RBD-targeting Emergency Use Authorized monoclonal antibody treatments CB6, LY-CoV555 and REGN10933 show abrogated neutralization activity against the ten key point mutations in Spike in the P.1 lineage vs wildtype or WA-1, but REGN10987 activity remains strong. RBD-targeting monoclonal antibodies 2-15 and C121 show abrogated neutralization activity against the ten key point mutations in Spike in the P.1 lineage vs wildtype or WA-1. N terminal domain targeting monoclonal antibodies 5-7, 4-8, 4-18 and 2-17 have abrogated neutralization activity against the ten key point mutations in Spike in the P.1 lineage vs wildtype or WA-1.	False	P.1.12.1, P.1.17, P.1.14, P.1.15, P.1, P.1.12, P.1.10, P.1.7	P.1.12=True, P.1.14=True, P.1.7=True, P.1.10=True, P.1=True, P.1.12.1=True, P.1.17=True, P.1.15=True	VOC		11-Jan-2021	
p.L18F	c.C52T	p.L18F			21614	S	S	MISSENSE	11383	172.0	11387						0	T=11383	11383	T	C	convalescent plasma binding	Gong et al. (2021)	https://www.biorxiv.org/content/10.1101/2021.08.04.455140v1	'D614G'	1.66x increase in Spike binding (relative to D614G alone) by 5 plasma collected 8 months post-symptom-onset. Compare to decreased binding in full Spike variant complements for major lineages containing this variant subset: 0.96x (B.1.351 aka Beta), 0.77x (P.1 aka Gamma).	False	P.1.12.1, P.1.17, P.1.14, P.1.15, P.1, P.1.12, P.1.10, P.1.7	P.1.12=True, P.1.14=True, P.1.7=True, P.1.10=True, P.1=True, P.1.12.1=True, P.1.17=True, P.1.15=True	VOC		11-Jan-2021	
p.L18F	c.C52T	p.L18F			21614	S	S	MISSENSE	11383	172.0	11387						0	T=11383	11383	T	C	convalescent plasma binding	Gong et al. (2021)	https://www.biorxiv.org/content/10.1101/2021.08.04.455140v1	'D614G', 'T20N', 'P26S', 'D138Y', 'R190S', 'K417T', 'E484K', 'N501Y', 'H655Y', 'T1027I'	This variant combination (representing P.1 aka Gamma)  showed a 1.3x decrease in Spike binding (relative to D614G alone) by 5 plasma collected 8 months post-symptom-onset.	False	P.1.12.1, P.1.17, P.1.14, P.1.15, P.1, P.1.12, P.1.10, P.1.7	P.1.12=True, P.1.14=True, P.1.7=True, P.1.10=True, P.1=True, P.1.12.1=True, P.1.17=True, P.1.15=True	VOC		11-Jan-2021	
p.L18F	c.C52T	p.L18F			21614	S	S	MISSENSE	11383	172.0	11387						0	T=11383	11383	T	C	convalescent plasma escape	Cele et al. (2021)	https://www.krisp.org.za/manuscripts/MEDRXIV-2021-250224v1-Sigal.pdf		The 501Y.V2 to first wave IC50 ratio ranged from 6 to 200-fold. Averaging across all 7 participant convalescent sera highlighted the dramatic decrease in sensitivity to neutralization of authentic 501Y.V2 variants. PG: I'm purposefully ignoring D614G and A701V as contributors	False	P.1.12.1, P.1.17, P.1.14, P.1.15, P.1, P.1.12, P.1.10, P.1.7	P.1.12=True, P.1.14=True, P.1.7=True, P.1.10=True, P.1=True, P.1.12.1=True, P.1.17=True, P.1.15=True	VOC		11-Jan-2021	
p.L18F	c.C52T	p.L18F			21614	S	S	MISSENSE	11383	172.0	11387						0	T=11383	11383	T	C	convalescent plasma escape	Chen et al. (2021)	https://www.nature.com/articles/s41591-021-01294-w 	'T20N', 'P26S', 'D138Y', 'R190S', 'K417T', 'E484K', 'N501Y', 'D614G', 'H655Y', 'T1027I', 'V1176F'	B.1.1.248 variant constellation in 10 convalescent human sera ~1mo post infection had mild to moderate resistence against most samples, P	False	P.1.12.1, P.1.17, P.1.14, P.1.15, P.1, P.1.12, P.1.10, P.1.7	P.1.12=True, P.1.14=True, P.1.7=True, P.1.10=True, P.1=True, P.1.12.1=True, P.1.17=True, P.1.15=True	VOC		11-Jan-2021	
p.L18F	c.C52T	p.L18F			21614	S	S	MISSENSE	11383	172.0	11387						0	T=11383	11383	T	C	convalescent plasma escape	Chen et al. (2021)	https://www.nature.com/articles/s41591-021-01294-w 	'T20N', 'P26S', 'D138Y', 'R190S', 'K417T', 'E484K', 'N501Y', 'D614G', 'H655Y', 'T1027I', 'V1176F'	B.1.1.7 variant constellation two-tailed Wilcoxon matched-pairs signed-rank test against 10 convalescent sera P	False	P.1.12.1, P.1.17, P.1.14, P.1.15, P.1, P.1.12, P.1.10, P.1.7	P.1.12=True, P.1.14=True, P.1.7=True, P.1.10=True, P.1=True, P.1.12.1=True, P.1.17=True, P.1.15=True	VOC		11-Jan-2021	
