name	nt_name	aa_name	multi_aa_name	multiaa_mutation_split_names	start	vcf_gene	chrom_region	mutation_type	dp	obs_sample_size	variant_pop_size	ps_filter	ps_exc	mat_pep_id	mat_pep_desc	mat_pep_acc	ro	ao_by_var_seq	ao	variant_seq	reference_seq	function_category	citation	citation_url	comb_mutation	function_description	heterozygosity	viral_lineages	clade_defining_status	status	voi_designation_date	voc_designation_date	vum_designation_date
p.E484K	c.G1450A	p.E484K			23012	S	S	MISSENSE	11382	172.0	11387						0	A=11382	11382	A	G	antibody epitope effects	Wang et al. (2021)	https://www.nature.com/articles/s41586-021-03398-2		Pseudotyped virus model ablates neutralization by RBD-directed mAbs 4-20, 2-4, 2-43, 2-30, 2-15, LY-Cov555, C121. Pseudotyped virus model impairs neutralization by RBD-directed mAb COV2-2196 (somewhat more than fully pseudotyped B.1.351 or live virus)	False	P.1.12.1, P.1.17, P.1.14, P.1.15, P.1, P.1.12, P.1.10, P.1.7	P.1.12=True, P.1.14=True, P.1.7=True, P.1.10=True, P.1=True, P.1.12.1=True, P.1.17=True, P.1.15=True	VOC		11-Jan-2021	
p.E484K	c.G1450A	p.E484K			23012	S	S	MISSENSE	11382	172.0	11387						0	A=11382	11382	A	G	antibody epitope effects	Wang et al. (2021)	https://www.biorxiv.org/content/10.1101/2021.01.15.426911v2		Resistent to all seven class 2 (Spike 'up' or 'down' conformation, RBD targeting) antibodies tested, with 10-fold  or greater reduction in neutralization (plus notable reudction in two unclassfied mAbs).	False	P.1.12.1, P.1.17, P.1.14, P.1.15, P.1, P.1.12, P.1.10, P.1.7	P.1.12=True, P.1.14=True, P.1.7=True, P.1.10=True, P.1=True, P.1.12.1=True, P.1.17=True, P.1.15=True	VOC		11-Jan-2021	
p.E484K	c.G1450A	p.E484K			23012	S	S	MISSENSE	11382	172.0	11387						0	A=11382	11382	A	G	antibody epitope effects	Wang et al. (2021)	https://dx.doi.org/10.1101%2F2021.03.01.433466	'L18F', 'T20N', 'P26S', 'D138Y', 'R190S', 'K417T', 'N501Y', 'D614G', 'H655Y'	Amongst RBD-targeting Emergency Use Authorized monoclonal antibody treatments CB6, LY-CoV555 and REGN10933 show abrogated neutralization activity against the ten key point mutations in Spike in the P.1 lineage vs wildtype or WA-1, but REGN10987 activity remains strong. RBD-targeting monoclonal antibodies 2-15 and C121 show abrogated neutralization activity against the ten key point mutations in Spike in the P.1 lineage vs wildtype or WA-1. N terminal domain targeting monoclonal antibodies 5-7, 4-8, 4-18 and 2-17 have abrogated neutralization activity against the ten key point mutations in Spike in the P.1 lineage vs wildtype or WA-1.	False	P.1.12.1, P.1.17, P.1.14, P.1.15, P.1, P.1.12, P.1.10, P.1.7	P.1.12=True, P.1.14=True, P.1.7=True, P.1.10=True, P.1=True, P.1.12.1=True, P.1.17=True, P.1.15=True	VOC		11-Jan-2021	
p.E484K	c.G1450A	p.E484K			23012	S	S	MISSENSE	11382	172.0	11387						0	A=11382	11382	A	G	convalescent plasma binding	Gong et al. (2021)	https://www.biorxiv.org/content/10.1101/2021.08.04.455140v1	'D614G'	1.42x increase in Spike binding (relative to D614G alone) by 5 plasma collected 8 months post-symptom-onset.	False	P.1.12.1, P.1.17, P.1.14, P.1.15, P.1, P.1.12, P.1.10, P.1.7	P.1.12=True, P.1.14=True, P.1.7=True, P.1.10=True, P.1=True, P.1.12.1=True, P.1.17=True, P.1.15=True	VOC		11-Jan-2021	
p.E484K	c.G1450A	p.E484K			23012	S	S	MISSENSE	11382	172.0	11387						0	A=11382	11382	A	G	convalescent plasma binding	Gong et al. (2021)	https://www.biorxiv.org/content/10.1101/2021.08.04.455140v1	'D614G', 'L18F', 'T20N', 'P26S', 'D138Y', 'R190S', 'K417T', 'N501Y', 'H655Y', 'T1027I'	This variant combination (representing P.1 aka Gamma)  showed a 1.3x decrease in Spike binding (relative to D614G alone) by 5 plasma collected 8 months post-symptom-onset.	False	P.1.12.1, P.1.17, P.1.14, P.1.15, P.1, P.1.12, P.1.10, P.1.7	P.1.12=True, P.1.14=True, P.1.7=True, P.1.10=True, P.1=True, P.1.12.1=True, P.1.17=True, P.1.15=True	VOC		11-Jan-2021	
p.E484K	c.G1450A	p.E484K			23012	S	S	MISSENSE	11382	172.0	11387						0	A=11382	11382	A	G	convalescent plasma escape	Alenquer et al. (2021)	https://www.biorxiv.org/content/10.1101/2021.04.22.441007v1		Average ~5-fold reduction in neutralization efficacy in convalescent sera of 16 health workers infected in Spring 2020.	False	P.1.12.1, P.1.17, P.1.14, P.1.15, P.1, P.1.12, P.1.10, P.1.7	P.1.12=True, P.1.14=True, P.1.7=True, P.1.10=True, P.1=True, P.1.12.1=True, P.1.17=True, P.1.15=True	VOC		11-Jan-2021	
p.E484K	c.G1450A	p.E484K			23012	S	S	MISSENSE	11382	172.0	11387						0	A=11382	11382	A	G	convalescent plasma escape	Andreano et al. (2020)	https://www.biorxiv.org/content/10.1101/2020.12.28.424451		This mutation occurred in 100% of sequenced virions after 12 passages and led to a 4-fold decrease in convalescent plasma neutralization activity	False	P.1.12.1, P.1.17, P.1.14, P.1.15, P.1, P.1.12, P.1.10, P.1.7	P.1.12=True, P.1.14=True, P.1.7=True, P.1.10=True, P.1=True, P.1.12.1=True, P.1.17=True, P.1.15=True	VOC		11-Jan-2021	
p.E484K	c.G1450A	p.E484K			23012	S	S	MISSENSE	11382	172.0	11387						0	A=11382	11382	A	G	convalescent plasma escape	Cele et al. (2021)	https://www.krisp.org.za/manuscripts/MEDRXIV-2021-250224v1-Sigal.pdf		The 501Y.V2 to first wave IC50 ratio ranged from 6 to 200-fold. Averaging across all 7 participant convalescent sera highlighted the dramatic decrease in sensitivity to neutralization of authentic 501Y.V2 variants. PG: I'm purposefully ignoring D614G and A701V as contributors	False	P.1.12.1, P.1.17, P.1.14, P.1.15, P.1, P.1.12, P.1.10, P.1.7	P.1.12=True, P.1.14=True, P.1.7=True, P.1.10=True, P.1=True, P.1.12.1=True, P.1.17=True, P.1.15=True	VOC		11-Jan-2021	
p.E484K	c.G1450A	p.E484K			23012	S	S	MISSENSE	11382	172.0	11387						0	A=11382	11382	A	G	convalescent plasma escape	Chen et al. (2021)	https://www.nature.com/articles/s41591-021-01294-w 	'L18F', 'T20N', 'P26S', 'D138Y', 'R190S', 'K417T', 'N501Y', 'D614G', 'H655Y', 'T1027I', 'V1176F'	B.1.1.248 variant constellation in 10 convalescent human sera ~1mo post infection had mild to moderate resistence against most samples, P	False	P.1.12.1, P.1.17, P.1.14, P.1.15, P.1, P.1.12, P.1.10, P.1.7	P.1.12=True, P.1.14=True, P.1.7=True, P.1.10=True, P.1=True, P.1.12.1=True, P.1.17=True, P.1.15=True	VOC		11-Jan-2021	
p.E484K	c.G1450A	p.E484K			23012	S	S	MISSENSE	11382	172.0	11387						0	A=11382	11382	A	G	convalescent plasma escape	Chen et al. (2021)	https://www.nature.com/articles/s41591-021-01294-w 	'L18F', 'T20N', 'P26S', 'D138Y', 'R190S', 'K417T', 'N501Y', 'D614G', 'H655Y', 'T1027I', 'V1176F'	B.1.1.7 variant constellation two-tailed Wilcoxon matched-pairs signed-rank test against 10 convalescent sera P	False	P.1.12.1, P.1.17, P.1.14, P.1.15, P.1, P.1.12, P.1.10, P.1.7	P.1.12=True, P.1.14=True, P.1.7=True, P.1.10=True, P.1=True, P.1.12.1=True, P.1.17=True, P.1.15=True	VOC		11-Jan-2021	
p.E484K	c.G1450A	p.E484K			23012	S	S	MISSENSE	11382	172.0	11387						0	A=11382	11382	A	G	convalescent plasma escape	Chen et al. (2021)	https://www.nature.com/articles/s41591-021-01294-w 	'N501Y'	In 19 convalescent human sera ~1mo post infection had mild to moderate resistence against all samples. 	False	P.1.12.1, P.1.17, P.1.14, P.1.15, P.1, P.1.12, P.1.10, P.1.7	P.1.12=True, P.1.14=True, P.1.7=True, P.1.10=True, P.1=True, P.1.12.1=True, P.1.17=True, P.1.15=True	VOC		11-Jan-2021	
p.E484K	c.G1450A	p.E484K			23012	S	S	MISSENSE	11382	172.0	11387						0	A=11382	11382	A	G	convalescent plasma escape	Hoffman et al. (2021)	https://doi.org/10.1016/j.cell.2021.03.036	'L18F', 'T20N', 'P26S', 'D138Y', 'R190S', 'K417T', 'N501Y', 'H655Y', 'T1027I', 'V1176F'	VSV pseudotype P.1 showed 4.8-fold decrease in NT50 vs wild type in sera from 9 ICU patients undergoing treatment in Germany (pre-variant infections).	False	P.1.12.1, P.1.17, P.1.14, P.1.15, P.1, P.1.12, P.1.10, P.1.7	P.1.12=True, P.1.14=True, P.1.7=True, P.1.10=True, P.1=True, P.1.12.1=True, P.1.17=True, P.1.15=True	VOC		11-Jan-2021	
p.E484K	c.G1450A	p.E484K			23012	S	S	MISSENSE	11382	172.0	11387						0	A=11382	11382	A	G	convalescent plasma escape	Liu et al. (2021)	https://www.biorxiv.org/content/10.1101/2020.11.06.372037v2		Remarkably, several of the E484 escape mutants were resistant to neutralization at the highest concentration (1:80 initial dilution) of all 4 convalescent sera tested (triplicate experiments). Against a wider panel of 16 convalescent plasma (no replicates), all but one show major resistance.	False	P.1.12.1, P.1.17, P.1.14, P.1.15, P.1, P.1.12, P.1.10, P.1.7	P.1.12=True, P.1.14=True, P.1.7=True, P.1.10=True, P.1=True, P.1.12.1=True, P.1.17=True, P.1.15=True	VOC		11-Jan-2021	
p.E484K	c.G1450A	p.E484K			23012	S	S	MISSENSE	11382	172.0	11387						0	A=11382	11382	A	G	convalescent plasma escape	Luftig et al. (2021)	https://doi.org/10.1056/nejmc2104036	'L18F', 'T20N', 'P26S', 'D138Y', 'R190S', 'K417T', 'N501Y', 'H655Y', 'T1027I', 'V1176F'	In sera from six patients collected 1 to 12 weeks post-infection with B.1, antibody titer in a microneutralization assay was on average 71.46 for P.1 virus. Compare to much stronger neutralization titers for B.1.1.7 (256) and wild type (456.1) in the same sera. 	False	P.1.12.1, P.1.17, P.1.14, P.1.15, P.1, P.1.12, P.1.10, P.1.7	P.1.12=True, P.1.14=True, P.1.7=True, P.1.10=True, P.1=True, P.1.12.1=True, P.1.17=True, P.1.15=True	VOC		11-Jan-2021	
p.E484K	c.G1450A	p.E484K			23012	S	S	MISSENSE	11382	172.0	11387						0	A=11382	11382	A	G	convalescent plasma escape	McCallum et al. (2021)	https://www.biorxiv.org/content/10.1101/2021.03.31.437925v1	'L18F', 'T20N', 'P26S', 'D138Y', 'R190S', 'K417T', 'N501Y', 'H655Y', 'T1027I', 'V1176F'	In 13 plasma collected ~1mo after B.1.1.7 infection (nursing home in Ticino, Switzerland), neutralization  reduced to undetectable levels in many plasma for P.1 pseudotyped virus, as well as WT and other VOCs.  [paper does not detail the P.1 variants used, using the most popular as a stand in]	False	P.1.12.1, P.1.17, P.1.14, P.1.15, P.1, P.1.12, P.1.10, P.1.7	P.1.12=True, P.1.14=True, P.1.7=True, P.1.10=True, P.1=True, P.1.12.1=True, P.1.17=True, P.1.15=True	VOC		11-Jan-2021	
p.E484K	c.G1450A	p.E484K			23012	S	S	MISSENSE	11382	172.0	11387						0	A=11382	11382	A	G	convalescent plasma escape	Mendes-Correa et al. (2021)	https://www.medrxiv.org/content/10.1101/2021.05.11.21256908v1	'L18F', 'T20N', 'P26S', 'D138Y', 'R190S', 'K417T', 'N501Y', 'H655Y', 'T1027I', 'V1176F'	Neutralizing antibodies that were generated following a mild infection with SARS-CoV-2 B.1.128 were effective in vitro,  and likely protective, against the SARS-CoV-2 P.1. variant in the majority of individuals based on 60 convalescent sera tested.	False	P.1.12.1, P.1.17, P.1.14, P.1.15, P.1, P.1.12, P.1.10, P.1.7	P.1.12=True, P.1.14=True, P.1.7=True, P.1.10=True, P.1=True, P.1.12.1=True, P.1.17=True, P.1.15=True	VOC		11-Jan-2021	
p.E484K	c.G1450A	p.E484K			23012	S	S	MISSENSE	11382	172.0	11387						0	A=11382	11382	A	G	convalescent plasma escape	Schmidt et al. (2021)	https://www.biorxiv.org/content/10.1101/2021.08.06.455491v1		Escape mutant found after in passage in plasma pool of 26 convalescents mean 1.5 post symptom onset.	False	P.1.12.1, P.1.17, P.1.14, P.1.15, P.1, P.1.12, P.1.10, P.1.7	P.1.12=True, P.1.14=True, P.1.7=True, P.1.10=True, P.1=True, P.1.12.1=True, P.1.17=True, P.1.15=True	VOC		11-Jan-2021	
p.E484K	c.G1450A	p.E484K			23012	S	S	MISSENSE	11382	172.0	11387						0	A=11382	11382	A	G	convalescent plasma escape	Tada et al. (2021)	https://www.biorxiv.org/content/10.1101/2021.02.05.430003v1		The only mutation in the B.1.351 lineage that appears to contribute to neutralization reduction (~1.7x across 10 convalescent sera from April 2020 infectees)	False	P.1.12.1, P.1.17, P.1.14, P.1.15, P.1, P.1.12, P.1.10, P.1.7	P.1.12=True, P.1.14=True, P.1.7=True, P.1.10=True, P.1=True, P.1.12.1=True, P.1.17=True, P.1.15=True	VOC		11-Jan-2021	
p.E484K	c.G1450A	p.E484K			23012	S	S	MISSENSE	11382	172.0	11387						0	A=11382	11382	A	G	convalescent plasma escape	Tada et al. (2021)	https://www.biorxiv.org/content/10.1101/2021.05.14.444076v1	'D614G'	Pseudotyped viruses for B.1.618 was 2.5-fold resistant to neutralization by convalescent sera compared to wild type - a finding that was similar to that of the 3-fold resistance of the South Africa B.1.351 variant using the same assay. The resistance of B.1.618 was caused by the E484K mutation, based on results from viruses pseudotyped for individual variants within B.1.618. [details on the convalescent patient sera collection are not abundantly clear in the preprint]	False	P.1.12.1, P.1.17, P.1.14, P.1.15, P.1, P.1.12, P.1.10, P.1.7	P.1.12=True, P.1.14=True, P.1.7=True, P.1.10=True, P.1=True, P.1.12.1=True, P.1.17=True, P.1.15=True	VOC		11-Jan-2021	
p.E484K	c.G1450A	p.E484K			23012	S	S	MISSENSE	11382	172.0	11387						0	A=11382	11382	A	G	convalescent plasma escape	Tang et al. (2021)	https://www.biorxiv.org/content/10.1101/2021.03.19.436183v1		As measured by surface plasmon resonance, RBD with the E484K mutation alone showed a mean 19.1x decrease in binding affinity for  six batches of hyperimmune immunoglobulin (hCoV-2IG) preparations generated from SARS-CoV-2 convalescent plasma.	False	P.1.12.1, P.1.17, P.1.14, P.1.15, P.1, P.1.12, P.1.10, P.1.7	P.1.12=True, P.1.14=True, P.1.7=True, P.1.10=True, P.1=True, P.1.12.1=True, P.1.17=True, P.1.15=True	VOC		11-Jan-2021	
p.E484K	c.G1450A	p.E484K			23012	S	S	MISSENSE	11382	172.0	11387						0	A=11382	11382	A	G	convalescent plasma escape	Tang et al. (2021)	https://www.biorxiv.org/content/10.1101/2021.03.19.436183v1	'L18F', 'T20N', 'P26S', 'D138Y', 'R190S', 'K417T', 'N501Y', 'H655Y', 'T1027I', 'V1176F'	Loss of neutralizing activity (PsVNA50 assay) using 6 hyperimmune immunoglobulin preparations from convalescent plasma was seen against P.1 (3.5-fold). Neutralization against 10 convalescent plasma was slightly poorer (3.9-fold).	False	P.1.12.1, P.1.17, P.1.14, P.1.15, P.1, P.1.12, P.1.10, P.1.7	P.1.12=True, P.1.14=True, P.1.7=True, P.1.10=True, P.1=True, P.1.12.1=True, P.1.17=True, P.1.15=True	VOC		11-Jan-2021	
p.E484K	c.G1450A	p.E484K			23012	S	S	MISSENSE	11382	172.0	11387						0	A=11382	11382	A	G	convalescent plasma escape	Wang et al. (2021)	https://www.nature.com/articles/s41586-021-03398-2		The neutralizing activity of 15/20 convalescent sera was significantly lower against this pseudotyped virus model	False	P.1.12.1, P.1.17, P.1.14, P.1.15, P.1, P.1.12, P.1.10, P.1.7	P.1.12=True, P.1.14=True, P.1.7=True, P.1.10=True, P.1=True, P.1.12.1=True, P.1.17=True, P.1.15=True	VOC		11-Jan-2021	
p.E484K	c.G1450A	p.E484K			23012	S	S	MISSENSE	11382	172.0	11387						0	A=11382	11382	A	G	convalescent plasma escape	Wang et al. (2021)	https://dx.doi.org/10.1101%2F2021.03.01.433466	'L18F', 'T20N', 'P26S', 'D138Y', 'R190S', 'K417T', 'N501Y', 'D614G', 'H655Y'	In convalescent sera one month or more post-infection in Spring 2020, an average 6.5x decrease in reciprocal ID50 value was observed  ten key point mutations in Spike in the P.1 lineage vs wildtype. A 3.4x decrease against the full P.1 type vs WA-1 was observed, with  better full P.1 ID50 reciprocal value compared to the 10-mutation model.	False	P.1.12.1, P.1.17, P.1.14, P.1.15, P.1, P.1.12, P.1.10, P.1.7	P.1.12=True, P.1.14=True, P.1.7=True, P.1.10=True, P.1=True, P.1.12.1=True, P.1.17=True, P.1.15=True	VOC		11-Jan-2021	
p.E484K	c.G1450A	p.E484K			23012	S	S	MISSENSE	11382	172.0	11387						0	A=11382	11382	A	G	convalescent plasma escape	Wibmer et al. (2021)	https://doi.org/10.1101/2021.01.18.427166		"27% of 44 early pandemic exposure convalescent plasma/sera lose all activity against a RBD triple mutant pseudovirus (RBD mutatants of the 501Y.V2 ""South African"" lineage), while only 23% retained high titres "	False	P.1.12.1, P.1.17, P.1.14, P.1.15, P.1, P.1.12, P.1.10, P.1.7	P.1.12=True, P.1.14=True, P.1.7=True, P.1.10=True, P.1=True, P.1.12.1=True, P.1.17=True, P.1.15=True	VOC		11-Jan-2021	
p.E484K	c.G1450A	p.E484K			23012	S	S	MISSENSE	11382	172.0	11387						0	A=11382	11382	A	G	convalescent plasma escape	Wibmer et al. (2021)	https://doi.org/10.1101/2021.01.18.427166		"Nearly half (21 of 44, 48%) of early pandemic exposure convalescent plasma/sera failed to neutralize the 501Y.V2 (""South African"") lineage pseudovirus construct Only 3 of 44 convascent sera (those with the highest titer, which correlated direectly with initial infection severity) had high neutralization against this 501Y.V2  PG: note that lineage variant R246I was excluded from the text in reference to these sera assays, not sure if that was an oversight."	False	P.1.12.1, P.1.17, P.1.14, P.1.15, P.1, P.1.12, P.1.10, P.1.7	P.1.12=True, P.1.14=True, P.1.7=True, P.1.10=True, P.1=True, P.1.12.1=True, P.1.17=True, P.1.15=True	VOC		11-Jan-2021	
p.E484K	c.G1450A	p.E484K			23012	S	S	MISSENSE	11382	172.0	11387						0	A=11382	11382	A	G	convalescent plasma escape	Zhou et al. (2021)	https://www.biorxiv.org/content/10.1101/2021.03.24.436620v1		"Subtype of the B.1.526 ""New York"" lineage, lentivirus pseudotyped with this mutation combination in showed 3.3x reduction in  IC50 serum dilution concentration for 6 convalescent sera."	False	P.1.12.1, P.1.17, P.1.14, P.1.15, P.1, P.1.12, P.1.10, P.1.7	P.1.12=True, P.1.14=True, P.1.7=True, P.1.10=True, P.1=True, P.1.12.1=True, P.1.17=True, P.1.15=True	VOC		11-Jan-2021	
p.E484K	c.G1450A	p.E484K			23012	S	S	MISSENSE	11382	172.0	11387						0	A=11382	11382	A	G	monoclonal antibody serial passage escape	Barnes et al. (2020)	https://www.nature.com/articles/s41586-020-2852-1_reference.pdf?origin		The engineered mutation cause 10-fold or more increase in the disassociation constant with many monoclonal antibodies (C144/C002/C121/C104/C110).	False	P.1.12.1, P.1.17, P.1.14, P.1.15, P.1, P.1.12, P.1.10, P.1.7	P.1.12=True, P.1.14=True, P.1.7=True, P.1.10=True, P.1=True, P.1.12.1=True, P.1.17=True, P.1.15=True	VOC		11-Jan-2021	
p.E484K	c.G1450A	p.E484K			23012	S	S	MISSENSE	11382	172.0	11387						0	A=11382	11382	A	G	monoclonal antibody serial passage escape	Baum et al. (2020)	http://dx.doi.org/10.1126/science.abd0831		Escape variant 100% appearance in 2 passages against Regeneron monoclonal antibody REGN10989 @ 50ug/mL (99% after one passage)	False	P.1.12.1, P.1.17, P.1.14, P.1.15, P.1, P.1.12, P.1.10, P.1.7	P.1.12=True, P.1.14=True, P.1.7=True, P.1.10=True, P.1=True, P.1.12.1=True, P.1.17=True, P.1.15=True	VOC		11-Jan-2021	
p.E484K	c.G1450A	p.E484K			23012	S	S	MISSENSE	11382	172.0	11387						0	A=11382	11382	A	G	monoclonal antibody serial passage escape	Greaney et al. (2020)	https://doi.org/10.1016/j.chom.2020.11.007		Mildly effective mutant against this position in the RBD for highly neutralizing COV2-2479 monoclonal antibody Effective mutant against this position in the RBD for highly neutralizing COV2-2050 monoclonal antibody	False	P.1.12.1, P.1.17, P.1.14, P.1.15, P.1, P.1.12, P.1.10, P.1.7	P.1.12=True, P.1.14=True, P.1.7=True, P.1.10=True, P.1=True, P.1.12.1=True, P.1.17=True, P.1.15=True	VOC		11-Jan-2021	
p.E484K	c.G1450A	p.E484K			23012	S	S	MISSENSE	11382	172.0	11387						0	A=11382	11382	A	G	monoclonal antibody serial passage escape	Starr et al. (2021)	https://www.biorxiv.org/content/10.1101/2021.02.17.431683v1		Escape mutation against monoclonal antibody LY-CoV555 (antibody that forms the basis for Eli Lilly's bamlanivimab)	False	P.1.12.1, P.1.17, P.1.14, P.1.15, P.1, P.1.12, P.1.10, P.1.7	P.1.12=True, P.1.14=True, P.1.7=True, P.1.10=True, P.1=True, P.1.12.1=True, P.1.17=True, P.1.15=True	VOC		11-Jan-2021	
p.E484K	c.G1450A	p.E484K			23012	S	S	MISSENSE	11382	172.0	11387						0	A=11382	11382	A	G	monoclonal antibody serial passage escape	Wang et al. (2021)	https://www.biorxiv.org/content/10.1101/2021.01.15.426911v2		Class 2 antibodies C627, C602, C671, C643, and class 2/3 antibody C603 selected for the emergence of the E484K mutation in vitro.	False	P.1.12.1, P.1.17, P.1.14, P.1.15, P.1, P.1.12, P.1.10, P.1.7	P.1.12=True, P.1.14=True, P.1.7=True, P.1.10=True, P.1=True, P.1.12.1=True, P.1.17=True, P.1.15=True	VOC		11-Jan-2021	
p.E484K	c.G1450A	p.E484K			23012	S	S	MISSENSE	11382	172.0	11387						0	A=11382	11382	A	G	monoclonal antibody serial passage escape	Weisblum et al. (2020)	https://www.biorxiv.org/content/10.1101/2020.07.21.214759v1.full.pdf		Strong positive selection (up to 50% of supernatant sequences) after C121 monoclonal antibody assay, decreasing in subsequent passages Strong positive selection (up to 44% of supernatant sequences) after after one round of C144 monoclonal antibody passage, then waning on subsequent passages	False	P.1.12.1, P.1.17, P.1.14, P.1.15, P.1, P.1.12, P.1.10, P.1.7	P.1.12=True, P.1.14=True, P.1.7=True, P.1.10=True, P.1=True, P.1.12.1=True, P.1.17=True, P.1.15=True	VOC		11-Jan-2021	
p.E484K	c.G1450A	p.E484K			23012	S	S	MISSENSE	11382	172.0	11387						0	A=11382	11382	A	G	outcome hazard ratio	Funk et al. (2021)	https://www.eurosurveillance.org/content/10.2807/1560-7917.ES.2021.26.16.2100348	'L18F', 'K417T', 'N501Y', 'H655Y'	On average across 7 European countries studied, using P.1 defining mutations: Significant shift to infection in those without pre-existing conditions (27.8% vs 89% for non-VOC cases). Significant increase in hospitalization rate (20% vs 7.5% for non-VOC cases). Significant increase in ICU rate (2.1% vs 0.6% for non-VOC cases). Significant increase in health care worker rate (19.8% vs 8.0% for non-VOC cases).	False	P.1.12.1, P.1.17, P.1.14, P.1.15, P.1, P.1.12, P.1.10, P.1.7	P.1.12=True, P.1.14=True, P.1.7=True, P.1.10=True, P.1=True, P.1.12.1=True, P.1.17=True, P.1.15=True	VOC		11-Jan-2021	
p.E484K	c.G1450A	p.E484K			23012	S	S	MISSENSE	11382	172.0	11387						0	A=11382	11382	A	G	outcome hazard ratio	Ribas Freitas et al. (2021)	https://www.medrxiv.org/content/10.1101/2021.04.13.21255281v1	'L18F', 'K417T', 'N501Y', 'H655Y'	In the Southern Brazilian stats of Rio Grande do Sul, comparing pre-P.1 and post-P.1 waves:  The increase in Case Fatality Rate occurred in a greatest intensity in the population between 20 and 59 years old and among patients without pre-existing risk conditions. Female 20 to 39 years old, with no pre-existing risk conditions, were at risk of death 5.65 times higher in February (95%CI 	False	P.1.12.1, P.1.17, P.1.14, P.1.15, P.1, P.1.12, P.1.10, P.1.7	P.1.12=True, P.1.14=True, P.1.7=True, P.1.10=True, P.1=True, P.1.12.1=True, P.1.17=True, P.1.15=True	VOC		11-Jan-2021	
p.E484K	c.G1450A	p.E484K			23012	S	S	MISSENSE	11382	172.0	11387						0	A=11382	11382	A	G	outcome hazard ratio	Santos de Oliviera et al. (2021)	https://www.medrxiv.org/content/10.1101/2021.03.24.21254046v1	'L18F', 'K417T', 'N501Y', 'H655Y'	In the Parana state of Brazil, patients aged 20-29 years experienced a tripling of their case fatality rate (CFR), from 0.04% to 0.13%, while those aged  30-39, 40-49, 50-59 experienced approximate CFR doubling comparing February to January in 2021. Notably,  the observed CFR increase coincided with the second consecutive month of declining number of diagnosed SARS-CoV-2 cases.  Taken together, these preliminary findings suggest significant increases in CFR in young and middle-aged adults after  identification of a novel SARS-CoV-2 strain circulating in Brazil.  [this is somewhat indirect evidence that assume greatly increasing proportion of P.1 cases in March (70%) compared to  February, but the first official ID of P.1 in Parana state (Feb 16th) may be due to testing procedures rather than actual prevalence]	False	P.1.12.1, P.1.17, P.1.14, P.1.15, P.1, P.1.12, P.1.10, P.1.7	P.1.12=True, P.1.14=True, P.1.7=True, P.1.10=True, P.1=True, P.1.12.1=True, P.1.17=True, P.1.15=True	VOC		11-Jan-2021	
p.E484K	c.G1450A	p.E484K			23012	S	S	MISSENSE	11382	172.0	11387						0	A=11382	11382	A	G	pharmaceutical effectiveness	Engelhart et al. (2021)	https://www.biorxiv.org/content/10.1101/2021.04.27.440939v1		Bamlanivimab (LY-CoV555) lost ~16x binding against this isolated mutation. Casirivimab lost ~16x binding against this isolated mutation.	False	P.1.12.1, P.1.17, P.1.14, P.1.15, P.1, P.1.12, P.1.10, P.1.7	P.1.12=True, P.1.14=True, P.1.7=True, P.1.10=True, P.1=True, P.1.12.1=True, P.1.17=True, P.1.15=True	VOC		11-Jan-2021	
p.E484K	c.G1450A	p.E484K			23012	S	S	MISSENSE	11382	172.0	11387						0	A=11382	11382	A	G	pharmaceutical effectiveness	Engelhart et al. (2021)	https://www.biorxiv.org/content/10.1101/2021.04.27.440939v1		Tixagevimab, Regdanvimab and COR-101 display reduced binding affinity to virus pseudotyped as RBD from B.1.351.	False	P.1.12.1, P.1.17, P.1.14, P.1.15, P.1, P.1.12, P.1.10, P.1.7	P.1.12=True, P.1.14=True, P.1.7=True, P.1.10=True, P.1=True, P.1.12.1=True, P.1.17=True, P.1.15=True	VOC		11-Jan-2021	
p.E484K	c.G1450A	p.E484K			23012	S	S	MISSENSE	11382	172.0	11387						0	A=11382	11382	A	G	pharmaceutical effectiveness	Engelhart et al. (2021)	https://www.biorxiv.org/content/10.1101/2021.04.27.440939v1	'K417T', 'N501Y'	Tixagevimab, Regdanvimab and COR-101 display reduced binding affinity to virus pseudotyped as RBD from P.1.	False	P.1.12.1, P.1.17, P.1.14, P.1.15, P.1, P.1.12, P.1.10, P.1.7	P.1.12=True, P.1.14=True, P.1.7=True, P.1.10=True, P.1=True, P.1.12.1=True, P.1.17=True, P.1.15=True	VOC		11-Jan-2021	
p.E484K	c.G1450A	p.E484K			23012	S	S	MISSENSE	11382	172.0	11387						0	A=11382	11382	A	G	pharmaceutical effectiveness	Engelhart et al. (2021)	https://www.biorxiv.org/content/10.1101/2021.04.27.440939v1	'N501Y'	Bamlanivimab (LY-CoV555) lost ~64x binding against this double mutation. COR-101 lost ~50x binding against this double mutation. Casirivimab lost ~250x binding against this double mutation. Estesevimab lost ~16x binding against this double mutation. Regdanvimab lost ~32x binding against this double mutation. Tixagevimab lost ~10x binding against this double mutation.	False	P.1.12.1, P.1.17, P.1.14, P.1.15, P.1, P.1.12, P.1.10, P.1.7	P.1.12=True, P.1.14=True, P.1.7=True, P.1.10=True, P.1=True, P.1.12.1=True, P.1.17=True, P.1.15=True	VOC		11-Jan-2021	
