name	nt_name	aa_name	multi_aa_name	multiaa_mutation_split_names	start	vcf_gene	chrom_region	mutation_type	dp	obs_sample_size	variant_pop_size	ps_filter	ps_exc	mat_pep_id	mat_pep_desc	mat_pep_acc	ro	ao_by_var_seq	ao	variant_seq	reference_seq	function_category	citation	citation_url	comb_mutation	function_description	heterozygosity	viral_lineages	clade_defining_status	status	voi_designation_date	voc_designation_date	vum_designation_date
c.-12_-11insAACA	c.-12_-11insAACA				28262	N	intergenic		11385	172.0	11387						11	GAACA=11374	11374	GAACA	G						False	P.1.12.1, P.1.17, P.1.14, P.1.15, P.1, P.1.12, P.1.10, P.1.7	P.1.12=True, P.1.14=True, P.1.7=True, P.1.10=True, P.1=True, P.1.12.1=True, P.1.17=True, P.1.15=True	VOC		11-Jan-2021	
c.C-25T	c.C-25T				241	orf1ab	5' UTR		11387	172.0	11387						0	T=11387	11387	T	C						False	P.1.12.1, P.1.17, P.1.14, P.1.15, P.1, P.1.12, P.1.10, P.1.7	P.1.12=True, P.1.14=True, P.1.7=True, P.1.10=True, P.1=True, P.1.12.1=True, P.1.17=True, P.1.15=True	VOC		11-Jan-2021	
c.C-36T	c.C-36T				27858	ORF8	intergenic		2	2.0	11387						0	T=2	2	T	C						False	P.1.12.1	P.1.12.1=True	VOC		11-Jan-2021	
c.G-132T	c.G-132T				27762	ORF8	intergenic		26	26.0	11387						22	T=4	4	T	G						False	P.1.17	P.1.17=False	VOC		11-Jan-2021	
c.G29764A	c.G*4380A				29764	intergenic	Stem-loop,3' UTR		133	133.0	11387						118	A=15	15	A	G						False	P.1	P.1=False	VOC		11-Jan-2021	
p.3676del	c.11023_11031delTCTGGTTTT	p.S3675_F3677del	S3675_F3677del	'S3675del', 'F3677del'	11287	orf1ab	ORF1ab		11389	344.0	11387			nsp6	nsp6_TM, putative transmembrane domain, produced by both pp1a and pp1ab	YP_009725302.1	0	G=11389	11389	G	GTCTGGTTTT						False	P.1.12.1, P.1.17, P.1.14, P.1.15, P.1, P.1.12, P.1.10, P.1.7	P.1.12=True, P.1.14=True, P.1.7=True, P.1.10=True, P.1=True, P.1.12.1=True, P.1.17=True, P.1.15=True	VOC		11-Jan-2021	
p.A3143V	c.C9428T	p.A3143V			9693	orf1ab	ORF1ab	MISSENSE	2	2.0	11387			nsp4	nsp4B_TM, contains transmembrane domain 2 (TM2), produced by both pp1a and pp1ab	YP_009725300.1	1	T=1	1	T	C						False	P.1.7	P.1.7=False	VOC		11-Jan-2021	
p.A35A	c.G105T	p.A35A			28378	N	N	SILENT	137	137.0	11387						106	T=31	31	T	G						False	P.1.12, P.1	P.1=False, P.1.12=False	VOC		11-Jan-2021	
p.A3648T	c.G10942A	p.A3648T			11207	orf1ab	ORF1ab	MISSENSE	4	4.0	11387			nsp6	nsp6_TM, putative transmembrane domain, produced by both pp1a and pp1ab	YP_009725302.1	3	A=1	1	A	G						False	P.1.12	P.1.12=False	VOC		11-Jan-2021	
p.A4285V	c.C12854T	p.A4285V			13119	orf1ab	ORF1ab	MISSENSE	26	26.0	11387			nsp10	nsp10_CysHis, formerly known as growth-factor-like protein (GFL), produced by both pp1a and pp1ab	YP_009725306.1	9	T=17	17	T	C						False	P.1.17	P.1.17=False	VOC		11-Jan-2021	
p.A4835A	c.T14505G	p.A4835A			14769	orf1ab	ORF1ab	SILENT	2	2.0	11387			RNA-dependent RNA polymerase	nsp12, NiRAN and RdRp, produced by pp1ab only	YP_009725307.1	0	G=2	2	G	T						False	P.1.12.1	P.1.12.1=True	VOC		11-Jan-2021	
p.A735V	c.C2204T	p.A735V			2469	orf1ab	ORF1ab	MISSENSE	26	26.0	11387			nsp2	produced by both pp1a and pp1ab	YP_009725298.1	23	T=3	3	T	C						False	P.1.17	P.1.17=False	VOC		11-Jan-2021	
p.A859V	c.C2576T	p.A859V			2841	orf1ab	ORF1ab	MISSENSE	4	4.0	11387			nsp3	former nsp1, conserved domains are: N-terminal acidic (Ac), predicted phosphoesterase, papain-like proteinase, Y-domain, transmembrane domain 1 (TM1), adenosine diphosphate-ribose 1''-phosphatase (ADRP), produced by both pp1a and pp1ab	YP_009725299.1	1	T=3	3	T	C						False	P.1.10	P.1.10=False	VOC		11-Jan-2021	
p.A879S	c.G2635T	p.A879S			24197	S	S	MISSENSE	4	4.0	11387						3	T=1	1	T	G						False	P.1.10	P.1.10=False	VOC		11-Jan-2021	
p.C37F	c.G110T	p.C37F			28003	ORF8	ORF8	MISSENSE	4	4.0	11387						3	T=1	1	T	G						False	P.1.12	P.1.12=False	VOC		11-Jan-2021	
p.C5343C	c.C16029T	p.C5343C			16293	orf1ab	ORF1ab	SILENT	2	2.0	11387			helicase	nsp13_ZBD, nsp13_TB, and nsp_HEL1core, zinc-binding domain (ZD), NTPase/helicase domain (HEL), RNA 5'-triphosphatase, produced by pp1ab only	YP_009725308.1	0	T=2	2	T	C						False	P.1.7	P.1.7=True	VOC		11-Jan-2021	
p.C657Y	c.G1970A	p.C657Y			2235	orf1ab	ORF1ab	MISSENSE	2	2.0	11387			nsp2	produced by both pp1a and pp1ab	YP_009725298.1	0	A=2	2	A	G						False	P.1.12.1	P.1.12.1=True	VOC		11-Jan-2021	
p.D138Y	c.G412T	p.D138Y			21974	S	S	MISSENSE	11383	172.0	11387						0	T=11383	11383	T	G	ACE2 receptor binding affinity	Gong et al. (2021)	https://www.biorxiv.org/content/10.1101/2021.08.04.455140v1	'D614G'	Using flow cytometry and ACE2 ectodomains-Fc portion IgG complex, this variant showed a 1.32x increase in binding (KD) relative to D614G.	False	P.1.12.1, P.1.17, P.1.14, P.1.15, P.1, P.1.12, P.1.10, P.1.7	P.1.12=True, P.1.14=True, P.1.7=True, P.1.10=True, P.1=True, P.1.12.1=True, P.1.17=True, P.1.15=True	VOC		11-Jan-2021	
p.D138Y	c.G412T	p.D138Y			21974	S	S	MISSENSE	11383	172.0	11387						0	T=11383	11383	T	G	ACE2 receptor binding affinity	Gong et al. (2021)	https://www.biorxiv.org/content/10.1101/2021.08.04.455140v1	'D614G', 'L18F', 'T20N', 'P26S', 'R190S', 'K417T', 'E484K', 'N501Y', 'H655Y', 'T1027I'	Using flow cytometry and ACE2 ectodomains-Fc portion IgG complex, this variant combination (representing P.1 aka Gamma)  showed a 4.24x increase in binding (KD) relative to D614G.	False	P.1.12.1, P.1.17, P.1.14, P.1.15, P.1, P.1.12, P.1.10, P.1.7	P.1.12=True, P.1.14=True, P.1.7=True, P.1.10=True, P.1=True, P.1.12.1=True, P.1.17=True, P.1.15=True	VOC		11-Jan-2021	
p.D138Y	c.G412T	p.D138Y			21974	S	S	MISSENSE	11383	172.0	11387						0	T=11383	11383	T	G	anthropozoonotic events	Montagutelli et al. (2021)	https://www.biorxiv.org/content/10.1101/2021.03.18.436013v1	'L18F', 'T20N', 'P26S', 'R190S', 'K417T', 'E484K', 'N501Y', 'D614G', 'H655Y', 'T1027I', 'V1176F'	Unlike wild type or B.1.1.7, P.1 lineage virus was able to infect and replicate in common lab mouse strains, with high titer.	False	P.1.12.1, P.1.17, P.1.14, P.1.15, P.1, P.1.12, P.1.10, P.1.7	P.1.12=True, P.1.14=True, P.1.7=True, P.1.10=True, P.1=True, P.1.12.1=True, P.1.17=True, P.1.15=True	VOC		11-Jan-2021	
p.D138Y	c.G412T	p.D138Y			21974	S	S	MISSENSE	11383	172.0	11387						0	T=11383	11383	T	G	antibody epitope effects	Chen et al. (2021)	https://www.nature.com/articles/s41591-021-01294-w 	'L18F', 'T20N', 'P26S', 'R190S', 'K417T', 'E484K', 'N501Y', 'D614G', 'H655Y', 'T1027I', 'V1176F'	B.1.1.248 variant constellation ablates Class 1 receptor-binding-motif targeting antibodies COV2-2050, 1B07. B.1.1.248 variant constellation ablates Class 3 N-terminal domain targeting antibody COV2-2676.	False	P.1.12.1, P.1.17, P.1.14, P.1.15, P.1, P.1.12, P.1.10, P.1.7	P.1.12=True, P.1.14=True, P.1.7=True, P.1.10=True, P.1=True, P.1.12.1=True, P.1.17=True, P.1.15=True	VOC		11-Jan-2021	
p.D138Y	c.G412T	p.D138Y			21974	S	S	MISSENSE	11383	172.0	11387						0	T=11383	11383	T	G	antibody epitope effects	Dejnirattisai et al. (2021)	https://doi.org/10.1016/j.cell.2021.03.055	'L18F', 'T20N', 'P26S', 'R190S'	"The neutralization titer of NTD-binding mAb159 was 133-fold reduced on P.1 compared to Victoria (~wild type), with only 64% neutralization at 10 μg/mL.  Residues 20, 18, and 138 form a cluster underlying the 245–259 loop, which inserts into a groove between the light and heavy chains of Fab 159. In addition, the N-terminal residues preceding residue 18 interact with the antibody and may be perturbed.  Given that there is likely a single supersite (""i"") for potent NTD-binding antibodies, the binding of many of these are likely affected. Using 20 potent (primaruly anti-RBD) antibodies, neutralization was measured by a focus reduction neutralization test (FRNT) and compared with  neutralization of Victoria (~wild type) and variants B.1.1.7 and B.1.351. Compared to Victoria neutralization by the mAbs was significantly impacted by P.1,  with 12/20 showing > 10-fold reduction in FRNT50 titer and a number showing complete knockout of activity. The results with P.1 showed a  greater impact compared to B.1.1.7 but were, as expected, similar to those with B.1.351."	False	P.1.12.1, P.1.17, P.1.14, P.1.15, P.1, P.1.12, P.1.10, P.1.7	P.1.12=True, P.1.14=True, P.1.7=True, P.1.10=True, P.1=True, P.1.12.1=True, P.1.17=True, P.1.15=True	VOC		11-Jan-2021	
p.D138Y	c.G412T	p.D138Y			21974	S	S	MISSENSE	11383	172.0	11387						0	T=11383	11383	T	G	antibody epitope effects	Wang et al. (2021)	https://dx.doi.org/10.1101%2F2021.03.01.433466	'L18F', 'T20N', 'P26S', 'R190S', 'K417T', 'E484K', 'N501Y', 'D614G', 'H655Y'	Amongst RBD-targeting Emergency Use Authorized monoclonal antibody treatments CB6, LY-CoV555 and REGN10933 show abrogated neutralization activity against the ten key point mutations in Spike in the P.1 lineage vs wildtype or WA-1, but REGN10987 activity remains strong. RBD-targeting monoclonal antibodies 2-15 and C121 show abrogated neutralization activity against the ten key point mutations in Spike in the P.1 lineage vs wildtype or WA-1. N terminal domain targeting monoclonal antibodies 5-7, 4-8, 4-18 and 2-17 have abrogated neutralization activity against the ten key point mutations in Spike in the P.1 lineage vs wildtype or WA-1.	False	P.1.12.1, P.1.17, P.1.14, P.1.15, P.1, P.1.12, P.1.10, P.1.7	P.1.12=True, P.1.14=True, P.1.7=True, P.1.10=True, P.1=True, P.1.12.1=True, P.1.17=True, P.1.15=True	VOC		11-Jan-2021	
p.D138Y	c.G412T	p.D138Y			21974	S	S	MISSENSE	11383	172.0	11387						0	T=11383	11383	T	G	convalescent plasma binding	Gong et al. (2021)	https://www.biorxiv.org/content/10.1101/2021.08.04.455140v1	'D614G'	1.56x decrease in Spike binding (relative to D614G alone) by 5 plasma collected 8 months post-symptom-onset.	False	P.1.12.1, P.1.17, P.1.14, P.1.15, P.1, P.1.12, P.1.10, P.1.7	P.1.12=True, P.1.14=True, P.1.7=True, P.1.10=True, P.1=True, P.1.12.1=True, P.1.17=True, P.1.15=True	VOC		11-Jan-2021	
p.D138Y	c.G412T	p.D138Y			21974	S	S	MISSENSE	11383	172.0	11387						0	T=11383	11383	T	G	convalescent plasma binding	Gong et al. (2021)	https://www.biorxiv.org/content/10.1101/2021.08.04.455140v1	'D614G', 'L18F', 'T20N', 'P26S', 'R190S', 'K417T', 'E484K', 'N501Y', 'H655Y', 'T1027I'	This variant combination (representing P.1 aka Gamma)  showed a 1.3x decrease in Spike binding (relative to D614G alone) by 5 plasma collected 8 months post-symptom-onset.	False	P.1.12.1, P.1.17, P.1.14, P.1.15, P.1, P.1.12, P.1.10, P.1.7	P.1.12=True, P.1.14=True, P.1.7=True, P.1.10=True, P.1=True, P.1.12.1=True, P.1.17=True, P.1.15=True	VOC		11-Jan-2021	
p.D138Y	c.G412T	p.D138Y			21974	S	S	MISSENSE	11383	172.0	11387						0	T=11383	11383	T	G	convalescent plasma escape	Chen et al. (2021)	https://www.nature.com/articles/s41591-021-01294-w 	'L18F', 'T20N', 'P26S', 'R190S', 'K417T', 'E484K', 'N501Y', 'D614G', 'H655Y', 'T1027I', 'V1176F'	B.1.1.248 variant constellation in 10 convalescent human sera ~1mo post infection had mild to moderate resistence against most samples, P	False	P.1.12.1, P.1.17, P.1.14, P.1.15, P.1, P.1.12, P.1.10, P.1.7	P.1.12=True, P.1.14=True, P.1.7=True, P.1.10=True, P.1=True, P.1.12.1=True, P.1.17=True, P.1.15=True	VOC		11-Jan-2021	
p.D138Y	c.G412T	p.D138Y			21974	S	S	MISSENSE	11383	172.0	11387						0	T=11383	11383	T	G	convalescent plasma escape	Chen et al. (2021)	https://www.nature.com/articles/s41591-021-01294-w 	'L18F', 'T20N', 'P26S', 'R190S', 'K417T', 'E484K', 'N501Y', 'D614G', 'H655Y', 'T1027I', 'V1176F'	B.1.1.7 variant constellation two-tailed Wilcoxon matched-pairs signed-rank test against 10 convalescent sera P	False	P.1.12.1, P.1.17, P.1.14, P.1.15, P.1, P.1.12, P.1.10, P.1.7	P.1.12=True, P.1.14=True, P.1.7=True, P.1.10=True, P.1=True, P.1.12.1=True, P.1.17=True, P.1.15=True	VOC		11-Jan-2021	
p.D138Y	c.G412T	p.D138Y			21974	S	S	MISSENSE	11383	172.0	11387						0	T=11383	11383	T	G	convalescent plasma escape	Hoffman et al. (2021)	https://doi.org/10.1016/j.cell.2021.03.036	'L18F', 'T20N', 'P26S', 'R190S', 'K417T', 'E484K', 'N501Y', 'H655Y', 'T1027I', 'V1176F'	VSV pseudotype P.1 showed 4.8-fold decrease in NT50 vs wild type in sera from 9 ICU patients undergoing treatment in Germany (pre-variant infections).	False	P.1.12.1, P.1.17, P.1.14, P.1.15, P.1, P.1.12, P.1.10, P.1.7	P.1.12=True, P.1.14=True, P.1.7=True, P.1.10=True, P.1=True, P.1.12.1=True, P.1.17=True, P.1.15=True	VOC		11-Jan-2021	
p.D138Y	c.G412T	p.D138Y			21974	S	S	MISSENSE	11383	172.0	11387						0	T=11383	11383	T	G	convalescent plasma escape	Luftig et al. (2021)	https://doi.org/10.1056/nejmc2104036	'L18F', 'T20N', 'P26S', 'R190S', 'K417T', 'E484K', 'N501Y', 'H655Y', 'T1027I', 'V1176F'	In sera from six patients collected 1 to 12 weeks post-infection with B.1, antibody titer in a microneutralization assay was on average 71.46 for P.1 virus. Compare to much stronger neutralization titers for B.1.1.7 (256) and wild type (456.1) in the same sera. 	False	P.1.12.1, P.1.17, P.1.14, P.1.15, P.1, P.1.12, P.1.10, P.1.7	P.1.12=True, P.1.14=True, P.1.7=True, P.1.10=True, P.1=True, P.1.12.1=True, P.1.17=True, P.1.15=True	VOC		11-Jan-2021	
p.D138Y	c.G412T	p.D138Y			21974	S	S	MISSENSE	11383	172.0	11387						0	T=11383	11383	T	G	convalescent plasma escape	McCallum et al. (2021)	https://www.biorxiv.org/content/10.1101/2021.03.31.437925v1	'L18F', 'T20N', 'P26S', 'R190S', 'K417T', 'E484K', 'N501Y', 'H655Y', 'T1027I', 'V1176F'	In 13 plasma collected ~1mo after B.1.1.7 infection (nursing home in Ticino, Switzerland), neutralization  reduced to undetectable levels in many plasma for P.1 pseudotyped virus, as well as WT and other VOCs.  [paper does not detail the P.1 variants used, using the most popular as a stand in]	False	P.1.12.1, P.1.17, P.1.14, P.1.15, P.1, P.1.12, P.1.10, P.1.7	P.1.12=True, P.1.14=True, P.1.7=True, P.1.10=True, P.1=True, P.1.12.1=True, P.1.17=True, P.1.15=True	VOC		11-Jan-2021	
p.D138Y	c.G412T	p.D138Y			21974	S	S	MISSENSE	11383	172.0	11387						0	T=11383	11383	T	G	convalescent plasma escape	Mendes-Correa et al. (2021)	https://www.medrxiv.org/content/10.1101/2021.05.11.21256908v1	'L18F', 'T20N', 'P26S', 'R190S', 'K417T', 'E484K', 'N501Y', 'H655Y', 'T1027I', 'V1176F'	Neutralizing antibodies that were generated following a mild infection with SARS-CoV-2 B.1.128 were effective in vitro,  and likely protective, against the SARS-CoV-2 P.1. variant in the majority of individuals based on 60 convalescent sera tested.	False	P.1.12.1, P.1.17, P.1.14, P.1.15, P.1, P.1.12, P.1.10, P.1.7	P.1.12=True, P.1.14=True, P.1.7=True, P.1.10=True, P.1=True, P.1.12.1=True, P.1.17=True, P.1.15=True	VOC		11-Jan-2021	
p.D138Y	c.G412T	p.D138Y			21974	S	S	MISSENSE	11383	172.0	11387						0	T=11383	11383	T	G	convalescent plasma escape	Tang et al. (2021)	https://www.biorxiv.org/content/10.1101/2021.03.19.436183v1	'L18F', 'T20N', 'P26S', 'R190S', 'K417T', 'E484K', 'N501Y', 'H655Y', 'T1027I', 'V1176F'	Loss of neutralizing activity (PsVNA50 assay) using 6 hyperimmune immunoglobulin preparations from convalescent plasma was seen against P.1 (3.5-fold). Neutralization against 10 convalescent plasma was slightly poorer (3.9-fold).	False	P.1.12.1, P.1.17, P.1.14, P.1.15, P.1, P.1.12, P.1.10, P.1.7	P.1.12=True, P.1.14=True, P.1.7=True, P.1.10=True, P.1=True, P.1.12.1=True, P.1.17=True, P.1.15=True	VOC		11-Jan-2021	
p.D138Y	c.G412T	p.D138Y			21974	S	S	MISSENSE	11383	172.0	11387						0	T=11383	11383	T	G	convalescent plasma escape	Wang et al. (2021)	https://dx.doi.org/10.1101%2F2021.03.01.433466	'L18F', 'T20N', 'P26S', 'R190S', 'K417T', 'E484K', 'N501Y', 'D614G', 'H655Y'	In convalescent sera one month or more post-infection in Spring 2020, an average 6.5x decrease in reciprocal ID50 value was observed  ten key point mutations in Spike in the P.1 lineage vs wildtype. A 3.4x decrease against the full P.1 type vs WA-1 was observed, with  better full P.1 ID50 reciprocal value compared to the 10-mutation model.	False	P.1.12.1, P.1.17, P.1.14, P.1.15, P.1, P.1.12, P.1.10, P.1.7	P.1.12=True, P.1.14=True, P.1.7=True, P.1.10=True, P.1=True, P.1.12.1=True, P.1.17=True, P.1.15=True	VOC		11-Jan-2021	
p.D138Y	c.G412T	p.D138Y			21974	S	S	MISSENSE	11383	172.0	11387						0	T=11383	11383	T	G	pharmaceutical effectiveness	Hoffman et al. (2021)	https://doi.org/10.1016/j.cell.2021.03.036	'L18F', 'T20N', 'P26S', 'R190S', 'K417T', 'E484K', 'N501Y', 'H655Y', 'T1027I', 'V1176F'	VSV pseudotype P.1 entry mediated by the S proteins of the P.1 variant was completely resistant to blocking by REGN10989 and Bamlanivimab. Cell fusion proficiency was slight impaired. Entry driven by the S proteins of the B.1.351 was partially resistant against Casirivimab.	False	P.1.12.1, P.1.17, P.1.14, P.1.15, P.1, P.1.12, P.1.10, P.1.7	P.1.12=True, P.1.14=True, P.1.7=True, P.1.10=True, P.1=True, P.1.12.1=True, P.1.17=True, P.1.15=True	VOC		11-Jan-2021	
p.D138Y	c.G412T	p.D138Y			21974	S	S	MISSENSE	11383	172.0	11387						0	T=11383	11383	T	G	reinfection	Malta Romano et al. (2021)	https://doi.org/10.1590/s1678-9946202163036	'L18F', 'T20N', 'P26S', 'R190S', 'K417T', 'E484K', 'N501Y', 'D614G', 'H655Y', 'T1027I'	After a 128 day interval, a patient in Sao Paulo State, Brazil reinfected with P.1 (first episode likely predates P.1 emergence). Both cases were fairly mild (difficulty breathing, tiredness, dizziness and fatigue).	False	P.1.12.1, P.1.17, P.1.14, P.1.15, P.1, P.1.12, P.1.10, P.1.7	P.1.12=True, P.1.14=True, P.1.7=True, P.1.10=True, P.1=True, P.1.12.1=True, P.1.17=True, P.1.15=True	VOC		11-Jan-2021	
p.D138Y	c.G412T	p.D138Y			21974	S	S	MISSENSE	11383	172.0	11387						0	T=11383	11383	T	G	trafficking	Esclera et al. (2021)	https://www.biorxiv.org/content/10.1101/2021.08.05.455290v1	'L18F', 'T20N', 'P26S', 'R190S', 'K417T', 'E484K', 'N501Y', 'D614G', 'H655Y', 'T1027I'	~6x cleavage of S2 relative to WA1 (D614G) wildtype by Gamma variant as measured by mass spectrometry of Vero-TMPRSS culture  [no mutations directly at furin cleavage site, but H655Y is upstream] Compare to 4.5x or less for variants of concern with  direct furin clevage site mutations.	False	P.1.12.1, P.1.17, P.1.14, P.1.15, P.1, P.1.12, P.1.10, P.1.7	P.1.12=True, P.1.14=True, P.1.7=True, P.1.10=True, P.1=True, P.1.12.1=True, P.1.17=True, P.1.15=True	VOC		11-Jan-2021	
p.D138Y	c.G412T	p.D138Y			21974	S	S	MISSENSE	11383	172.0	11387						0	T=11383	11383	T	G	trafficking	Hoffman et al. (2021)	https://doi.org/10.1016/j.cell.2021.03.036	'L18F', 'T20N', 'P26S', 'R190S', 'K417T', 'E484K', 'N501Y', 'H655Y', 'T1027I', 'V1176F'	VSV pseudotype P.1 showed slight decrease in cell entry relative to wild type in 262T and 263T-ACE2 (kidney) cell lines. Cell fusion proficiency was slight impaired.	False	P.1.12.1, P.1.17, P.1.14, P.1.15, P.1, P.1.12, P.1.10, P.1.7	P.1.12=True, P.1.14=True, P.1.7=True, P.1.10=True, P.1=True, P.1.12.1=True, P.1.17=True, P.1.15=True	VOC		11-Jan-2021	
p.D138Y	c.G412T	p.D138Y			21974	S	S	MISSENSE	11383	172.0	11387						0	T=11383	11383	T	G	transmissibility	Stefanelli et al. (2021)	https://www.medrxiv.org/content/10.1101/2021.04.06.21254923v1	'L18F', 'T20N', 'P26S', 'R190S', 'E484K', 'N501Y', 'D614G', 'H655Y'	The relative transmissibility of P.1 estimated at the national level (Italy) varied according to the assumed  degree of cross-protection granted by infection with other lineages and ranged from 1.12 (95%CI 1.03-1.23) in the  case of complete immune evasion by P.1 to 1.39 (95%CI 1.26-1.56) in the case of complete cross-protection. PG: variant list has been abbreviated due to mixed K417 bases in this lineage, potential miscalls of deletions	False	P.1.12.1, P.1.17, P.1.14, P.1.15, P.1, P.1.12, P.1.10, P.1.7	P.1.12=True, P.1.14=True, P.1.7=True, P.1.10=True, P.1=True, P.1.12.1=True, P.1.17=True, P.1.15=True	VOC		11-Jan-2021	
p.D138Y	c.G412T	p.D138Y			21974	S	S	MISSENSE	11383	172.0	11387						0	T=11383	11383	T	G	vaccine neutralization efficacy	Alenquer et al. (2021)	https://www.biorxiv.org/content/10.1101/2021.04.22.441007v1	'L18F', 'T20N', 'P26S', 'R190S', 'K417T', 'E484K', 'N501Y', 'H655Y', 'T1027I'	Using P.1 defining mutations for Spike, observed 4x average decrease in neutralization efficiency  (but still relevant titres) for sera from 10 BNT162b2 vaccinees 12 days after second dose, but only one  relevant titre 12 days after first dose. Compares unfavorably to wild type or B.1.1.7 titres.	False	P.1.12.1, P.1.17, P.1.14, P.1.15, P.1, P.1.12, P.1.10, P.1.7	P.1.12=True, P.1.14=True, P.1.7=True, P.1.10=True, P.1=True, P.1.12.1=True, P.1.17=True, P.1.15=True	VOC		11-Jan-2021	
p.D138Y	c.G412T	p.D138Y			21974	S	S	MISSENSE	11383	172.0	11387						0	T=11383	11383	T	G	vaccine neutralization efficacy	Andrade et al. (2021)	https://www.biorxiv.org/content/10.1101/2021.04.14.439719v1	'L18F', 'T20N', 'P26S', 'R190S', 'K417T', 'E484K', 'N501Y', 'H655Y', 'T1027I'	In human sera 8 weeks post-vaccination with INO-4800, a ~2-fold reduction in P.1 neutralization was observed.	False	P.1.12.1, P.1.17, P.1.14, P.1.15, P.1, P.1.12, P.1.10, P.1.7	P.1.12=True, P.1.14=True, P.1.7=True, P.1.10=True, P.1=True, P.1.12.1=True, P.1.17=True, P.1.15=True	VOC		11-Jan-2021	
p.D138Y	c.G412T	p.D138Y			21974	S	S	MISSENSE	11383	172.0	11387						0	T=11383	11383	T	G	vaccine neutralization efficacy	Chen et al. (2021)	https://www.nature.com/articles/s41591-021-01294-w 	'L18F', 'T20N', 'P26S', 'R190S', 'K417T', 'E484K', 'N501Y', 'D614G', 'H655Y', 'T1027I', 'V1176F'	The neutralizing activity of vaccine was slightly lower against B.1.1.248 variant constellation in sera tested from most of the 15 patients with  the BNT162b2 mRNA vaccine. (Fig. 4)	False	P.1.12.1, P.1.17, P.1.14, P.1.15, P.1, P.1.12, P.1.10, P.1.7	P.1.12=True, P.1.14=True, P.1.7=True, P.1.10=True, P.1=True, P.1.12.1=True, P.1.17=True, P.1.15=True	VOC		11-Jan-2021	
p.D138Y	c.G412T	p.D138Y			21974	S	S	MISSENSE	11383	172.0	11387						0	T=11383	11383	T	G	vaccine neutralization efficacy	Choi et al. (2021)	https://www.biorxiv.org/content/10.1101/2021.06.28.449914v1	'L18F', 'T20N', 'P26S', 'R190S', 'K417T', 'E484K', 'N501Y', 'H655Y', 'T1027I', 'V1176F'	Neutralization efficiency (ID50) against P.1 reduced 3.2x relative to D614G wildtype using pseudotyped VSV assay on 8 Moderna vaccinee sera one week post-booster.	False	P.1.12.1, P.1.17, P.1.14, P.1.15, P.1, P.1.12, P.1.10, P.1.7	P.1.12=True, P.1.14=True, P.1.7=True, P.1.10=True, P.1=True, P.1.12.1=True, P.1.17=True, P.1.15=True	VOC		11-Jan-2021	
p.D138Y	c.G412T	p.D138Y			21974	S	S	MISSENSE	11383	172.0	11387						0	T=11383	11383	T	G	vaccine neutralization efficacy	Gallagher et al. (2021)	https://www.biorxiv.org/content/10.1101/2021.05.03.442455v1	'L18F', 'T20N', 'P26S', 'R190S', 'K417T', 'E484K', 'N501Y', 'D614G', 'H655Y', 'T1027I', 'V1176F'	ELISpot assays show T cell neutralization reduced by 16.6% in this B.1.1.248 pseudotype relative to wild type in 18-20 pooled patient samples post second mRNA vaccine dose, with no significant difference between Pfizer and Moderna cohorts. Reduction was stronger in the S1 subunit than S2 (separate peptide pools were used).	False	P.1.12.1, P.1.17, P.1.14, P.1.15, P.1, P.1.12, P.1.10, P.1.7	P.1.12=True, P.1.14=True, P.1.7=True, P.1.10=True, P.1=True, P.1.12.1=True, P.1.17=True, P.1.15=True	VOC		11-Jan-2021	
p.D138Y	c.G412T	p.D138Y			21974	S	S	MISSENSE	11383	172.0	11387						0	T=11383	11383	T	G	vaccine neutralization efficacy	Garcia-Beltran et al. (2021)	https://doi.org/10.1016/j.cell.2021.03.013	'L18F', 'T20N', 'P26S', 'R190S', 'K417T', 'E484K', 'N501Y', 'D614G', 'H655Y', 'T1027I', 'V1176F'	Pseudotyped P.1 virus has reduced neutralization activity vs wild type: 6.7x (30 sera Pfizer median 9 days post 2nd dose)  and 4.5x (35 sera Moderna median 18 days post 2nd dose). This was significant by ANOVA.	False	P.1.12.1, P.1.17, P.1.14, P.1.15, P.1, P.1.12, P.1.10, P.1.7	P.1.12=True, P.1.14=True, P.1.7=True, P.1.10=True, P.1=True, P.1.12.1=True, P.1.17=True, P.1.15=True	VOC		11-Jan-2021	
p.D138Y	c.G412T	p.D138Y			21974	S	S	MISSENSE	11383	172.0	11387						0	T=11383	11383	T	G	vaccine neutralization efficacy	Gong et al. (2021)	https://www.biorxiv.org/content/10.1101/2021.08.04.455140v1	'L18F', 'T20N', 'P26S', 'R190S', 'K417T', 'E484K', 'N501Y', 'H655Y', 'T1027I', 'V1176F'	1.15x *increase* in neutralization (ID50) in sera 3 weeks after one dose of Pfizer/BioNTech BNT162b2 (up to 5 naive and post infection vaccinees)	False	P.1.12.1, P.1.17, P.1.14, P.1.15, P.1, P.1.12, P.1.10, P.1.7	P.1.12=True, P.1.14=True, P.1.7=True, P.1.10=True, P.1=True, P.1.12.1=True, P.1.17=True, P.1.15=True	VOC		11-Jan-2021	
p.D138Y	c.G412T	p.D138Y			21974	S	S	MISSENSE	11383	172.0	11387						0	T=11383	11383	T	G	vaccine neutralization efficacy	Hitchlings et al. (2021)	https://www.medrxiv.org/content/10.1101/2021.04.07.21255081v1	'L18F', 'T20N', 'P26S', 'R190S', 'K417T', 'E484K', 'N501Y', 'H655Y', 'T1027I'	Among 46,884 HCWs in Manaus, Brazil vaccinated with at least one dose of CoronaVac, a 0.50-fold reduction (adjusted vaccine  effectiveness, 49.6%: 95% CI, 11.3 - 71.4) in the odds of  symptomatic SARS-CoV-2 infection was observed during the period 14 days or more after receiving the first dose. Estimated vaccine effectiveness of at least one dose against any SARS-CoV-2 infection was 35.1% (95% CI, −6.6 - 60.5) in the same time period.	False	P.1.12.1, P.1.17, P.1.14, P.1.15, P.1, P.1.12, P.1.10, P.1.7	P.1.12=True, P.1.14=True, P.1.7=True, P.1.10=True, P.1=True, P.1.12.1=True, P.1.17=True, P.1.15=True	VOC		11-Jan-2021	
p.D138Y	c.G412T	p.D138Y			21974	S	S	MISSENSE	11383	172.0	11387						0	T=11383	11383	T	G	vaccine neutralization efficacy	Hoffman et al. (2021)	https://doi.org/10.1016/j.cell.2021.03.036	'L18F', 'T20N', 'P26S', 'R190S', 'K417T', 'E484K', 'N501Y', 'H655Y', 'T1027I', 'V1176F'	VSV pseudotype P.1 showed 5.12-fold reduction in neutralization efficiency vs wild type in 15 Pfizer BNT162b2 vaccinee sera 13-15 days post second dose. Cell fusion proficiency was slight impaired.	False	P.1.12.1, P.1.17, P.1.14, P.1.15, P.1, P.1.12, P.1.10, P.1.7	P.1.12=True, P.1.14=True, P.1.7=True, P.1.10=True, P.1=True, P.1.12.1=True, P.1.17=True, P.1.15=True	VOC		11-Jan-2021	
