name	nt_name	aa_name	multi_aa_name	multiaa_mutation_split_names	start	vcf_gene	chrom_region	mutation_type	dp	obs_sample_size	variant_pop_size	ps_filter	ps_exc	mat_pep_id	mat_pep_desc	mat_pep_acc	ro	ao_by_var_seq	ao	variant_seq	reference_seq	function_category	citation	citation_url	comb_mutation	function_description	heterozygosity	viral_lineages	clade_defining_status	status	voi_designation_date	voc_designation_date	vum_designation_date
p.P26S	c.C76T	p.P26S			21638	S	S	MISSENSE	11383	172.0	11387						0	T=11383	11383	T	C	convalescent plasma binding	Gong et al. (2021)	https://www.biorxiv.org/content/10.1101/2021.08.04.455140v1	'D614G', 'L18F', 'T20N', 'D138Y', 'R190S', 'K417T', 'E484K', 'N501Y', 'H655Y', 'T1027I'	This variant combination (representing P.1 aka Gamma)  showed a 1.3x decrease in Spike binding (relative to D614G alone) by 5 plasma collected 8 months post-symptom-onset.	False	P.1.12.1, P.1.17, P.1.14, P.1.15, P.1, P.1.12, P.1.10, P.1.7	P.1.12=True, P.1.14=True, P.1.7=True, P.1.10=True, P.1=True, P.1.12.1=True, P.1.17=True, P.1.15=True	VOC		11-Jan-2021	
p.P26S	c.C76T	p.P26S			21638	S	S	MISSENSE	11383	172.0	11387						0	T=11383	11383	T	C	convalescent plasma escape	Chen et al. (2021)	https://www.nature.com/articles/s41591-021-01294-w 	'L18F', 'T20N', 'D138Y', 'R190S', 'K417T', 'E484K', 'N501Y', 'D614G', 'H655Y', 'T1027I', 'V1176F'	B.1.1.248 variant constellation in 10 convalescent human sera ~1mo post infection had mild to moderate resistence against most samples, P	False	P.1.12.1, P.1.17, P.1.14, P.1.15, P.1, P.1.12, P.1.10, P.1.7	P.1.12=True, P.1.14=True, P.1.7=True, P.1.10=True, P.1=True, P.1.12.1=True, P.1.17=True, P.1.15=True	VOC		11-Jan-2021	
p.P26S	c.C76T	p.P26S			21638	S	S	MISSENSE	11383	172.0	11387						0	T=11383	11383	T	C	convalescent plasma escape	Chen et al. (2021)	https://www.nature.com/articles/s41591-021-01294-w 	'L18F', 'T20N', 'D138Y', 'R190S', 'K417T', 'E484K', 'N501Y', 'D614G', 'H655Y', 'T1027I', 'V1176F'	B.1.1.7 variant constellation two-tailed Wilcoxon matched-pairs signed-rank test against 10 convalescent sera P	False	P.1.12.1, P.1.17, P.1.14, P.1.15, P.1, P.1.12, P.1.10, P.1.7	P.1.12=True, P.1.14=True, P.1.7=True, P.1.10=True, P.1=True, P.1.12.1=True, P.1.17=True, P.1.15=True	VOC		11-Jan-2021	
p.P26S	c.C76T	p.P26S			21638	S	S	MISSENSE	11383	172.0	11387						0	T=11383	11383	T	C	convalescent plasma escape	Hoffman et al. (2021)	https://doi.org/10.1016/j.cell.2021.03.036	'L18F', 'T20N', 'D138Y', 'R190S', 'K417T', 'E484K', 'N501Y', 'H655Y', 'T1027I', 'V1176F'	VSV pseudotype P.1 showed 4.8-fold decrease in NT50 vs wild type in sera from 9 ICU patients undergoing treatment in Germany (pre-variant infections).	False	P.1.12.1, P.1.17, P.1.14, P.1.15, P.1, P.1.12, P.1.10, P.1.7	P.1.12=True, P.1.14=True, P.1.7=True, P.1.10=True, P.1=True, P.1.12.1=True, P.1.17=True, P.1.15=True	VOC		11-Jan-2021	
p.P26S	c.C76T	p.P26S			21638	S	S	MISSENSE	11383	172.0	11387						0	T=11383	11383	T	C	convalescent plasma escape	Luftig et al. (2021)	https://doi.org/10.1056/nejmc2104036	'L18F', 'T20N', 'D138Y', 'R190S', 'K417T', 'E484K', 'N501Y', 'H655Y', 'T1027I', 'V1176F'	In sera from six patients collected 1 to 12 weeks post-infection with B.1, antibody titer in a microneutralization assay was on average 71.46 for P.1 virus. Compare to much stronger neutralization titers for B.1.1.7 (256) and wild type (456.1) in the same sera. 	False	P.1.12.1, P.1.17, P.1.14, P.1.15, P.1, P.1.12, P.1.10, P.1.7	P.1.12=True, P.1.14=True, P.1.7=True, P.1.10=True, P.1=True, P.1.12.1=True, P.1.17=True, P.1.15=True	VOC		11-Jan-2021	
p.P26S	c.C76T	p.P26S			21638	S	S	MISSENSE	11383	172.0	11387						0	T=11383	11383	T	C	convalescent plasma escape	McCallum et al. (2021)	https://www.biorxiv.org/content/10.1101/2021.03.31.437925v1	'L18F', 'T20N', 'D138Y', 'R190S', 'K417T', 'E484K', 'N501Y', 'H655Y', 'T1027I', 'V1176F'	In 13 plasma collected ~1mo after B.1.1.7 infection (nursing home in Ticino, Switzerland), neutralization  reduced to undetectable levels in many plasma for P.1 pseudotyped virus, as well as WT and other VOCs.  [paper does not detail the P.1 variants used, using the most popular as a stand in]	False	P.1.12.1, P.1.17, P.1.14, P.1.15, P.1, P.1.12, P.1.10, P.1.7	P.1.12=True, P.1.14=True, P.1.7=True, P.1.10=True, P.1=True, P.1.12.1=True, P.1.17=True, P.1.15=True	VOC		11-Jan-2021	
p.P26S	c.C76T	p.P26S			21638	S	S	MISSENSE	11383	172.0	11387						0	T=11383	11383	T	C	convalescent plasma escape	Mendes-Correa et al. (2021)	https://www.medrxiv.org/content/10.1101/2021.05.11.21256908v1	'L18F', 'T20N', 'D138Y', 'R190S', 'K417T', 'E484K', 'N501Y', 'H655Y', 'T1027I', 'V1176F'	Neutralizing antibodies that were generated following a mild infection with SARS-CoV-2 B.1.128 were effective in vitro,  and likely protective, against the SARS-CoV-2 P.1. variant in the majority of individuals based on 60 convalescent sera tested.	False	P.1.12.1, P.1.17, P.1.14, P.1.15, P.1, P.1.12, P.1.10, P.1.7	P.1.12=True, P.1.14=True, P.1.7=True, P.1.10=True, P.1=True, P.1.12.1=True, P.1.17=True, P.1.15=True	VOC		11-Jan-2021	
p.P26S	c.C76T	p.P26S			21638	S	S	MISSENSE	11383	172.0	11387						0	T=11383	11383	T	C	convalescent plasma escape	Tang et al. (2021)	https://www.biorxiv.org/content/10.1101/2021.03.19.436183v1	'L18F', 'T20N', 'D138Y', 'R190S', 'K417T', 'E484K', 'N501Y', 'H655Y', 'T1027I', 'V1176F'	Loss of neutralizing activity (PsVNA50 assay) using 6 hyperimmune immunoglobulin preparations from convalescent plasma was seen against P.1 (3.5-fold). Neutralization against 10 convalescent plasma was slightly poorer (3.9-fold).	False	P.1.12.1, P.1.17, P.1.14, P.1.15, P.1, P.1.12, P.1.10, P.1.7	P.1.12=True, P.1.14=True, P.1.7=True, P.1.10=True, P.1=True, P.1.12.1=True, P.1.17=True, P.1.15=True	VOC		11-Jan-2021	
p.P26S	c.C76T	p.P26S			21638	S	S	MISSENSE	11383	172.0	11387						0	T=11383	11383	T	C	convalescent plasma escape	Wang et al. (2021)	https://dx.doi.org/10.1101%2F2021.03.01.433466	'L18F', 'T20N', 'D138Y', 'R190S', 'K417T', 'E484K', 'N501Y', 'D614G', 'H655Y'	In convalescent sera one month or more post-infection in Spring 2020, an average 6.5x decrease in reciprocal ID50 value was observed  ten key point mutations in Spike in the P.1 lineage vs wildtype. A 3.4x decrease against the full P.1 type vs WA-1 was observed, with  better full P.1 ID50 reciprocal value compared to the 10-mutation model.	False	P.1.12.1, P.1.17, P.1.14, P.1.15, P.1, P.1.12, P.1.10, P.1.7	P.1.12=True, P.1.14=True, P.1.7=True, P.1.10=True, P.1=True, P.1.12.1=True, P.1.17=True, P.1.15=True	VOC		11-Jan-2021	
p.P26S	c.C76T	p.P26S			21638	S	S	MISSENSE	11383	172.0	11387						0	T=11383	11383	T	C	pharmaceutical effectiveness	Hoffman et al. (2021)	https://doi.org/10.1016/j.cell.2021.03.036	'L18F', 'T20N', 'D138Y', 'R190S', 'K417T', 'E484K', 'N501Y', 'H655Y', 'T1027I', 'V1176F'	VSV pseudotype P.1 entry mediated by the S proteins of the P.1 variant was completely resistant to blocking by REGN10989 and Bamlanivimab. Cell fusion proficiency was slight impaired. Entry driven by the S proteins of the B.1.351 was partially resistant against Casirivimab.	False	P.1.12.1, P.1.17, P.1.14, P.1.15, P.1, P.1.12, P.1.10, P.1.7	P.1.12=True, P.1.14=True, P.1.7=True, P.1.10=True, P.1=True, P.1.12.1=True, P.1.17=True, P.1.15=True	VOC		11-Jan-2021	
p.P26S	c.C76T	p.P26S			21638	S	S	MISSENSE	11383	172.0	11387						0	T=11383	11383	T	C	reinfection	Malta Romano et al. (2021)	https://doi.org/10.1590/s1678-9946202163036	'L18F', 'T20N', 'D138Y', 'R190S', 'K417T', 'E484K', 'N501Y', 'D614G', 'H655Y', 'T1027I'	After a 128 day interval, a patient in Sao Paulo State, Brazil reinfected with P.1 (first episode likely predates P.1 emergence). Both cases were fairly mild (difficulty breathing, tiredness, dizziness and fatigue).	False	P.1.12.1, P.1.17, P.1.14, P.1.15, P.1, P.1.12, P.1.10, P.1.7	P.1.12=True, P.1.14=True, P.1.7=True, P.1.10=True, P.1=True, P.1.12.1=True, P.1.17=True, P.1.15=True	VOC		11-Jan-2021	
p.P26S	c.C76T	p.P26S			21638	S	S	MISSENSE	11383	172.0	11387						0	T=11383	11383	T	C	trafficking	Esclera et al. (2021)	https://www.biorxiv.org/content/10.1101/2021.08.05.455290v1	'L18F', 'T20N', 'D138Y', 'R190S', 'K417T', 'E484K', 'N501Y', 'D614G', 'H655Y', 'T1027I'	~6x cleavage of S2 relative to WA1 (D614G) wildtype by Gamma variant as measured by mass spectrometry of Vero-TMPRSS culture  [no mutations directly at furin cleavage site, but H655Y is upstream] Compare to 4.5x or less for variants of concern with  direct furin clevage site mutations.	False	P.1.12.1, P.1.17, P.1.14, P.1.15, P.1, P.1.12, P.1.10, P.1.7	P.1.12=True, P.1.14=True, P.1.7=True, P.1.10=True, P.1=True, P.1.12.1=True, P.1.17=True, P.1.15=True	VOC		11-Jan-2021	
p.P26S	c.C76T	p.P26S			21638	S	S	MISSENSE	11383	172.0	11387						0	T=11383	11383	T	C	trafficking	Hoffman et al. (2021)	https://doi.org/10.1016/j.cell.2021.03.036	'L18F', 'T20N', 'D138Y', 'R190S', 'K417T', 'E484K', 'N501Y', 'H655Y', 'T1027I', 'V1176F'	VSV pseudotype P.1 showed slight decrease in cell entry relative to wild type in 262T and 263T-ACE2 (kidney) cell lines. Cell fusion proficiency was slight impaired.	False	P.1.12.1, P.1.17, P.1.14, P.1.15, P.1, P.1.12, P.1.10, P.1.7	P.1.12=True, P.1.14=True, P.1.7=True, P.1.10=True, P.1=True, P.1.12.1=True, P.1.17=True, P.1.15=True	VOC		11-Jan-2021	
p.P26S	c.C76T	p.P26S			21638	S	S	MISSENSE	11383	172.0	11387						0	T=11383	11383	T	C	transmissibility	Stefanelli et al. (2021)	https://www.medrxiv.org/content/10.1101/2021.04.06.21254923v1	'L18F', 'T20N', 'D138Y', 'R190S', 'E484K', 'N501Y', 'D614G', 'H655Y'	The relative transmissibility of P.1 estimated at the national level (Italy) varied according to the assumed  degree of cross-protection granted by infection with other lineages and ranged from 1.12 (95%CI 1.03-1.23) in the  case of complete immune evasion by P.1 to 1.39 (95%CI 1.26-1.56) in the case of complete cross-protection. PG: variant list has been abbreviated due to mixed K417 bases in this lineage, potential miscalls of deletions	False	P.1.12.1, P.1.17, P.1.14, P.1.15, P.1, P.1.12, P.1.10, P.1.7	P.1.12=True, P.1.14=True, P.1.7=True, P.1.10=True, P.1=True, P.1.12.1=True, P.1.17=True, P.1.15=True	VOC		11-Jan-2021	
p.P26S	c.C76T	p.P26S			21638	S	S	MISSENSE	11383	172.0	11387						0	T=11383	11383	T	C	vaccine neutralization efficacy	Alenquer et al. (2021)	https://www.biorxiv.org/content/10.1101/2021.04.22.441007v1	'L18F', 'T20N', 'D138Y', 'R190S', 'K417T', 'E484K', 'N501Y', 'H655Y', 'T1027I'	Using P.1 defining mutations for Spike, observed 4x average decrease in neutralization efficiency  (but still relevant titres) for sera from 10 BNT162b2 vaccinees 12 days after second dose, but only one  relevant titre 12 days after first dose. Compares unfavorably to wild type or B.1.1.7 titres.	False	P.1.12.1, P.1.17, P.1.14, P.1.15, P.1, P.1.12, P.1.10, P.1.7	P.1.12=True, P.1.14=True, P.1.7=True, P.1.10=True, P.1=True, P.1.12.1=True, P.1.17=True, P.1.15=True	VOC		11-Jan-2021	
p.P26S	c.C76T	p.P26S			21638	S	S	MISSENSE	11383	172.0	11387						0	T=11383	11383	T	C	vaccine neutralization efficacy	Andrade et al. (2021)	https://www.biorxiv.org/content/10.1101/2021.04.14.439719v1	'L18F', 'T20N', 'D138Y', 'R190S', 'K417T', 'E484K', 'N501Y', 'H655Y', 'T1027I'	In human sera 8 weeks post-vaccination with INO-4800, a ~2-fold reduction in P.1 neutralization was observed.	False	P.1.12.1, P.1.17, P.1.14, P.1.15, P.1, P.1.12, P.1.10, P.1.7	P.1.12=True, P.1.14=True, P.1.7=True, P.1.10=True, P.1=True, P.1.12.1=True, P.1.17=True, P.1.15=True	VOC		11-Jan-2021	
p.P26S	c.C76T	p.P26S			21638	S	S	MISSENSE	11383	172.0	11387						0	T=11383	11383	T	C	vaccine neutralization efficacy	Chen et al. (2021)	https://www.nature.com/articles/s41591-021-01294-w 	'L18F', 'T20N', 'D138Y', 'R190S', 'K417T', 'E484K', 'N501Y', 'D614G', 'H655Y', 'T1027I', 'V1176F'	The neutralizing activity of vaccine was slightly lower against B.1.1.248 variant constellation in sera tested from most of the 15 patients with  the BNT162b2 mRNA vaccine. (Fig. 4)	False	P.1.12.1, P.1.17, P.1.14, P.1.15, P.1, P.1.12, P.1.10, P.1.7	P.1.12=True, P.1.14=True, P.1.7=True, P.1.10=True, P.1=True, P.1.12.1=True, P.1.17=True, P.1.15=True	VOC		11-Jan-2021	
p.P26S	c.C76T	p.P26S			21638	S	S	MISSENSE	11383	172.0	11387						0	T=11383	11383	T	C	vaccine neutralization efficacy	Choi et al. (2021)	https://www.biorxiv.org/content/10.1101/2021.06.28.449914v1	'L18F', 'T20N', 'D138Y', 'R190S', 'K417T', 'E484K', 'N501Y', 'H655Y', 'T1027I', 'V1176F'	Neutralization efficiency (ID50) against P.1 reduced 3.2x relative to D614G wildtype using pseudotyped VSV assay on 8 Moderna vaccinee sera one week post-booster.	False	P.1.12.1, P.1.17, P.1.14, P.1.15, P.1, P.1.12, P.1.10, P.1.7	P.1.12=True, P.1.14=True, P.1.7=True, P.1.10=True, P.1=True, P.1.12.1=True, P.1.17=True, P.1.15=True	VOC		11-Jan-2021	
p.P26S	c.C76T	p.P26S			21638	S	S	MISSENSE	11383	172.0	11387						0	T=11383	11383	T	C	vaccine neutralization efficacy	Gallagher et al. (2021)	https://www.biorxiv.org/content/10.1101/2021.05.03.442455v1	'L18F', 'T20N', 'D138Y', 'R190S', 'K417T', 'E484K', 'N501Y', 'D614G', 'H655Y', 'T1027I', 'V1176F'	ELISpot assays show T cell neutralization reduced by 16.6% in this B.1.1.248 pseudotype relative to wild type in 18-20 pooled patient samples post second mRNA vaccine dose, with no significant difference between Pfizer and Moderna cohorts. Reduction was stronger in the S1 subunit than S2 (separate peptide pools were used).	False	P.1.12.1, P.1.17, P.1.14, P.1.15, P.1, P.1.12, P.1.10, P.1.7	P.1.12=True, P.1.14=True, P.1.7=True, P.1.10=True, P.1=True, P.1.12.1=True, P.1.17=True, P.1.15=True	VOC		11-Jan-2021	
p.P26S	c.C76T	p.P26S			21638	S	S	MISSENSE	11383	172.0	11387						0	T=11383	11383	T	C	vaccine neutralization efficacy	Garcia-Beltran et al. (2021)	https://doi.org/10.1016/j.cell.2021.03.013	'L18F', 'T20N', 'D138Y', 'R190S', 'K417T', 'E484K', 'N501Y', 'D614G', 'H655Y', 'T1027I', 'V1176F'	Pseudotyped P.1 virus has reduced neutralization activity vs wild type: 6.7x (30 sera Pfizer median 9 days post 2nd dose)  and 4.5x (35 sera Moderna median 18 days post 2nd dose). This was significant by ANOVA.	False	P.1.12.1, P.1.17, P.1.14, P.1.15, P.1, P.1.12, P.1.10, P.1.7	P.1.12=True, P.1.14=True, P.1.7=True, P.1.10=True, P.1=True, P.1.12.1=True, P.1.17=True, P.1.15=True	VOC		11-Jan-2021	
p.P26S	c.C76T	p.P26S			21638	S	S	MISSENSE	11383	172.0	11387						0	T=11383	11383	T	C	vaccine neutralization efficacy	Gong et al. (2021)	https://www.biorxiv.org/content/10.1101/2021.08.04.455140v1	'L18F', 'T20N', 'D138Y', 'R190S', 'K417T', 'E484K', 'N501Y', 'H655Y', 'T1027I', 'V1176F'	1.15x *increase* in neutralization (ID50) in sera 3 weeks after one dose of Pfizer/BioNTech BNT162b2 (up to 5 naive and post infection vaccinees)	False	P.1.12.1, P.1.17, P.1.14, P.1.15, P.1, P.1.12, P.1.10, P.1.7	P.1.12=True, P.1.14=True, P.1.7=True, P.1.10=True, P.1=True, P.1.12.1=True, P.1.17=True, P.1.15=True	VOC		11-Jan-2021	
p.P26S	c.C76T	p.P26S			21638	S	S	MISSENSE	11383	172.0	11387						0	T=11383	11383	T	C	vaccine neutralization efficacy	Hitchlings et al. (2021)	https://www.medrxiv.org/content/10.1101/2021.04.07.21255081v1	'L18F', 'T20N', 'D138Y', 'R190S', 'K417T', 'E484K', 'N501Y', 'H655Y', 'T1027I'	Among 46,884 HCWs in Manaus, Brazil vaccinated with at least one dose of CoronaVac, a 0.50-fold reduction (adjusted vaccine  effectiveness, 49.6%: 95% CI, 11.3 - 71.4) in the odds of  symptomatic SARS-CoV-2 infection was observed during the period 14 days or more after receiving the first dose. Estimated vaccine effectiveness of at least one dose against any SARS-CoV-2 infection was 35.1% (95% CI, −6.6 - 60.5) in the same time period.	False	P.1.12.1, P.1.17, P.1.14, P.1.15, P.1, P.1.12, P.1.10, P.1.7	P.1.12=True, P.1.14=True, P.1.7=True, P.1.10=True, P.1=True, P.1.12.1=True, P.1.17=True, P.1.15=True	VOC		11-Jan-2021	
p.P26S	c.C76T	p.P26S			21638	S	S	MISSENSE	11383	172.0	11387						0	T=11383	11383	T	C	vaccine neutralization efficacy	Hoffman et al. (2021)	https://doi.org/10.1016/j.cell.2021.03.036	'L18F', 'T20N', 'D138Y', 'R190S', 'K417T', 'E484K', 'N501Y', 'H655Y', 'T1027I', 'V1176F'	VSV pseudotype P.1 showed 5.12-fold reduction in neutralization efficiency vs wild type in 15 Pfizer BNT162b2 vaccinee sera 13-15 days post second dose. Cell fusion proficiency was slight impaired.	False	P.1.12.1, P.1.17, P.1.14, P.1.15, P.1, P.1.12, P.1.10, P.1.7	P.1.12=True, P.1.14=True, P.1.7=True, P.1.10=True, P.1=True, P.1.12.1=True, P.1.17=True, P.1.15=True	VOC		11-Jan-2021	
p.P26S	c.C76T	p.P26S			21638	S	S	MISSENSE	11383	172.0	11387						0	T=11383	11383	T	C	vaccine neutralization efficacy	Leier et al. (2021)	https://www.medrxiv.org/content/10.1101/2021.04.25.21256049v1	'L18F', 'T20N', 'D138Y', 'R190S', 'K417T', 'E484K', 'N501Y', 'D614G', 'H655Y', 'T1027I', 'V1176F'	Neutralizing antibody titers increased in previously infected vaccinees relative to uninfected vaccinees  4.3-fold against P.1 (contrast with 3.4 fold against original SARS-CoV-2).	False	P.1.12.1, P.1.17, P.1.14, P.1.15, P.1, P.1.12, P.1.10, P.1.7	P.1.12=True, P.1.14=True, P.1.7=True, P.1.10=True, P.1=True, P.1.12.1=True, P.1.17=True, P.1.15=True	VOC		11-Jan-2021	
p.P26S	c.C76T	p.P26S			21638	S	S	MISSENSE	11383	172.0	11387						0	T=11383	11383	T	C	vaccine neutralization efficacy	Tarke et al. (2021)	https://www.biorxiv.org/content/10.1101/2021.02.27.433180v1	'L18F', 'T20N', 'D138Y', 'R190S', 'K417T', 'E484K', 'N501Y', 'H655Y', 'T1027I', 'V1176F'	PBMCs of Pfizer/BioNTech BNT162b2 (n	False	P.1.12.1, P.1.17, P.1.14, P.1.15, P.1, P.1.12, P.1.10, P.1.7	P.1.12=True, P.1.14=True, P.1.7=True, P.1.10=True, P.1=True, P.1.12.1=True, P.1.17=True, P.1.15=True	VOC		11-Jan-2021	
p.P26S	c.C76T	p.P26S			21638	S	S	MISSENSE	11383	172.0	11387						0	T=11383	11383	T	C	vaccine neutralization efficacy	Wang et al. (2021)	https://dx.doi.org/10.1101%2F2021.03.01.433466	'L18F', 'T20N', 'D138Y', 'R190S', 'K417T', 'E484K', 'N501Y', 'D614G', 'H655Y'	In 12 Moderna vaccinee sera 15 days post second dose (43 days since first vaccination), an average 2.8x decrease in reciprocal ID50 value was observed  ten key point mutations in Spike in the P.1 lineage vs wildtype. A 4.8x decrease against the full P.1 type vs WA-1 was observed, though overall with  a higher ID50 reciprocal value. In 10 Pfizer vaccinee sera 7 days or more post second dose (28 days or more since first vaccination), an average 2.2x decrease in reciprocal ID50 value was observed  ten key point mutations in Spike in the P.1 lineage vs wildtype. A 3.8x decrease against the full P.1 type vs WA-1 was observed, with  similar variant ID50 reciprocal value.	False	P.1.12.1, P.1.17, P.1.14, P.1.15, P.1, P.1.12, P.1.10, P.1.7	P.1.12=True, P.1.14=True, P.1.7=True, P.1.10=True, P.1=True, P.1.12.1=True, P.1.17=True, P.1.15=True	VOC		11-Jan-2021	
p.P26S	c.C76T	p.P26S			21638	S	S	MISSENSE	11383	172.0	11387						0	T=11383	11383	T	C	vaccinee plasma binding	Gong et al. (2021)	https://www.biorxiv.org/content/10.1101/2021.08.04.455140v1	'D614G'	1.23x decrease in Spike binding (relative to D614G alone) by 5 plasma collected 3 weeks after one dose of Pfizer/BioNtech BNT162b2 vaccine in previously non-seroconverted subjects.  1.37x decrease in Spike binding (relative to D614G alone) by 5 plasma collected 3 weeks after one dose of Pfizer/BioNtech BNT162b2 vaccine in post-infection vaccinees.	False	P.1.12.1, P.1.17, P.1.14, P.1.15, P.1, P.1.12, P.1.10, P.1.7	P.1.12=True, P.1.14=True, P.1.7=True, P.1.10=True, P.1=True, P.1.12.1=True, P.1.17=True, P.1.15=True	VOC		11-Jan-2021	
p.P26S	c.C76T	p.P26S			21638	S	S	MISSENSE	11383	172.0	11387						0	T=11383	11383	T	C	vaccinee plasma binding	Gong et al. (2021)	https://www.biorxiv.org/content/10.1101/2021.08.04.455140v1	'D614G', 'L18F', 'T20N', 'D138Y', 'R190S', 'K417T', 'E484K', 'N501Y', 'H655Y', 'T1027I'	This variant combination (representing P.1 aka Gamma)  showed a 1.14x decrease in Spike binding (relative to D614G alone) by 5 plasma 3 weeks after one dose of Pfizer/BioNtech BNT162b2 vaccine in previously non-seroconverted subjects.  1.27x decrease in Spike binding (relative to D614G alone) by 5 plasma collected 3 weeks after one dose of Pfizer/BioNtech BNT162b2 vaccine in post-infection vaccinees.	False	P.1.12.1, P.1.17, P.1.14, P.1.15, P.1, P.1.12, P.1.10, P.1.7	P.1.12=True, P.1.14=True, P.1.7=True, P.1.10=True, P.1=True, P.1.12.1=True, P.1.17=True, P.1.15=True	VOC		11-Jan-2021	
p.P26S	c.C76T	p.P26S			21638	S	S	MISSENSE	11383	172.0	11387						0	T=11383	11383	T	C	virion structure	Wang et al. (2021)	https://dx.doi.org/10.1101%2F2021.03.01.433466	'L18F', 'T20N', 'D138Y', 'R190S', 'K417T', 'E484K', 'N501Y', 'D614G', 'H655Y'	CryoEM reveals the P.1 trimer to adopt exclusively a conformation in which one of the receptor-binding domains is in the “up” position.	False	P.1.12.1, P.1.17, P.1.14, P.1.15, P.1, P.1.12, P.1.10, P.1.7	P.1.12=True, P.1.14=True, P.1.7=True, P.1.10=True, P.1=True, P.1.12.1=True, P.1.17=True, P.1.15=True	VOC		11-Jan-2021	
p.P309Q	c.C926A	p.P309Q			1191	orf1ab	ORF1ab	MISSENSE	2	2.0	11387			nsp2	produced by both pp1a and pp1ab	YP_009725298.1	1	A=1	1	A	C						False	P.1.7	P.1.7=False	VOC		11-Jan-2021	
p.P4715L	c.C14144T	p.P4715L			14408	orf1ab	ORF1ab	MISSENSE	11387	172.0	11387			RNA-dependent RNA polymerase	nsp12, NiRAN and RdRp, produced by pp1ab only	YP_009725307.1	0	T=11387	11387	T	C						False	P.1.12.1, P.1.17, P.1.14, P.1.15, P.1, P.1.12, P.1.10, P.1.7	P.1.12=True, P.1.14=True, P.1.7=True, P.1.10=True, P.1=True, P.1.12.1=True, P.1.17=True, P.1.15=True	VOC		11-Jan-2021	
p.P681H	c.C2042A	p.P681H			23604	S	S	MISSENSE	2	2.0	11387						0	A=2	2	A	C	ACE2 receptor binding affinity	Gong et al. (2021)	https://www.biorxiv.org/content/10.1101/2021.08.04.455140v1	'D614G'	Using flow cytometry and ACE2 ectodomains-Fc portion IgG complex, this variant showed a 1.23x decrease in binding (KD) relative to D614G.	False	P.1.7	P.1.7=True	VOC		11-Jan-2021	
p.P681H	c.C2042A	p.P681H			23604	S	S	MISSENSE	2	2.0	11387						0	A=2	2	A	C	antibody epitope effects	Chen et al. (2021)	https://www.nature.com/articles/s41591-021-01294-w 		Ablates Class 3 N-terminal domain targeting antibody COV2-2489, diminishes COV2-2676.	False	P.1.7	P.1.7=True	VOC		11-Jan-2021	
p.P681H	c.C2042A	p.P681H			23604	S	S	MISSENSE	2	2.0	11387						0	A=2	2	A	C	antibody epitope effects	Haynes et al. (2021)	https://www.medrxiv.org/content/10.1101/2021.01.06.20248960v1		Wildtype elicits immune response, COVID-19 cohort epitope score > 99th percentile of the 497 pre-pandemic controls, mutant drops PIWAS epitope score from 7.8% to 1.2% (significantly poorer immune recognition) Together with other B1.1.7 lineage mutational changes (Spike: Y144del,N501Y, A570D Nucleoprotein: D3L, S235F) resulted in only 2 of 579 individuals (0.3% of the population) having a dramatic reduction in PIWAS antigen scores, which reflects the peak epitope signal along the entire antigen.	False	P.1.7	P.1.7=True	VOC		11-Jan-2021	
p.P681H	c.C2042A	p.P681H			23604	S	S	MISSENSE	2	2.0	11387						0	A=2	2	A	C	antibody epitope effects	Johnson et al. (2020)	https://www.ncbi.nlm.nih.gov/pmc/articles/PMC7457603/ 		This variant is adjacent to the Spike protein furin cleavage site (cleavage of S into S1 and S2 subunits is required for viral membrane fusion and subsequent entry into host cells), a site shown to be highly immunogenic.	False	P.1.7	P.1.7=True	VOC		11-Jan-2021	
p.P681H	c.C2042A	p.P681H			23604	S	S	MISSENSE	2	2.0	11387						0	A=2	2	A	C	convalescent plasma binding	Gong et al. (2021)	https://www.biorxiv.org/content/10.1101/2021.08.04.455140v1	'D614G'	1.26x increase in Spike binding (relative to D614G alone) by 5 plasma collected 8 months post-symptom-onset.	False	P.1.7	P.1.7=True	VOC		11-Jan-2021	
p.P681H	c.C2042A	p.P681H			23604	S	S	MISSENSE	2	2.0	11387						0	A=2	2	A	C	trafficking	Lubinski et al. (2021)	https://www.biorxiv.org/content/10.1101/2021.04.06.438731v1		While the introduction of P681H in the SARS-CoV-2 B.1.1.7 variant may increase spike cleavage by furin-like proteases,  this does not significantly impact viral entry or cell-cell spread. We consider that other factors are at play to account  for the increased in transmission and disease severity attributed to this variant of concern (VOC).	False	P.1.7	P.1.7=True	VOC		11-Jan-2021	
p.P681H	c.C2042A	p.P681H			23604	S	S	MISSENSE	2	2.0	11387						0	A=2	2	A	C	trafficking	Maaroufi (2021)	https://www.researchgate.net/publication/348943694_The_mutation_P681H_in_the_B117_variant_of_SARS-CoV-2_probably_enhances_viral_entry_and_replication		This mutation in the first base of the furin clevage site maintains the RXXR recognition motif, and is presumed to enhance cleavage based on the removal of a proline-directed phosphotase recognition site at S680. In a homologuous site in Infectious  Bronchitis Virus (IBV, Gammacoronaviruses), abolition of S680 phosphorylation improves furin cleavage  (and presumably cell entry).	False	P.1.7	P.1.7=True	VOC		11-Jan-2021	
p.P681H	c.C2042A	p.P681H			23604	S	S	MISSENSE	2	2.0	11387						0	A=2	2	A	C	trafficking	Tada et al. (2021)	https://www.biorxiv.org/content/10.1101/2021.02.05.430003v1		Lentiviral pseudotyped with this individual mutation from B.1.1.7 was tested on ACE2.293T cells. Luciferase activity was measured two days postinfection,  showing NO statistically significant infection rate change amongst the cells, suggesting that furin cleavage typically used for cell entry is not affected by this change one  amino acid upstream of the RXXR recognition pattern. 	False	P.1.7	P.1.7=True	VOC		11-Jan-2021	
p.P681H	c.C2042A	p.P681H			23604	S	S	MISSENSE	2	2.0	11387						0	A=2	2	A	C	vaccine neutralization efficacy	Zuckerman et al. (2021)	https://www.medrxiv.org/content/10.1101/2021.03.25.21253908v1	'D614G'	No significant change in virus neutralzation by 18 Pfizer two dose vaccinee sera compared to B.1.1.7. [results without including the used mutation A27S likely generalizable, as this is not a lineage defining mutation]	False	P.1.7	P.1.7=True	VOC		11-Jan-2021	
