name	nt_name	aa_name	multi_aa_name	multiaa_mutation_split_names	start	vcf_gene	chrom_region	mutation_type	dp	obs_sample_size	variant_pop_size	ps_filter	ps_exc	mat_pep_id	mat_pep_desc	mat_pep_acc	ro	ao_by_var_seq	ao	variant_seq	reference_seq	function_category	citation	citation_url	comb_mutation	function_description	heterozygosity	viral_lineages	clade_defining_status	status	voi_designation_date	voc_designation_date	vum_designation_date
p.L452R	c.T1355G	p.L452R			22917	S	S	MISSENSE	430	430	0						0	G=430	430	G	T	antibody epitope effects	McCallum et al. (2021)	https://www.biorxiv.org/content/10.1101/2021.03.31.437925v1		10 of 14 RBD-specific mAbs that showed at least 10-fold reduced neutralization of B.1.427/B.1.429 variant pseudotype (S13I, W152C, and L452R) were also found to poorly bind to just a L452R RBD mutant, demonstrating a role for this mutation as an escape mechanism for certain RBD-targeting mAbs.	False	B.1.617.1	B.1.617.1=True	VUM	4-Apr-2021		20-Sep-2021
p.L452R	c.T1355G	p.L452R			22917	S	S	MISSENSE	430	430	0						0	G=430	430	G	T	antibody epitope effects	Sun et al. (2021)	https://www.biorxiv.org/content/10.1101/2021.03.22.436481v1		~20% (ELISA significance threshold) drop in antibody binding (ELISA) by this variant against monoclonal antibody VH ab6.	False	B.1.617.1	B.1.617.1=True	VUM	4-Apr-2021		20-Sep-2021
p.L452R	c.T1355G	p.L452R			22917	S	S	MISSENSE	430	430	0						0	G=430	430	G	T	convalescent plasma binding	Gong et al. (2021)	https://www.biorxiv.org/content/10.1101/2021.08.04.455140v1	'D614G'	2.15x increase in Spike binding (relative to D614G alone) by 5 plasma collected 8 months post-symptom-onset.	False	B.1.617.1	B.1.617.1=True	VUM	4-Apr-2021		20-Sep-2021
p.L452R	c.T1355G	p.L452R			22917	S	S	MISSENSE	430	430	0						0	G=430	430	G	T	convalescent plasma binding	Gong et al. (2021)	https://www.biorxiv.org/content/10.1101/2021.08.04.455140v1	'E484Q', 'D614G'	This variant combination (representing lineage B.1.617) showed a 1.22x decrease in Spike binding (relative  to D614G alone) by 5 plasma collected 8 months post-symptom-onset. [exact variant list not provided in manuscript, is inferred fro common knowledge]	False	B.1.617.1	B.1.617.1=True	VUM	4-Apr-2021		20-Sep-2021
p.L452R	c.T1355G	p.L452R			22917	S	S	MISSENSE	430	430	0						0	G=430	430	G	T	convalescent plasma escape	Alenquer et al. (2021)	https://www.biorxiv.org/content/10.1101/2021.04.22.441007v1		Observed ~2x decrease on average in 16 health workers' convalescent sera.	False	B.1.617.1	B.1.617.1=True	VUM	4-Apr-2021		20-Sep-2021
p.L452R	c.T1355G	p.L452R			22917	S	S	MISSENSE	430	430	0						0	G=430	430	G	T	convalescent plasma escape	Liu et al. (2021)	https://www.biorxiv.org/content/10.1101/2020.11.06.372037v2		Ablation of neutralization capability of 3 of 4 convalescent sera tested, the other is significantly hindered.	False	B.1.617.1	B.1.617.1=True	VUM	4-Apr-2021		20-Sep-2021
p.L452R	c.T1355G	p.L452R			22917	S	S	MISSENSE	430	430	0						0	G=430	430	G	T	convalescent plasma escape	Tada et al. (2021)	https://www.biorxiv.org/content/10.1101/2021.05.14.444076v1	'E484Q', 'D614G'	Pseudotyped viruses for B.1.617 was 2.3-fold resistant to neutralization by convalescent sera compared to wild type - a finding that was similar to that of the 3-fold resistance of the South Africa B.1.351 variant using the same assay. The resistance of B.1.617 was caused by the L452R and E484Q mutation, based on results from viruses pseudotyped for individual variants within B.1.617. [details on the convalescent patient sera collection are not abundantly clear in the preprint]	False	B.1.617.1	B.1.617.1=True	VUM	4-Apr-2021		20-Sep-2021
p.L452R	c.T1355G	p.L452R			22917	S	S	MISSENSE	430	430	0						0	G=430	430	G	T	convalescent plasma escape	Wilhelm et al. (2021)	https://www.medrxiv.org/content/10.1101/2021.08.09.21261704v1	'D614G'	Relative to B.1, Epsilon (B.1.417/429) shows 1.74x-2.35x decrease in neutralization efficiency by convalescent plasma [no cohort details provided]	False	B.1.617.1	B.1.617.1=True	VUM	4-Apr-2021		20-Sep-2021
p.L452R	c.T1355G	p.L452R			22917	S	S	MISSENSE	430	430	0						0	G=430	430	G	T	convalescent plasma escape	Wilhelm et al. (2021)	https://www.medrxiv.org/content/10.1101/2021.08.09.21261704v1	'G142D', 'E154K', 'E484Q', 'D614G', 'P681R', 'Q1071H'	Relative to B.1, Kappa (B.1.617.1) shows 5.71x decrease in neutralization efficiency by convalescent plasma [no cohort details provided]	False	B.1.617.1	B.1.617.1=True	VUM	4-Apr-2021		20-Sep-2021
p.L452R	c.T1355G	p.L452R			22917	S	S	MISSENSE	430	430	0						0	G=430	430	G	T	gene expression increase	Starr et al. (2020)	https://doi.org/10.1016/j.cell.2020.08.012		Experimentally, Spike gene expression increased 0.32 fold	False	B.1.617.1	B.1.617.1=True	VUM	4-Apr-2021		20-Sep-2021
p.L452R	c.T1355G	p.L452R			22917	S	S	MISSENSE	430	430	0						0	G=430	430	G	T	monoclonal antibody serial passage escape	Greaney et al. (2020)	https://doi.org/10.1016/j.chom.2020.11.007		Ranked effective mutant against this position in the RBD for highly neutralizing COV2-2096	False	B.1.617.1	B.1.617.1=True	VUM	4-Apr-2021		20-Sep-2021
p.L452R	c.T1355G	p.L452R			22917	S	S	MISSENSE	430	430	0						0	G=430	430	G	T	monoclonal antibody serial passage escape	Starr et al. (2021)	https://www.biorxiv.org/content/10.1101/2021.02.17.431683v1		Escape mutation against monoclonal antibody LY-CoV555 (antibody that forms the basis for Eli Lilly's bamlanivimab)	False	B.1.617.1	B.1.617.1=True	VUM	4-Apr-2021		20-Sep-2021
p.L452R	c.T1355G	p.L452R			22917	S	S	MISSENSE	430	430	0						0	G=430	430	G	T	monoclonal antibody serial passage escape	Wang et al. (2021)	https://www.biorxiv.org/content/10.1101/2021.01.15.426911v2		Class 2/3 antibody C628 and class 2 antibody C643 selected for the emergence of the L452R mutation in vitro.	False	B.1.617.1	B.1.617.1=True	VUM	4-Apr-2021		20-Sep-2021
p.L452R	c.T1355G	p.L452R			22917	S	S	MISSENSE	430	430	0						0	G=430	430	G	T	pharmaceutical effectiveness	Engelhart et al. (2021)	https://www.biorxiv.org/content/10.1101/2021.04.27.440939v1		Bamlanivimab (LY-CoV555) lost ~5x binding against this isolated mutation. Cligavimab lost ~4x binding against this isolated mutation. Regdanvimab lost ~4x binding against this isolated mutation.	False	B.1.617.1	B.1.617.1=True	VUM	4-Apr-2021		20-Sep-2021
p.L452R	c.T1355G	p.L452R			22917	S	S	MISSENSE	430	430	0						0	G=430	430	G	T	pharmaceutical effectiveness	McCallum et al. (2021)	https://www.biorxiv.org/content/10.1101/2021.03.31.437925v1		Bamlanivimab (LY-CoV555) entirely lost its neutralizing activity due to the central location of L452R in the epitopes recognized by this mAb. Regdanvimab (CT-P59), and to a smaller extent etesevimab, showed a reduction in neutralization potency.	False	B.1.617.1	B.1.617.1=True	VUM	4-Apr-2021		20-Sep-2021
p.L452R	c.T1355G	p.L452R			22917	S	S	MISSENSE	430	430	0						0	G=430	430	G	T	symptom prevalence	Yadav et al. (2021)	https://www.biorxiv.org/content/10.1101/2021.05.05.442760v1	'E484Q', 'P681R'	Gross examination of 3+3 hamster lung specimens showed pronounced congestion and hemorrhages on days 5 and 7 post-infection in the case of the B.1.617.1 as compared with the B.1. The lung lesions with  the B.1 variant were minimal to mild whereas with B.1.617.1 they were moderate. For B.1 pneumonic changes were minimal to mild (inflammatory cell infiltration, focal consolidation and mild congestion). The pronounced changes (moderate to severe) with mononuclear infiltration in the alveolar interstitial space, interstitial septal thickening, consolidation and pneumocyte hyperplasia were observed with B.1.617.1 variant consistently.	False	B.1.617.1	B.1.617.1=True	VUM	4-Apr-2021		20-Sep-2021
p.L452R	c.T1355G	p.L452R			22917	S	S	MISSENSE	430	430	0						0	G=430	430	G	T	trafficking	Deng et al. (2021)	https://www.medrxiv.org/content/10.1101/2021.03.07.21252647v1		We observed increased entry by pseudoviruses carrying the L452R mutation compared to D614G alone,  with a 6.7 to 22.5-fold increase in 293T cells and a 5.8 to 14.7-fold increase in human airway organoids.	False	B.1.617.1	B.1.617.1=True	VUM	4-Apr-2021		20-Sep-2021
p.L452R	c.T1355G	p.L452R			22917	S	S	MISSENSE	430	430	0						0	G=430	430	G	T	trafficking	Esclera et al. (2021)	https://www.biorxiv.org/content/10.1101/2021.08.05.455290v1	'G142D', 'E154K', 'E484Q', 'D614G', 'P681R', 'Q1071H'	~3.5x cleavage of S2 relative to WA1 (D614G) wildtype by Kappa (B.1.617.1) variant as measured by mass spectrometry of Vero-TMPRSS culture (compare to ~4.5x for closely related Delta B.1.617.2 also with P681R at the cleavage site). 	False	B.1.617.1	B.1.617.1=True	VUM	4-Apr-2021		20-Sep-2021
p.L452R	c.T1355G	p.L452R			22917	S	S	MISSENSE	430	430	0						0	G=430	430	G	T	trafficking	Ferriera et al (2021)	https://www.biorxiv.org/content/10.1101/2021.05.08.443253v1		This variant alone shows a ~5x decrease in cell entry efficiency (RLU measurement in 293T cells) compared to D614G. [listed as L454R in Figure, but L452R in text, also text  suggests not statistucally significant, but error bars say otherwise in Figure 4]	False	B.1.617.1	B.1.617.1=True	VUM	4-Apr-2021		20-Sep-2021
p.L452R	c.T1355G	p.L452R			22917	S	S	MISSENSE	430	430	0						0	G=430	430	G	T	trafficking	Motozono et al. (2021)	https://www.biorxiv.org/content/10.1101/2021.04.02.438288v1		Increased stability of RBD expression in yeast, suggesting increased Spike protein stability.	False	B.1.617.1	B.1.617.1=True	VUM	4-Apr-2021		20-Sep-2021
p.L452R	c.T1355G	p.L452R			22917	S	S	MISSENSE	430	430	0						0	G=430	430	G	T	transmissibility	Tada et al. (2021)	https://www.biorxiv.org/content/10.1101/2021.05.14.444076v1	'D614G'	Increased infectivity of the B.1.617 spike was attributed to L452R, which itself caused a 3.5-fold increase in infectivity relative to D614G wild type.  [In combination with E484Q caused a lower 3-fold increase]	False	B.1.617.1	B.1.617.1=True	VUM	4-Apr-2021		20-Sep-2021
p.L452R	c.T1355G	p.L452R			22917	S	S	MISSENSE	430	430	0						0	G=430	430	G	T	transmissibility	Tada et al. (2021)	https://www.biorxiv.org/content/10.1101/2021.05.14.444076v1	'E484Q', 'D614G'	The combination caused a 3-fold increase in infectivity relative to D614G wild type. [compare to 3.5x for L452R alone]	False	B.1.617.1	B.1.617.1=True	VUM	4-Apr-2021		20-Sep-2021
p.L452R	c.T1355G	p.L452R			22917	S	S	MISSENSE	430	430	0						0	G=430	430	G	T	transmissibility	Tada et al. (2021)	https://www.biorxiv.org/content/10.1101/2021.05.14.444076v1	'E484Q', 'P681R', 'D614G'	Normalized for particle number, on ACE2.293T cells showed that the B.1.617 spike protein was >2-fold increase in infectivity relative to D614G wild type.	False	B.1.617.1	B.1.617.1=True	VUM	4-Apr-2021		20-Sep-2021
p.L452R	c.T1355G	p.L452R			22917	S	S	MISSENSE	430	430	0						0	G=430	430	G	T	vaccine neutralization efficacy	Choi et al. (2021)	https://www.biorxiv.org/content/10.1101/2021.06.28.449914v1	'G142D', 'E154K', 'E484Q', 'D614G', 'P681R', 'Q1071H'	Inferring from two B.1.617.1 variants tested, estimate baseline 3.3x reduction in ID50 relative to D614G wildtype using pseudotyped VSV assay on 8 Moderna vaccinee sera one week post-booster.	False	B.1.617.1	B.1.617.1=True	VUM	4-Apr-2021		20-Sep-2021
p.L452R	c.T1355G	p.L452R			22917	S	S	MISSENSE	430	430	0						0	G=430	430	G	T	vaccine neutralization efficacy	Choi et al. (2021)	https://www.biorxiv.org/content/10.1101/2021.06.28.449914v1	'T95I', 'G142D', 'E154K', 'E484Q', 'D614G', 'P681R', 'Q1071H'	"Neutralization efficiency (ID50) against B.1.617.1-v1 (""Kappa"") reduced 3.4x relative to D614G wildtype using pseudotyped VSV assay on 8 Moderna vaccinee sera one week post-booster."	False	B.1.617.1	B.1.617.1=True	VUM	4-Apr-2021		20-Sep-2021
p.L452R	c.T1355G	p.L452R			22917	S	S	MISSENSE	430	430	0						0	G=430	430	G	T	vaccine neutralization efficacy	Ferreira et al. (2021)	https://www.biorxiv.org/content/10.1101/2021.05.08.443253v1		Nine stored sera from Pfizer BNT162b2 vaccinees were tested against a range of spike mutation bearing PV. L452R conferred about a two-fold reduction in neutralisation by vaccine sera, but was not statistically significant with this sample size.	False	B.1.617.1	B.1.617.1=True	VUM	4-Apr-2021		20-Sep-2021
p.L452R	c.T1355G	p.L452R			22917	S	S	MISSENSE	430	430	0						0	G=430	430	G	T	vaccine neutralization efficacy	Ferreira et al. (2021)	https://www.biorxiv.org/content/10.1101/2021.05.08.443253v1	'E484Q'	Nine stored sera from Pfizer BNT162b2 vaccinees were tested against a range of spike mutation bearing PV. E484Q had a ~5x drop in neutralization (vs ~10x for E484K). When E484Q and L452R were combined, the fold change was significant, but similar to that of L452R alone (~2x), suggesting no evidence for an additive effect [perhaps even E484Q effect dilution]. 	False	B.1.617.1	B.1.617.1=True	VUM	4-Apr-2021		20-Sep-2021
p.L452R	c.T1355G	p.L452R			22917	S	S	MISSENSE	430	430	0						0	G=430	430	G	T	vaccine neutralization efficacy	Gong et al. (2021)	https://www.biorxiv.org/content/10.1101/2021.08.04.455140v1	'E484Q', 'D614G'	1.4x reduction in neutralization (ID50) in sera 3 weeks after one dose of Pfizer/BioNTech BNT162b2 (up to 5 naive and post infection vaccinees)	False	B.1.617.1	B.1.617.1=True	VUM	4-Apr-2021		20-Sep-2021
p.L452R	c.T1355G	p.L452R			22917	S	S	MISSENSE	430	430	0						0	G=430	430	G	T	vaccine neutralization efficacy	Gong et al. (2021)	https://www.biorxiv.org/content/10.1101/2021.08.04.455140v1	'G142D', 'E154K', 'E484Q', 'D614G', 'P681R', 'Q1071H'	1.5x reduction in neutralization (ID50) in sera 3 weeks after one dose of Pfizer/BioNTech BNT162b2 (up to 5 naive and post infection vaccinees) [exact set of variants used is not listed in the manuscript]	False	B.1.617.1	B.1.617.1=True	VUM	4-Apr-2021		20-Sep-2021
p.L452R	c.T1355G	p.L452R			22917	S	S	MISSENSE	430	430	0						0	G=430	430	G	T	vaccine neutralization efficacy	Jacobson et al. (2021)	https://www.medrxiv.org/content/10.1101/2021.04.14.21255431v2		The presence of this variant in 189 post-mRNA-vaccination COVID-19 cases was proportionally in line with lineage prevalence in Northen California during the study period, suggesting no effect of these variants on immune escape.	False	B.1.617.1	B.1.617.1=True	VUM	4-Apr-2021		20-Sep-2021
p.L452R	c.T1355G	p.L452R			22917	S	S	MISSENSE	430	430	0						0	G=430	430	G	T	vaccine neutralization efficacy	Tada et al. (2021)	https://www.biorxiv.org/content/10.1101/2021.05.14.444076v1	'E484Q', 'D614G'	Pseudotyped viruses for B.1.617 was 4-fold resistant to neutralization by 6 BNT162b2 vaccine sera 28 days post-booster compared to wild type - a finding that was similar to that of the 3.4-fold resistance of the South Africa B.1.351 variant using the same assay. Neutralization by 3 Moderna vaccine sera 28 days post-booster was 5-fold resistant (vs. 2.2-fold for B.1.351). The resistance of B.1.617 was caused by the L452R and E484Q mutation, based on results from viruses pseudotyped for individual variants within B.1.617.	False	B.1.617.1	B.1.617.1=True	VUM	4-Apr-2021		20-Sep-2021
p.L452R	c.T1355G	p.L452R			22917	S	S	MISSENSE	430	430	0						0	G=430	430	G	T	vaccine neutralization efficacy	Wilhelm et al. (2021)	https://www.medrxiv.org/content/10.1101/2021.08.09.21261704v1	'D614G'	Relative to B.1, Epsilon (B.1.417/429) shows 1.74x-2.35x decrease in neutralization efficiency by 18 vaccinee sera (BNT162b2 and mRNA1273).	False	B.1.617.1	B.1.617.1=True	VUM	4-Apr-2021		20-Sep-2021
p.L452R	c.T1355G	p.L452R			22917	S	S	MISSENSE	430	430	0						0	G=430	430	G	T	vaccine neutralization efficacy	Wilhelm et al. (2021)	https://www.medrxiv.org/content/10.1101/2021.08.09.21261704v1	'G142D', 'E154K', 'E484Q', 'D614G', 'P681R', 'Q1071H'	Relative to B.1, Kappa (B.1.617.1) shows mean 1.97x decrease in neutralization efficiency by 18 vaccinee sera (BNT162b2 and mRNA1273).	False	B.1.617.1	B.1.617.1=True	VUM	4-Apr-2021		20-Sep-2021
p.L452R	c.T1355G	p.L452R			22917	S	S	MISSENSE	430	430	0						0	G=430	430	G	T	vaccine neutralization efficacy	Yadav et al. (2021)	https://www.biorxiv.org/content/10.1101/2021.04.23.441101v1	'G142D', 'E154K', 'E484Q', 'D614G', 'P681R', 'Q1071H'	Average 2x neutralization efficiency decrease against sera from 26 Phase II trial Covaxin (BBV152) vaccine recipents.  Very similar to B.1.1.7 (~2x) in the same study, and the neutralization from 17 sera of natural infections across B1 lineages.	False	B.1.617.1	B.1.617.1=True	VUM	4-Apr-2021		20-Sep-2021
p.L452R	c.T1355G	p.L452R			22917	S	S	MISSENSE	430	430	0						0	G=430	430	G	T	vaccinee plasma binding	Gong et al. (2021)	https://www.biorxiv.org/content/10.1101/2021.08.04.455140v1	'D614G'	1.05x decrease in Spike binding (relative to D614G alone) by 5 plasma collected 3 weeks after one dose of Pfizer/BioNtech BNT162b2 vaccine in previously non-seroconverted subjects. 1.16x decrease in Spike binding (relative to D614G alone) by 5 plasma collected 3 weeks after one dose of Pfizer/BioNtech BNT162b2 vaccine in post-infection vaccinees.	False	B.1.617.1	B.1.617.1=True	VUM	4-Apr-2021		20-Sep-2021
p.L452R	c.T1355G	p.L452R			22917	S	S	MISSENSE	430	430	0						0	G=430	430	G	T	vaccinee plasma binding	Gong et al. (2021)	https://www.biorxiv.org/content/10.1101/2021.08.04.455140v1	'E484Q', 'D614G'	This variant combination (representing lineage B.1.617) showed a 1.30x decrease in Spike binding (relative  to D614G alone) by 5 plasma collected 3 weeks after one dose of Pfizer/BioNtech BNT162b2 vaccine in previously non-seroconverted subjects.   1.18x decrease in Spike binding (relative to D614G alone) by 5 plasma collected 3 weeks after one dose of Pfizer/BioNtech BNT162b2 vaccine in post-infection vaccinees. [exact variant list not provided in manuscript, is inferred fro common knowledge]	False	B.1.617.1	B.1.617.1=True	VUM	4-Apr-2021		20-Sep-2021
p.L452R	c.T1355G	p.L452R			22917	S	S	MISSENSE	430	430	0						0	G=430	430	G	T	viral load	Yadav et al. (2021)	https://www.biorxiv.org/content/10.1101/2021.05.05.442760v1	'E484Q', 'P681R'	In 9 infected hamsters each for B.1 and B.1.617.1, no significant change in viral load or subgenomic RNA levels were detected. 	False	B.1.617.1	B.1.617.1=True	VUM	4-Apr-2021		20-Sep-2021
p.L452R	c.T1355G	p.L452R			22917	S	S	MISSENSE	430	430	0						0	G=430	430	G	T	virion structure	Spratt et al. (2021)	https://www.biorxiv.org/content/10.1101/2021.03.24.436850v1		Estimated free energy change (ddG) for this variant is -0.67 kcal/mol (i.e. destabilizing relative to wild type) 	False	B.1.617.1	B.1.617.1=True	VUM	4-Apr-2021		20-Sep-2021
p.L5580F	c.C16738T	p.L5580F			17002	orf1ab	ORF1ab	MISSENSE	430	430	0			helicase	nsp13_ZBD, nsp13_TB, and nsp_HEL1core, zinc-binding domain (ZD), NTPase/helicase domain (HEL), RNA 5'-triphosphatase, produced by pp1ab only	YP_009725308.1	186	T=244	244	T	C						False	B.1.617.1	B.1.617.1=False	VUM	4-Apr-2021		20-Sep-2021
p.M5753I	c.G17259T	p.M5753I			17523	orf1ab	ORF1ab	MISSENSE	430	430	0			helicase	nsp13_ZBD, nsp13_TB, and nsp_HEL1core, zinc-binding domain (ZD), NTPase/helicase domain (HEL), RNA 5'-triphosphatase, produced by pp1ab only	YP_009725308.1	0	T=430	430	T	G						False	B.1.617.1	B.1.617.1=True	VUM	4-Apr-2021		20-Sep-2021
p.N43Y	c.A127T	p.N43Y			27520	ORF7a	ORF7a	MISSENSE	424	430	0						75	T=349	349	T	A						False	B.1.617.1	B.1.617.1=True	VUM	4-Apr-2021		20-Sep-2021
p.P4715L	c.C14144T	p.P4715L			14408	orf1ab	ORF1ab	MISSENSE	430	430	0			RNA-dependent RNA polymerase	nsp12, NiRAN and RdRp, produced by pp1ab only	YP_009725307.1	0	T=430	430	T	C						False	B.1.617.1	B.1.617.1=True	VUM	4-Apr-2021		20-Sep-2021
p.P681R	c.C2042G	p.P681R			23604	S	S	MISSENSE	430	430	0						0	G=430	430	G	C	ACE2 receptor binding affinity	Gong et al. (2021)	https://www.biorxiv.org/content/10.1101/2021.08.04.455140v1	'G142D', 'E154K', 'L452R', 'E484Q', 'D614G', 'Q1071H'	"Using flow cytometry and ACE2 ectodomains-Fc portion IgG complex, this variant combination (representing lineage B.1.617.1) showed a 1.12x increase  in binding (KD) relative to D614G, but described as ""not significant"". [exact variant list not provided in manuscript, is inferred and  represents minimal set agreed upon commonly]"	False	B.1.617.1	B.1.617.1=True	VUM	4-Apr-2021		20-Sep-2021
p.P681R	c.C2042G	p.P681R			23604	S	S	MISSENSE	430	430	0						0	G=430	430	G	C	convalescent plasma escape	Wilhelm et al. (2021)	https://www.medrxiv.org/content/10.1101/2021.08.09.21261704v1	'G142D', 'E154K', 'L452R', 'E484Q', 'D614G', 'Q1071H'	Relative to B.1, Kappa (B.1.617.1) shows 5.71x decrease in neutralization efficiency by convalescent plasma [no cohort details provided]	False	B.1.617.1	B.1.617.1=True	VUM	4-Apr-2021		20-Sep-2021
p.P681R	c.C2042G	p.P681R			23604	S	S	MISSENSE	430	430	0						0	G=430	430	G	C	symptom prevalence	Yadav et al. (2021)	https://www.biorxiv.org/content/10.1101/2021.05.05.442760v1	'L452R', 'E484Q'	Gross examination of 3+3 hamster lung specimens showed pronounced congestion and hemorrhages on days 5 and 7 post-infection in the case of the B.1.617.1 as compared with the B.1. The lung lesions with  the B.1 variant were minimal to mild whereas with B.1.617.1 they were moderate. For B.1 pneumonic changes were minimal to mild (inflammatory cell infiltration, focal consolidation and mild congestion). The pronounced changes (moderate to severe) with mononuclear infiltration in the alveolar interstitial space, interstitial septal thickening, consolidation and pneumocyte hyperplasia were observed with B.1.617.1 variant consistently.	False	B.1.617.1	B.1.617.1=True	VUM	4-Apr-2021		20-Sep-2021
p.P681R	c.C2042G	p.P681R			23604	S	S	MISSENSE	430	430	0						0	G=430	430	G	C	trafficking	Esclera et al. (2021)	https://www.biorxiv.org/content/10.1101/2021.08.05.455290v1	'G142D', 'E154K', 'L452R', 'E484Q', 'D614G', 'Q1071H'	~3.5x cleavage of S2 relative to WA1 (D614G) wildtype by Kappa (B.1.617.1) variant as measured by mass spectrometry of Vero-TMPRSS culture (compare to ~4.5x for closely related Delta B.1.617.2 also with P681R at the cleavage site). 	False	B.1.617.1	B.1.617.1=True	VUM	4-Apr-2021		20-Sep-2021
p.P681R	c.C2042G	p.P681R			23604	S	S	MISSENSE	430	430	0						0	G=430	430	G	C	trafficking	Maaroufi (2021)	https://www.researchgate.net/publication/348943694_The_mutation_P681H_in_the_B117_variant_of_SARS-CoV-2_probably_enhances_viral_entry_and_replication		This mutation in the first base of the furin clevage site maintains the RXXR recognition motif, and is presumed to enhance cleavage based on the removal of a proline-directed phosphotase recognition site at S680. In a homologuous site in Infectious  Bronchitis Virus (IBV, Gammacoronaviruses), abolition of S680 phosphorylation improves furin cleavage  (and presumably cell entry). [Inference from similar positively charged substitution P681H actually described in the work]	False	B.1.617.1	B.1.617.1=True	VUM	4-Apr-2021		20-Sep-2021
p.P681R	c.C2042G	p.P681R			23604	S	S	MISSENSE	430	430	0						0	G=430	430	G	C	trafficking	Tada et al. (2021)	https://www.biorxiv.org/content/10.1101/2021.05.14.444076v1	'D614G'	Quantification of the band intensities showed that the P681R mutation, which lies near the proteolytic processing site,  caused a small increase in proteolytic processing as measured by a 2-fold decrease in the ratio of S/S2.	False	B.1.617.1	B.1.617.1=True	VUM	4-Apr-2021		20-Sep-2021
p.P681R	c.C2042G	p.P681R			23604	S	S	MISSENSE	430	430	0						0	G=430	430	G	C	transmissibility	Tada et al. (2021)	https://www.biorxiv.org/content/10.1101/2021.05.14.444076v1	'L452R', 'E484Q', 'D614G'	Normalized for particle number, on ACE2.293T cells showed that the B.1.617 spike protein was >2-fold increase in infectivity relative to D614G wild type.	False	B.1.617.1	B.1.617.1=True	VUM	4-Apr-2021		20-Sep-2021
p.P681R	c.C2042G	p.P681R			23604	S	S	MISSENSE	430	430	0						0	G=430	430	G	C	vaccine neutralization efficacy	Choi et al. (2021)	https://www.biorxiv.org/content/10.1101/2021.06.28.449914v1	'G142D', 'E154K', 'L452R', 'E484Q', 'D614G', 'Q1071H'	Inferring from two B.1.617.1 variants tested, estimate baseline 3.3x reduction in ID50 relative to D614G wildtype using pseudotyped VSV assay on 8 Moderna vaccinee sera one week post-booster.	False	B.1.617.1	B.1.617.1=True	VUM	4-Apr-2021		20-Sep-2021
p.P681R	c.C2042G	p.P681R			23604	S	S	MISSENSE	430	430	0						0	G=430	430	G	C	vaccine neutralization efficacy	Choi et al. (2021)	https://www.biorxiv.org/content/10.1101/2021.06.28.449914v1	'T95I', 'G142D', 'E154K', 'L452R', 'E484Q', 'D614G', 'Q1071H'	"Neutralization efficiency (ID50) against B.1.617.1-v1 (""Kappa"") reduced 3.4x relative to D614G wildtype using pseudotyped VSV assay on 8 Moderna vaccinee sera one week post-booster."	False	B.1.617.1	B.1.617.1=True	VUM	4-Apr-2021		20-Sep-2021
p.P681R	c.C2042G	p.P681R			23604	S	S	MISSENSE	430	430	0						0	G=430	430	G	C	vaccine neutralization efficacy	Gong et al. (2021)	https://www.biorxiv.org/content/10.1101/2021.08.04.455140v1	'G142D', 'E154K', 'L452R', 'E484Q', 'D614G', 'Q1071H'	1.5x reduction in neutralization (ID50) in sera 3 weeks after one dose of Pfizer/BioNTech BNT162b2 (up to 5 naive and post infection vaccinees) [exact set of variants used is not listed in the manuscript]	False	B.1.617.1	B.1.617.1=True	VUM	4-Apr-2021		20-Sep-2021
p.P681R	c.C2042G	p.P681R			23604	S	S	MISSENSE	430	430	0						0	G=430	430	G	C	vaccine neutralization efficacy	Wilhelm et al. (2021)	https://www.medrxiv.org/content/10.1101/2021.08.09.21261704v1	'G142D', 'E154K', 'L452R', 'E484Q', 'D614G', 'Q1071H'	Relative to B.1, Kappa (B.1.617.1) shows mean 1.97x decrease in neutralization efficiency by 18 vaccinee sera (BNT162b2 and mRNA1273).	False	B.1.617.1	B.1.617.1=True	VUM	4-Apr-2021		20-Sep-2021
