name	nt_name	aa_name	multi_aa_name	multiaa_mutation_split_names	start	vcf_gene	chrom_region	mutation_type	dp	obs_sample_size	variant_pop_size	ps_filter	ps_exc	mat_pep_id	mat_pep_desc	mat_pep_acc	ro	ao_by_var_seq	ao	variant_seq	reference_seq	function_category	citation	citation_url	comb_mutation	function_description	heterozygosity	viral_lineages	clade_defining_status	status	voi_designation_date	voc_designation_date	vum_designation_date
p.P681R	c.C2042G	p.P681R			23604	S	S	MISSENSE	430	430	0						0	G=430	430	G	C	vaccine neutralization efficacy	Yadav et al. (2021)	https://www.biorxiv.org/content/10.1101/2021.04.23.441101v1	'G142D', 'E154K', 'L452R', 'E484Q', 'D614G', 'Q1071H'	Average 2x neutralization efficiency decrease against sera from 26 Phase II trial Covaxin (BBV152) vaccine recipents.  Very similar to B.1.1.7 (~2x) in the same study, and the neutralization from 17 sera of natural infections across B1 lineages.	False	B.1.617.1	B.1.617.1=True	VUM	4-Apr-2021		20-Sep-2021
p.P681R	c.C2042G	p.P681R			23604	S	S	MISSENSE	430	430	0						0	G=430	430	G	C	viral load	Yadav et al. (2021)	https://www.biorxiv.org/content/10.1101/2021.05.05.442760v1	'L452R', 'E484Q'	In 9 infected hamsters each for B.1 and B.1.617.1, no significant change in viral load or subgenomic RNA levels were detected. 	False	B.1.617.1	B.1.617.1=True	VUM	4-Apr-2021		20-Sep-2021
p.P681R	c.C2042G	p.P681R			23604	S	S	MISSENSE	430	430	0						0	G=430	430	G	C	virion structure	Tada et al. (2021)	https://www.biorxiv.org/content/10.1101/2021.02.05.430003v1		The Ratio of S2 (processed Spike) to full length Spike is higher for this mutation,  due to a drop in the full length Spike measured, suggesting that this mutation compensates for decreased Spike production by improved proteolytic processing. [PG: Inferred by conservative AA substitution of described P681H]	False	B.1.617.1	B.1.617.1=True	VUM	4-Apr-2021		20-Sep-2021
p.Q1071H	c.A3213T	p.Q1071H			24775	S	S	MISSENSE	429	430	0						0	T=429	429	T	A	ACE2 receptor binding affinity	Gong et al. (2021)	https://www.biorxiv.org/content/10.1101/2021.08.04.455140v1	'G142D', 'E154K', 'L452R', 'E484Q', 'D614G', 'P681R'	"Using flow cytometry and ACE2 ectodomains-Fc portion IgG complex, this variant combination (representing lineage B.1.617.1) showed a 1.12x increase  in binding (KD) relative to D614G, but described as ""not significant"". [exact variant list not provided in manuscript, is inferred and  represents minimal set agreed upon commonly]"	False	B.1.617.1	B.1.617.1=True	VUM	4-Apr-2021		20-Sep-2021
p.Q1071H	c.A3213T	p.Q1071H			24775	S	S	MISSENSE	429	430	0						0	T=429	429	T	A	convalescent plasma escape	Wilhelm et al. (2021)	https://www.medrxiv.org/content/10.1101/2021.08.09.21261704v1	'G142D', 'E154K', 'L452R', 'E484Q', 'D614G', 'P681R'	Relative to B.1, Kappa (B.1.617.1) shows 5.71x decrease in neutralization efficiency by convalescent plasma [no cohort details provided]	False	B.1.617.1	B.1.617.1=True	VUM	4-Apr-2021		20-Sep-2021
p.Q1071H	c.A3213T	p.Q1071H			24775	S	S	MISSENSE	429	430	0						0	T=429	429	T	A	trafficking	Esclera et al. (2021)	https://www.biorxiv.org/content/10.1101/2021.08.05.455290v1	'G142D', 'E154K', 'L452R', 'E484Q', 'D614G', 'P681R'	~3.5x cleavage of S2 relative to WA1 (D614G) wildtype by Kappa (B.1.617.1) variant as measured by mass spectrometry of Vero-TMPRSS culture (compare to ~4.5x for closely related Delta B.1.617.2 also with P681R at the cleavage site). 	False	B.1.617.1	B.1.617.1=True	VUM	4-Apr-2021		20-Sep-2021
p.Q1071H	c.A3213T	p.Q1071H			24775	S	S	MISSENSE	429	430	0						0	T=429	429	T	A	vaccine neutralization efficacy	Choi et al. (2021)	https://www.biorxiv.org/content/10.1101/2021.06.28.449914v1	'G142D', 'E154K', 'L452R', 'E484Q', 'D614G', 'P681R'	Inferring from two B.1.617.1 variants tested, estimate baseline 3.3x reduction in ID50 relative to D614G wildtype using pseudotyped VSV assay on 8 Moderna vaccinee sera one week post-booster.	False	B.1.617.1	B.1.617.1=True	VUM	4-Apr-2021		20-Sep-2021
p.Q1071H	c.A3213T	p.Q1071H			24775	S	S	MISSENSE	429	430	0						0	T=429	429	T	A	vaccine neutralization efficacy	Choi et al. (2021)	https://www.biorxiv.org/content/10.1101/2021.06.28.449914v1	'T95I', 'G142D', 'E154K', 'L452R', 'E484Q', 'D614G', 'P681R'	"Neutralization efficiency (ID50) against B.1.617.1-v1 (""Kappa"") reduced 3.4x relative to D614G wildtype using pseudotyped VSV assay on 8 Moderna vaccinee sera one week post-booster."	False	B.1.617.1	B.1.617.1=True	VUM	4-Apr-2021		20-Sep-2021
p.Q1071H	c.A3213T	p.Q1071H			24775	S	S	MISSENSE	429	430	0						0	T=429	429	T	A	vaccine neutralization efficacy	Gong et al. (2021)	https://www.biorxiv.org/content/10.1101/2021.08.04.455140v1	'G142D', 'E154K', 'L452R', 'E484Q', 'D614G', 'P681R'	1.5x reduction in neutralization (ID50) in sera 3 weeks after one dose of Pfizer/BioNTech BNT162b2 (up to 5 naive and post infection vaccinees) [exact set of variants used is not listed in the manuscript]	False	B.1.617.1	B.1.617.1=True	VUM	4-Apr-2021		20-Sep-2021
p.Q1071H	c.A3213T	p.Q1071H			24775	S	S	MISSENSE	429	430	0						0	T=429	429	T	A	vaccine neutralization efficacy	Wilhelm et al. (2021)	https://www.medrxiv.org/content/10.1101/2021.08.09.21261704v1	'G142D', 'E154K', 'L452R', 'E484Q', 'D614G', 'P681R'	Relative to B.1, Kappa (B.1.617.1) shows mean 1.97x decrease in neutralization efficiency by 18 vaccinee sera (BNT162b2 and mRNA1273).	False	B.1.617.1	B.1.617.1=True	VUM	4-Apr-2021		20-Sep-2021
p.Q1071H	c.A3213T	p.Q1071H			24775	S	S	MISSENSE	429	430	0						0	T=429	429	T	A	vaccine neutralization efficacy	Yadav et al. (2021)	https://www.biorxiv.org/content/10.1101/2021.04.23.441101v1	'G142D', 'E154K', 'L452R', 'E484Q', 'D614G', 'P681R'	Average 2x neutralization efficiency decrease against sera from 26 Phase II trial Covaxin (BBV152) vaccine recipents.  Very similar to B.1.1.7 (~2x) in the same study, and the neutralization from 17 sera of natural infections across B1 lineages.	False	B.1.617.1	B.1.617.1=True	VUM	4-Apr-2021		20-Sep-2021
p.R203M	c.G608T	p.R203M			28881	N	N	MISSENSE	430	430	0	caution	neighbour_linked				0	T=430	430	T	G	RNA binding	Syed et al. (2021)	https://www.biorxiv.org/content/10.1101/2021.08.05.455082v1		Northern blot analysis of novel mutant virus-like-particles (VLPs) shows most increase in RNA content of any N mutation tested, suggesting that this mutation improves virus particle production (requisite RNA packaging signal binding site in nsp15/16 boundary is included in the VLP).	False	B.1.617.1	B.1.617.1=True	VUM	4-Apr-2021		20-Sep-2021
p.S26L	c.C77T	p.S26L			25469	ORF3a	ORF3a	MISSENSE	430	430	0						0	T=430	430	T	C						False	B.1.617.1	B.1.617.1=True	VUM	4-Apr-2021		20-Sep-2021
p.S6713A	c.T20137G	p.S6713A			20401	orf1ab	ORF1ab	MISSENSE	430	430	0			endoRNAse	nsp15-A1 and nsp15B-NendoU, produced by pp1ab only	YP_009725310.1	24	G=406	406	G	T						False	B.1.617.1	B.1.617.1=True	VUM	4-Apr-2021		20-Sep-2021
p.T1567I	c.C4700T	p.T1567I			4965	orf1ab	ORF1ab	MISSENSE	430	430	0			nsp3	former nsp1, conserved domains are: N-terminal acidic (Ac), predicted phosphoesterase, papain-like proteinase, Y-domain, transmembrane domain 1 (TM1), adenosine diphosphate-ribose 1''-phosphatase (ADRP), produced by both pp1a and pp1ab	YP_009725299.1	0	T=430	430	T	C						False	B.1.617.1	B.1.617.1=True	VUM	4-Apr-2021		20-Sep-2021
p.T3646A	c.A10936G	p.T3646A			11201	orf1ab	ORF1ab	MISSENSE	430	430	0			nsp6	nsp6_TM, putative transmembrane domain, produced by both pp1a and pp1ab	YP_009725302.1	0	G=430	430	G	A						False	B.1.617.1	B.1.617.1=True	VUM	4-Apr-2021		20-Sep-2021
p.T63T	c.T189A	p.T63T			21751	S	S	SILENT	427	430	0						381	A=46	46	A	T						False	B.1.617.1	B.1.617.1=False	VUM	4-Apr-2021		20-Sep-2021
p.T95I	c.C284T	p.T95I			21846	S	S	MISSENSE	428	430	0						31	T=397	397	T	C	ACE2 receptor binding affinity	Gong et al. (2021)	https://www.biorxiv.org/content/10.1101/2021.08.04.455140v1	'D614G'	Using flow cytometry and ACE2 ectodomains-Fc portion IgG complex, this variant showed a 1.33x decrease in binding (KD) relative to D614G.	False	B.1.617.1	B.1.617.1=True	VUM	4-Apr-2021		20-Sep-2021
p.T95I	c.C284T	p.T95I			21846	S	S	MISSENSE	428	430	0						31	T=397	397	T	C	convalescent plasma binding	Gong et al. (2021)	https://www.biorxiv.org/content/10.1101/2021.08.04.455140v1	'D614G'	No change in Spike binding (relative to D614G alone) by 5 plasma collected 8 months post-symptom-onset.	False	B.1.617.1	B.1.617.1=True	VUM	4-Apr-2021		20-Sep-2021
p.T95I	c.C284T	p.T95I			21846	S	S	MISSENSE	428	430	0						31	T=397	397	T	C	vaccine neutralization efficacy	Choi et al. (2021)	https://www.biorxiv.org/content/10.1101/2021.06.28.449914v1	'G142D', 'E154K', 'L452R', 'E484Q', 'D614G', 'P681R', 'Q1071H'	"Neutralization efficiency (ID50) against B.1.617.1-v1 (""Kappa"") reduced 3.4x relative to D614G wildtype using pseudotyped VSV assay on 8 Moderna vaccinee sera one week post-booster."	False	B.1.617.1	B.1.617.1=True	VUM	4-Apr-2021		20-Sep-2021
p.T95I	c.C284T	p.T95I			21846	S	S	MISSENSE	428	430	0						31	T=397	397	T	C	vaccinee plasma binding	Gong et al. (2021)	https://www.biorxiv.org/content/10.1101/2021.08.04.455140v1	'D614G'	1.16x increase in Spike binding (relative to D614G alone) by 5 plasma collected 3 weeks after one dose of Pfizer/BioNtech BNT162b2 vaccine in previously non-seroconverted subjects.  1.02x decrease in Spike binding (relative to D614G alone) by 5 plasma collected 3 weeks after one dose of Pfizer/BioNtech BNT162b2 vaccine in post-infection vaccinees.	False	B.1.617.1	B.1.617.1=True	VUM	4-Apr-2021		20-Sep-2021
p.V82A	c.T245C	p.V82A			27638	ORF7a	ORF7a	MISSENSE	424	430	0						0	C=424	424	C	T						False	B.1.617.1	B.1.617.1=True	VUM	4-Apr-2021		20-Sep-2021
p.Y1064Y	c.C3192T	p.Y1064Y			3457	orf1ab	ORF1ab	SILENT	430	430	0			nsp3	former nsp1, conserved domains are: N-terminal acidic (Ac), predicted phosphoesterase, papain-like proteinase, Y-domain, transmembrane domain 1 (TM1), adenosine diphosphate-ribose 1''-phosphatase (ADRP), produced by both pp1a and pp1ab	YP_009725299.1	0	T=430	430	T	C						False	B.1.617.1	B.1.617.1=True	VUM	4-Apr-2021		20-Sep-2021
