name	nt_name	aa_name	multi_aa_name	multiaa_comb_mutation	start	vcf_gene	chrom_region	mutation_type	sequence_depth	sample_size	ps_filter	ps_exc	mat_pep_id	mat_pep_desc	mat_pep_acc	ro	ao	reference_seq	variant_seq	viral_lineages	function_category	citation	comb_mutation	function_description	heterozygosity	clade_defining	who_variant	status	voi_designation_date	voc_designation_date	vum_designation_date
p.L452R	c.T1355G	p.L452R			22917	S	S	MISSENSE	407	407						0	407	T	G	B.1.617.1	trafficking	Ferriera et al (2021)		This variant alone shows a ~5x decrease in cell entry efficiency (RLU measurement in 293T cells) compared to D614G. [listed as L454R in Figure, but L452R in text, also text  suggests not statistucally significant, but error bars say otherwise in Figure 4]	False	True	Kappa	VUM	4-Apr-2021		20-Sep-2021
p.L452R	c.T1355G	p.L452R			22917	S	S	MISSENSE	407	407						0	407	T	G	B.1.617.1	trafficking	Motozono et al. (2021)		Increased stability of RBD expression in yeast, suggesting increased Spike protein stability.	False	True	Kappa	VUM	4-Apr-2021		20-Sep-2021
p.L452R	c.T1355G	p.L452R			22917	S	S	MISSENSE	407	407						0	407	T	G	B.1.617.1	transmissibility	Tada et al. (2021)	'D614G'	Increased infectivity of the B.1.617 spike was attributed to L452R, which itself caused a 3.5-fold increase in infectivity relative to D614G wild type.  [In combination with E484Q caused a lower 3-fold increase]	False	True	Kappa	VUM	4-Apr-2021		20-Sep-2021
p.L452R	c.T1355G	p.L452R			22917	S	S	MISSENSE	407	407						0	407	T	G	B.1.617.1	transmissibility	Tada et al. (2021)	'E484Q', 'D614G'	The combination caused a 3-fold increase in infectivity relative to D614G wild type. [compare to 3.5x for L452R alone]	False	True	Kappa	VUM	4-Apr-2021		20-Sep-2021
p.L452R	c.T1355G	p.L452R			22917	S	S	MISSENSE	407	407						0	407	T	G	B.1.617.1	transmissibility	Tada et al. (2021)	'E484Q', 'P681R', 'D614G'	Normalized for particle number, on ACE2.293T cells showed that the B.1.617 spike protein was >2-fold increase in infectivity relative to D614G wild type.	False	True	Kappa	VUM	4-Apr-2021		20-Sep-2021
p.L452R	c.T1355G	p.L452R			22917	S	S	MISSENSE	407	407						0	407	T	G	B.1.617.1	vaccine neutralization efficacy	Choi et al. (2021)	'G142D', 'E154K', 'E484Q', 'D614G', 'P681R', 'Q1071H'	Inferring from two B.1.617.1 variants tested, estimate baseline 3.3x reduction in ID50 relative to D614G wildtype using pseudotyped VSV assay on 8 Moderna vaccinee sera one week post-booster.	False	True	Kappa	VUM	4-Apr-2021		20-Sep-2021
p.L452R	c.T1355G	p.L452R			22917	S	S	MISSENSE	407	407						0	407	T	G	B.1.617.1	vaccine neutralization efficacy	Choi et al. (2021)	'T95I', 'G142D', 'E154K', 'E484Q', 'D614G', 'P681R', 'Q1071H'	"Neutralization efficiency (ID50) against B.1.617.1-v1 (""Kappa"") reduced 3.4x relative to D614G wildtype using pseudotyped VSV assay on 8 Moderna vaccinee sera one week post-booster."	False	True	Kappa	VUM	4-Apr-2021		20-Sep-2021
p.L452R	c.T1355G	p.L452R			22917	S	S	MISSENSE	407	407						0	407	T	G	B.1.617.1	vaccine neutralization efficacy	Ferreira et al. (2021)		Nine stored sera from Pfizer BNT162b2 vaccinees were tested against a range of spike mutation bearing PV. L452R conferred about a two-fold reduction in neutralisation by vaccine sera, but was not statistically significant with this sample size.	False	True	Kappa	VUM	4-Apr-2021		20-Sep-2021
p.L452R	c.T1355G	p.L452R			22917	S	S	MISSENSE	407	407						0	407	T	G	B.1.617.1	vaccine neutralization efficacy	Ferreira et al. (2021)	'E484Q'	Nine stored sera from Pfizer BNT162b2 vaccinees were tested against a range of spike mutation bearing PV. E484Q had a ~5x drop in neutralization (vs ~10x for E484K). When E484Q and L452R were combined, the fold change was significant, but similar to that of L452R alone (~2x), suggesting no evidence for an additive effect [perhaps even E484Q effect dilution]. 	False	True	Kappa	VUM	4-Apr-2021		20-Sep-2021
p.L452R	c.T1355G	p.L452R			22917	S	S	MISSENSE	407	407						0	407	T	G	B.1.617.1	vaccine neutralization efficacy	Gong et al. (2021)	'E484Q', 'D614G'	1.4x reduction in neutralization (ID50) in sera 3 weeks after one dose of Pfizer/BioNTech BNT162b2 (up to 5 naive and post infection vaccinees)	False	True	Kappa	VUM	4-Apr-2021		20-Sep-2021
p.L452R	c.T1355G	p.L452R			22917	S	S	MISSENSE	407	407						0	407	T	G	B.1.617.1	vaccine neutralization efficacy	Gong et al. (2021)	'G142D', 'E154K', 'E484Q', 'D614G', 'P681R', 'Q1071H'	1.5x reduction in neutralization (ID50) in sera 3 weeks after one dose of Pfizer/BioNTech BNT162b2 (up to 5 naive and post infection vaccinees) [exact set of variants used is not listed in the manuscript]	False	True	Kappa	VUM	4-Apr-2021		20-Sep-2021
p.L452R	c.T1355G	p.L452R			22917	S	S	MISSENSE	407	407						0	407	T	G	B.1.617.1	vaccine neutralization efficacy	Jacobson et al. (2021)		The presence of this variant in 189 post-mRNA-vaccination COVID-19 cases was proportionally in line with lineage prevalence in Northen California during the study period, suggesting no effect of these variants on immune escape.	False	True	Kappa	VUM	4-Apr-2021		20-Sep-2021
p.L452R	c.T1355G	p.L452R			22917	S	S	MISSENSE	407	407						0	407	T	G	B.1.617.1	vaccine neutralization efficacy	Tada et al. (2021)	'E484Q', 'D614G'	Pseudotyped viruses for B.1.617 was 4-fold resistant to neutralization by 6 BNT162b2 vaccine sera 28 days post-booster compared to wild type - a finding that was similar to that of the 3.4-fold resistance of the South Africa B.1.351 variant using the same assay. Neutralization by 3 Moderna vaccine sera 28 days post-booster was 5-fold resistant (vs. 2.2-fold for B.1.351). The resistance of B.1.617 was caused by the L452R and E484Q mutation, based on results from viruses pseudotyped for individual variants within B.1.617.	False	True	Kappa	VUM	4-Apr-2021		20-Sep-2021
p.L452R	c.T1355G	p.L452R			22917	S	S	MISSENSE	407	407						0	407	T	G	B.1.617.1	vaccine neutralization efficacy	Wilhelm et al. (2021)	'D614G'	Relative to B.1, Epsilon (B.1.417/429) shows 1.74x-2.35x decrease in neutralization efficiency by 18 vaccinee sera (BNT162b2 and mRNA1273).	False	True	Kappa	VUM	4-Apr-2021		20-Sep-2021
p.L452R	c.T1355G	p.L452R			22917	S	S	MISSENSE	407	407						0	407	T	G	B.1.617.1	vaccine neutralization efficacy	Wilhelm et al. (2021)	'G142D', 'E154K', 'E484Q', 'D614G', 'P681R', 'Q1071H'	Relative to B.1, Kappa (B.1.617.1) shows mean 1.97x decrease in neutralization efficiency by 18 vaccinee sera (BNT162b2 and mRNA1273).	False	True	Kappa	VUM	4-Apr-2021		20-Sep-2021
p.L452R	c.T1355G	p.L452R			22917	S	S	MISSENSE	407	407						0	407	T	G	B.1.617.1	vaccine neutralization efficacy	Yadav et al. (2021)	'G142D', 'E154K', 'E484Q', 'D614G', 'P681R', 'Q1071H'	Average 2x neutralization efficiency decrease against sera from 26 Phase II trial Covaxin (BBV152) vaccine recipents.  Very similar to B.1.1.7 (~2x) in the same study, and the neutralization from 17 sera of natural infections across B1 lineages.	False	True	Kappa	VUM	4-Apr-2021		20-Sep-2021
p.L452R	c.T1355G	p.L452R			22917	S	S	MISSENSE	407	407						0	407	T	G	B.1.617.1	vaccinee plasma binding	Gong et al. (2021)	'D614G'	1.05x decrease in Spike binding (relative to D614G alone) by 5 plasma collected 3 weeks after one dose of Pfizer/BioNtech BNT162b2 vaccine in previously non-seroconverted subjects. 1.16x decrease in Spike binding (relative to D614G alone) by 5 plasma collected 3 weeks after one dose of Pfizer/BioNtech BNT162b2 vaccine in post-infection vaccinees.	False	True	Kappa	VUM	4-Apr-2021		20-Sep-2021
p.L452R	c.T1355G	p.L452R			22917	S	S	MISSENSE	407	407						0	407	T	G	B.1.617.1	vaccinee plasma binding	Gong et al. (2021)	'E484Q', 'D614G'	This variant combination (representing lineage B.1.617) showed a 1.30x decrease in Spike binding (relative  to D614G alone) by 5 plasma collected 3 weeks after one dose of Pfizer/BioNtech BNT162b2 vaccine in previously non-seroconverted subjects.   1.18x decrease in Spike binding (relative to D614G alone) by 5 plasma collected 3 weeks after one dose of Pfizer/BioNtech BNT162b2 vaccine in post-infection vaccinees. [exact variant list not provided in manuscript, is inferred fro common knowledge]	False	True	Kappa	VUM	4-Apr-2021		20-Sep-2021
p.L452R	c.T1355G	p.L452R			22917	S	S	MISSENSE	407	407						0	407	T	G	B.1.617.1	viral load	Yadav et al. (2021)	'E484Q', 'P681R'	In 9 infected hamsters each for B.1 and B.1.617.1, no significant change in viral load or subgenomic RNA levels were detected. 	False	True	Kappa	VUM	4-Apr-2021		20-Sep-2021
p.L452R	c.T1355G	p.L452R			22917	S	S	MISSENSE	407	407						0	407	T	G	B.1.617.1	virion structure	Spratt et al. (2021)		Estimated free energy change (ddG) for this variant is -0.67 kcal/mol (i.e. destabilizing relative to wild type) 	False	True	Kappa	VUM	4-Apr-2021		20-Sep-2021
p.L5580F	c.C16738T	p.L5580F			17002	orf1ab	ORF1ab	MISSENSE	407	407			helicase	nsp13_ZBD, nsp13_TB, and nsp_HEL1core, zinc-binding domain (ZD), NTPase/helicase domain (HEL), RNA 5'-triphosphatase, produced by pp1ab only	YP_009725308.1	166	241	C	T	B.1.617.1					False	False	Kappa	VUM	4-Apr-2021		20-Sep-2021
p.M5753I	c.G17259T	p.M5753I			17523	orf1ab	ORF1ab	MISSENSE	407	407			helicase	nsp13_ZBD, nsp13_TB, and nsp_HEL1core, zinc-binding domain (ZD), NTPase/helicase domain (HEL), RNA 5'-triphosphatase, produced by pp1ab only	YP_009725308.1	0	407	G	T	B.1.617.1					False	True	Kappa	VUM	4-Apr-2021		20-Sep-2021
p.N43Y	c.A127T	p.N43Y			27520	ORF7a	ORF7a	MISSENSE	401	407						69	332	A	T	B.1.617.1					False	True	Kappa	VUM	4-Apr-2021		20-Sep-2021
p.P4715L	c.C14144T	p.P4715L			14408	orf1ab	ORF1ab	MISSENSE	407	407			RNA-dependent RNA polymerase	nsp12, NiRAN and RdRp, produced by pp1ab only	YP_009725307.1	0	407	C	T	B.1.617.1					False	True	Kappa	VUM	4-Apr-2021		20-Sep-2021
p.P681R	c.C2042G	p.P681R			23604	S	S	MISSENSE	407	407						0	407	C	G	B.1.617.1	ACE2 receptor binding affinity	Gong et al. (2021)	'G142D', 'E154K', 'L452R', 'E484Q', 'D614G', 'Q1071H'	"Using flow cytometry and ACE2 ectodomains-Fc portion IgG complex, this variant combination (representing lineage B.1.617.1) showed a 1.12x increase  in binding (KD) relative to D614G, but described as ""not significant"". [exact variant list not provided in manuscript, is inferred and  represents minimal set agreed upon commonly]"	False	True	Kappa	VUM	4-Apr-2021		20-Sep-2021
p.P681R	c.C2042G	p.P681R			23604	S	S	MISSENSE	407	407						0	407	C	G	B.1.617.1	convalescent plasma escape	Wilhelm et al. (2021)	'G142D', 'E154K', 'L452R', 'E484Q', 'D614G', 'Q1071H'	Relative to B.1, Kappa (B.1.617.1) shows 5.71x decrease in neutralization efficiency by convalescent plasma [no cohort details provided]	False	True	Kappa	VUM	4-Apr-2021		20-Sep-2021
p.P681R	c.C2042G	p.P681R			23604	S	S	MISSENSE	407	407						0	407	C	G	B.1.617.1	symptom prevalence	Yadav et al. (2021)	'L452R', 'E484Q'	Gross examination of 3+3 hamster lung specimens showed pronounced congestion and hemorrhages on days 5 and 7 post-infection in the case of the B.1.617.1 as compared with the B.1. The lung lesions with  the B.1 variant were minimal to mild whereas with B.1.617.1 they were moderate. For B.1 pneumonic changes were minimal to mild (inflammatory cell infiltration, focal consolidation and mild congestion). The pronounced changes (moderate to severe) with mononuclear infiltration in the alveolar interstitial space, interstitial septal thickening, consolidation and pneumocyte hyperplasia were observed with B.1.617.1 variant consistently.	False	True	Kappa	VUM	4-Apr-2021		20-Sep-2021
p.P681R	c.C2042G	p.P681R			23604	S	S	MISSENSE	407	407						0	407	C	G	B.1.617.1	trafficking	Esclera et al. (2021)	'G142D', 'E154K', 'L452R', 'E484Q', 'D614G', 'Q1071H'	~3.5x cleavage of S2 relative to WA1 (D614G) wildtype by Kappa (B.1.617.1) variant as measured by mass spectrometry of Vero-TMPRSS culture (compare to ~4.5x for closely related Delta B.1.617.2 also with P681R at the cleavage site). 	False	True	Kappa	VUM	4-Apr-2021		20-Sep-2021
p.P681R	c.C2042G	p.P681R			23604	S	S	MISSENSE	407	407						0	407	C	G	B.1.617.1	trafficking	Maaroufi (2021)		This mutation in the first base of the furin clevage site maintains the RXXR recognition motif, and is presumed to enhance cleavage based on the removal of a proline-directed phosphotase recognition site at S680. In a homologuous site in Infectious  Bronchitis Virus (IBV, Gammacoronaviruses), abolition of S680 phosphorylation improves furin cleavage  (and presumably cell entry). [Inference from similar positively charged substitution P681H actually described in the work]	False	True	Kappa	VUM	4-Apr-2021		20-Sep-2021
p.P681R	c.C2042G	p.P681R			23604	S	S	MISSENSE	407	407						0	407	C	G	B.1.617.1	trafficking	Tada et al. (2021)	'D614G'	Quantification of the band intensities showed that the P681R mutation, which lies near the proteolytic processing site,  caused a small increase in proteolytic processing as measured by a 2-fold decrease in the ratio of S/S2.	False	True	Kappa	VUM	4-Apr-2021		20-Sep-2021
p.P681R	c.C2042G	p.P681R			23604	S	S	MISSENSE	407	407						0	407	C	G	B.1.617.1	transmissibility	Tada et al. (2021)	'L452R', 'E484Q', 'D614G'	Normalized for particle number, on ACE2.293T cells showed that the B.1.617 spike protein was >2-fold increase in infectivity relative to D614G wild type.	False	True	Kappa	VUM	4-Apr-2021		20-Sep-2021
p.P681R	c.C2042G	p.P681R			23604	S	S	MISSENSE	407	407						0	407	C	G	B.1.617.1	vaccine neutralization efficacy	Choi et al. (2021)	'G142D', 'E154K', 'L452R', 'E484Q', 'D614G', 'Q1071H'	Inferring from two B.1.617.1 variants tested, estimate baseline 3.3x reduction in ID50 relative to D614G wildtype using pseudotyped VSV assay on 8 Moderna vaccinee sera one week post-booster.	False	True	Kappa	VUM	4-Apr-2021		20-Sep-2021
p.P681R	c.C2042G	p.P681R			23604	S	S	MISSENSE	407	407						0	407	C	G	B.1.617.1	vaccine neutralization efficacy	Choi et al. (2021)	'T95I', 'G142D', 'E154K', 'L452R', 'E484Q', 'D614G', 'Q1071H'	"Neutralization efficiency (ID50) against B.1.617.1-v1 (""Kappa"") reduced 3.4x relative to D614G wildtype using pseudotyped VSV assay on 8 Moderna vaccinee sera one week post-booster."	False	True	Kappa	VUM	4-Apr-2021		20-Sep-2021
p.P681R	c.C2042G	p.P681R			23604	S	S	MISSENSE	407	407						0	407	C	G	B.1.617.1	vaccine neutralization efficacy	Gong et al. (2021)	'G142D', 'E154K', 'L452R', 'E484Q', 'D614G', 'Q1071H'	1.5x reduction in neutralization (ID50) in sera 3 weeks after one dose of Pfizer/BioNTech BNT162b2 (up to 5 naive and post infection vaccinees) [exact set of variants used is not listed in the manuscript]	False	True	Kappa	VUM	4-Apr-2021		20-Sep-2021
p.P681R	c.C2042G	p.P681R			23604	S	S	MISSENSE	407	407						0	407	C	G	B.1.617.1	vaccine neutralization efficacy	Wilhelm et al. (2021)	'G142D', 'E154K', 'L452R', 'E484Q', 'D614G', 'Q1071H'	Relative to B.1, Kappa (B.1.617.1) shows mean 1.97x decrease in neutralization efficiency by 18 vaccinee sera (BNT162b2 and mRNA1273).	False	True	Kappa	VUM	4-Apr-2021		20-Sep-2021
p.P681R	c.C2042G	p.P681R			23604	S	S	MISSENSE	407	407						0	407	C	G	B.1.617.1	vaccine neutralization efficacy	Yadav et al. (2021)	'G142D', 'E154K', 'L452R', 'E484Q', 'D614G', 'Q1071H'	Average 2x neutralization efficiency decrease against sera from 26 Phase II trial Covaxin (BBV152) vaccine recipents.  Very similar to B.1.1.7 (~2x) in the same study, and the neutralization from 17 sera of natural infections across B1 lineages.	False	True	Kappa	VUM	4-Apr-2021		20-Sep-2021
p.P681R	c.C2042G	p.P681R			23604	S	S	MISSENSE	407	407						0	407	C	G	B.1.617.1	viral load	Yadav et al. (2021)	'L452R', 'E484Q'	In 9 infected hamsters each for B.1 and B.1.617.1, no significant change in viral load or subgenomic RNA levels were detected. 	False	True	Kappa	VUM	4-Apr-2021		20-Sep-2021
p.P681R	c.C2042G	p.P681R			23604	S	S	MISSENSE	407	407						0	407	C	G	B.1.617.1	virion structure	Tada et al. (2021)		The Ratio of S2 (processed Spike) to full length Spike is higher for this mutation,  due to a drop in the full length Spike measured, suggesting that this mutation compensates for decreased Spike production by improved proteolytic processing. [PG: Inferred by conservative AA substitution of described P681H]	False	True	Kappa	VUM	4-Apr-2021		20-Sep-2021
p.Q1071H	c.A3213T	p.Q1071H			24775	S	S	MISSENSE	406	407						0	406	A	T	B.1.617.1	ACE2 receptor binding affinity	Gong et al. (2021)	'G142D', 'E154K', 'L452R', 'E484Q', 'D614G', 'P681R'	"Using flow cytometry and ACE2 ectodomains-Fc portion IgG complex, this variant combination (representing lineage B.1.617.1) showed a 1.12x increase  in binding (KD) relative to D614G, but described as ""not significant"". [exact variant list not provided in manuscript, is inferred and  represents minimal set agreed upon commonly]"	False	True	Kappa	VUM	4-Apr-2021		20-Sep-2021
p.Q1071H	c.A3213T	p.Q1071H			24775	S	S	MISSENSE	406	407						0	406	A	T	B.1.617.1	convalescent plasma escape	Wilhelm et al. (2021)	'G142D', 'E154K', 'L452R', 'E484Q', 'D614G', 'P681R'	Relative to B.1, Kappa (B.1.617.1) shows 5.71x decrease in neutralization efficiency by convalescent plasma [no cohort details provided]	False	True	Kappa	VUM	4-Apr-2021		20-Sep-2021
p.Q1071H	c.A3213T	p.Q1071H			24775	S	S	MISSENSE	406	407						0	406	A	T	B.1.617.1	trafficking	Esclera et al. (2021)	'G142D', 'E154K', 'L452R', 'E484Q', 'D614G', 'P681R'	~3.5x cleavage of S2 relative to WA1 (D614G) wildtype by Kappa (B.1.617.1) variant as measured by mass spectrometry of Vero-TMPRSS culture (compare to ~4.5x for closely related Delta B.1.617.2 also with P681R at the cleavage site). 	False	True	Kappa	VUM	4-Apr-2021		20-Sep-2021
p.Q1071H	c.A3213T	p.Q1071H			24775	S	S	MISSENSE	406	407						0	406	A	T	B.1.617.1	vaccine neutralization efficacy	Choi et al. (2021)	'G142D', 'E154K', 'L452R', 'E484Q', 'D614G', 'P681R'	Inferring from two B.1.617.1 variants tested, estimate baseline 3.3x reduction in ID50 relative to D614G wildtype using pseudotyped VSV assay on 8 Moderna vaccinee sera one week post-booster.	False	True	Kappa	VUM	4-Apr-2021		20-Sep-2021
p.Q1071H	c.A3213T	p.Q1071H			24775	S	S	MISSENSE	406	407						0	406	A	T	B.1.617.1	vaccine neutralization efficacy	Choi et al. (2021)	'T95I', 'G142D', 'E154K', 'L452R', 'E484Q', 'D614G', 'P681R'	"Neutralization efficiency (ID50) against B.1.617.1-v1 (""Kappa"") reduced 3.4x relative to D614G wildtype using pseudotyped VSV assay on 8 Moderna vaccinee sera one week post-booster."	False	True	Kappa	VUM	4-Apr-2021		20-Sep-2021
p.Q1071H	c.A3213T	p.Q1071H			24775	S	S	MISSENSE	406	407						0	406	A	T	B.1.617.1	vaccine neutralization efficacy	Gong et al. (2021)	'G142D', 'E154K', 'L452R', 'E484Q', 'D614G', 'P681R'	1.5x reduction in neutralization (ID50) in sera 3 weeks after one dose of Pfizer/BioNTech BNT162b2 (up to 5 naive and post infection vaccinees) [exact set of variants used is not listed in the manuscript]	False	True	Kappa	VUM	4-Apr-2021		20-Sep-2021
p.Q1071H	c.A3213T	p.Q1071H			24775	S	S	MISSENSE	406	407						0	406	A	T	B.1.617.1	vaccine neutralization efficacy	Wilhelm et al. (2021)	'G142D', 'E154K', 'L452R', 'E484Q', 'D614G', 'P681R'	Relative to B.1, Kappa (B.1.617.1) shows mean 1.97x decrease in neutralization efficiency by 18 vaccinee sera (BNT162b2 and mRNA1273).	False	True	Kappa	VUM	4-Apr-2021		20-Sep-2021
p.Q1071H	c.A3213T	p.Q1071H			24775	S	S	MISSENSE	406	407						0	406	A	T	B.1.617.1	vaccine neutralization efficacy	Yadav et al. (2021)	'G142D', 'E154K', 'L452R', 'E484Q', 'D614G', 'P681R'	Average 2x neutralization efficiency decrease against sera from 26 Phase II trial Covaxin (BBV152) vaccine recipents.  Very similar to B.1.1.7 (~2x) in the same study, and the neutralization from 17 sera of natural infections across B1 lineages.	False	True	Kappa	VUM	4-Apr-2021		20-Sep-2021
p.R203M	c.G608T	p.R203M			28881	N	N	MISSENSE	407	407	caution	neighbour_linked				0	407	G	T	B.1.617.1	RNA binding	Syed et al. (2021)		Northern blot analysis of novel mutant virus-like-particles (VLPs) shows most increase in RNA content of any N mutation tested, suggesting that this mutation improves virus particle production (requisite RNA packaging signal binding site in nsp15/16 boundary is included in the VLP).	False	True	Kappa	VUM	4-Apr-2021		20-Sep-2021
p.S26L	c.C77T	p.S26L			25469	ORF3a	ORF3a	MISSENSE	407	407						0	407	C	T	B.1.617.1					False	True	Kappa	VUM	4-Apr-2021		20-Sep-2021
p.S6713A	c.T20137G	p.S6713A			20401	orf1ab	ORF1ab	MISSENSE	407	407			endoRNAse	nsp15-A1 and nsp15B-NendoU, produced by pp1ab only	YP_009725310.1	21	386	T	G	B.1.617.1					False	True	Kappa	VUM	4-Apr-2021		20-Sep-2021
p.T1567I	c.C4700T	p.T1567I			4965	orf1ab	ORF1ab	MISSENSE	407	407			nsp3	former nsp1, conserved domains are: N-terminal acidic (Ac), predicted phosphoesterase, papain-like proteinase, Y-domain, transmembrane domain 1 (TM1), adenosine diphosphate-ribose 1''-phosphatase (ADRP), produced by both pp1a and pp1ab	YP_009725299.1	0	407	C	T	B.1.617.1					False	True	Kappa	VUM	4-Apr-2021		20-Sep-2021
p.T3646A	c.A10936G	p.T3646A			11201	orf1ab	ORF1ab	MISSENSE	407	407			nsp6	nsp6_TM, putative transmembrane domain, produced by both pp1a and pp1ab	YP_009725302.1	0	407	A	G	B.1.617.1					False	True	Kappa	VUM	4-Apr-2021		20-Sep-2021
p.T95I	c.C284T	p.T95I			21846	S	S	MISSENSE	405	407						28	377	C	T	B.1.617.1	ACE2 receptor binding affinity	Gong et al. (2021)	'D614G'	Using flow cytometry and ACE2 ectodomains-Fc portion IgG complex, this variant showed a 1.33x decrease in binding (KD) relative to D614G.	False	True	Kappa	VUM	4-Apr-2021		20-Sep-2021
p.T95I	c.C284T	p.T95I			21846	S	S	MISSENSE	405	407						28	377	C	T	B.1.617.1	convalescent plasma binding	Gong et al. (2021)	'D614G'	No change in Spike binding (relative to D614G alone) by 5 plasma collected 8 months post-symptom-onset.	False	True	Kappa	VUM	4-Apr-2021		20-Sep-2021
p.T95I	c.C284T	p.T95I			21846	S	S	MISSENSE	405	407						28	377	C	T	B.1.617.1	vaccine neutralization efficacy	Choi et al. (2021)	'G142D', 'E154K', 'L452R', 'E484Q', 'D614G', 'P681R', 'Q1071H'	"Neutralization efficiency (ID50) against B.1.617.1-v1 (""Kappa"") reduced 3.4x relative to D614G wildtype using pseudotyped VSV assay on 8 Moderna vaccinee sera one week post-booster."	False	True	Kappa	VUM	4-Apr-2021		20-Sep-2021
p.T95I	c.C284T	p.T95I			21846	S	S	MISSENSE	405	407						28	377	C	T	B.1.617.1	vaccinee plasma binding	Gong et al. (2021)	'D614G'	1.16x increase in Spike binding (relative to D614G alone) by 5 plasma collected 3 weeks after one dose of Pfizer/BioNtech BNT162b2 vaccine in previously non-seroconverted subjects.  1.02x decrease in Spike binding (relative to D614G alone) by 5 plasma collected 3 weeks after one dose of Pfizer/BioNtech BNT162b2 vaccine in post-infection vaccinees.	False	True	Kappa	VUM	4-Apr-2021		20-Sep-2021
p.V82A	c.T245C	p.V82A			27638	ORF7a	ORF7a	MISSENSE	401	407						0	401	T	C	B.1.617.1					False	True	Kappa	VUM	4-Apr-2021		20-Sep-2021
p.Y1064Y	c.C3192T	p.Y1064Y			3457	orf1ab	ORF1ab	SILENT	407	407			nsp3	former nsp1, conserved domains are: N-terminal acidic (Ac), predicted phosphoesterase, papain-like proteinase, Y-domain, transmembrane domain 1 (TM1), adenosine diphosphate-ribose 1''-phosphatase (ADRP), produced by both pp1a and pp1ab	YP_009725299.1	0	407	C	T	B.1.617.1					False	True	Kappa	VUM	4-Apr-2021		20-Sep-2021
