name	nt_name	aa_name	multi_aa_name	multiaa_comb_mutation	start	vcf_gene	chrom_region	mutation_type	sequence_depth	sample_size	ps_filter	ps_exc	mat_pep_id	mat_pep_desc	mat_pep_acc	ro	ao	reference_seq	variant_seq	viral_lineages	function_category	citation	comb_mutation	function_description	heterozygosity	clade_defining	who_variant	status	voi_designation_date	voc_designation_date	vum_designation_date
c.-3delA	c.-3delA				28270	N	intergenic		406	407						0	406	TA	T	B.1.617.1					False	True	Kappa	VUM	4-Apr-2021		20-Sep-2021
c.C-25T	c.C-25T				241	orf1ab	5' UTR		407	407						0	407	C	T	B.1.617.1					False	True	Kappa	VUM	4-Apr-2021		20-Sep-2021
c.G-56T	c.G-56T				210	orf1ab	5' UTR		407	407						0	407	G	T	B.1.617.1					False	True	Kappa	VUM	4-Apr-2021		20-Sep-2021
c.G29742T	c.G*4358T				29742	intergenic	Stem-loop,3' UTR		403	407						0	403	G	T	B.1.617.1					False	True	Kappa	VUM	4-Apr-2021		20-Sep-2021
c.G29781T	c.G*4397T				29781	intergenic	3' UTR		37	407						33	4	G	T	B.1.617.1					False	False	Kappa	VUM	4-Apr-2021		20-Sep-2021
p.A5692S	c.G17074T	p.A5692S			17338	orf1ab	ORF1ab	MISSENSE	407	407			helicase	nsp13_ZBD, nsp13_TB, and nsp_HEL1core, zinc-binding domain (ZD), NTPase/helicase domain (HEL), RNA 5'-triphosphatase, produced by pp1ab only	YP_009725308.1	69	338	G	T	B.1.617.1					False	True	Kappa	VUM	4-Apr-2021		20-Sep-2021
p.D111D	c.T333C	p.D111D			21895	S	S	SILENT	402	407						0	402	T	C	B.1.617.1					False	True	Kappa	VUM	4-Apr-2021		20-Sep-2021
p.D377Y	c.G1129T	p.D377Y			29402	N	N	MISSENSE	407	407						0	407	G	T	B.1.617.1					False	True	Kappa	VUM	4-Apr-2021		20-Sep-2021
p.D614G	c.A1841G	p.D614G			23403	S	S	MISSENSE	407	407						0	407	A	G	B.1.617.1	ACE2 receptor binding affinity	Gong et al. (2021)	'G142D', 'E154K', 'L452R', 'E484Q', 'P681R', 'Q1071H'	"Using flow cytometry and ACE2 ectodomains-Fc portion IgG complex, this variant combination (representing lineage B.1.617.1) showed a 1.12x increase  in binding (KD) relative to D614G, but described as ""not significant"". [exact variant list not provided in manuscript, is inferred and  represents minimal set agreed upon commonly]"	False	True	Kappa	VUM	4-Apr-2021		20-Sep-2021
p.D614G	c.A1841G	p.D614G			23403	S	S	MISSENSE	407	407						0	407	A	G	B.1.617.1	ACE2 receptor binding affinity	Gong et al. (2021)	'L452R'	Using flow cytometry and ACE2 ectodomains-Fc portion IgG complex, this variant showed a 2.66x increase in binding (KD) relative to D614G.	False	True	Kappa	VUM	4-Apr-2021		20-Sep-2021
p.D614G	c.A1841G	p.D614G			23403	S	S	MISSENSE	407	407						0	407	A	G	B.1.617.1	ACE2 receptor binding affinity	Gong et al. (2021)	'L452R', 'E484Q'	Using flow cytometry and ACE2 ectodomains-Fc portion IgG complex, this variant combination (representing lineage B.1.617) showed a 1.85x increase  in binding (KD) relative to D614G. [exact variant list not provided in manuscript, is inferred fro common knowledge]	False	True	Kappa	VUM	4-Apr-2021		20-Sep-2021
p.D614G	c.A1841G	p.D614G			23403	S	S	MISSENSE	407	407						0	407	A	G	B.1.617.1	ACE2 receptor binding affinity	Gong et al. (2021)	'T95I'	Using flow cytometry and ACE2 ectodomains-Fc portion IgG complex, this variant showed a 1.33x decrease in binding (KD) relative to D614G.	False	True	Kappa	VUM	4-Apr-2021		20-Sep-2021
p.D614G	c.A1841G	p.D614G			23403	S	S	MISSENSE	407	407						0	407	A	G	B.1.617.1	ACE2 receptor binding affinity	Li et al. (2020)		In four cell lines (including 293T-hACE2 cells), this mutation combination increases infectivity vs D614G alone	False	True	Kappa	VUM	4-Apr-2021		20-Sep-2021
p.D614G	c.A1841G	p.D614G			23403	S	S	MISSENSE	407	407						0	407	A	G	B.1.617.1	convalescent plasma binding	Gong et al. (2021)	'L452R'	2.15x increase in Spike binding (relative to D614G alone) by 5 plasma collected 8 months post-symptom-onset.	False	True	Kappa	VUM	4-Apr-2021		20-Sep-2021
p.D614G	c.A1841G	p.D614G			23403	S	S	MISSENSE	407	407						0	407	A	G	B.1.617.1	convalescent plasma binding	Gong et al. (2021)	'L452R', 'E484Q'	This variant combination (representing lineage B.1.617) showed a 1.22x decrease in Spike binding (relative  to D614G alone) by 5 plasma collected 8 months post-symptom-onset. [exact variant list not provided in manuscript, is inferred fro common knowledge]	False	True	Kappa	VUM	4-Apr-2021		20-Sep-2021
p.D614G	c.A1841G	p.D614G			23403	S	S	MISSENSE	407	407						0	407	A	G	B.1.617.1	convalescent plasma binding	Gong et al. (2021)	'T95I'	No change in Spike binding (relative to D614G alone) by 5 plasma collected 8 months post-symptom-onset.	False	True	Kappa	VUM	4-Apr-2021		20-Sep-2021
p.D614G	c.A1841G	p.D614G			23403	S	S	MISSENSE	407	407						0	407	A	G	B.1.617.1	convalescent plasma escape	Tada et al. (2021)	'L452R', 'E484Q'	Pseudotyped viruses for B.1.617 was 2.3-fold resistant to neutralization by convalescent sera compared to wild type - a finding that was similar to that of the 3-fold resistance of the South Africa B.1.351 variant using the same assay. The resistance of B.1.617 was caused by the L452R and E484Q mutation, based on results from viruses pseudotyped for individual variants within B.1.617. [details on the convalescent patient sera collection are not abundantly clear in the preprint]	False	True	Kappa	VUM	4-Apr-2021		20-Sep-2021
p.D614G	c.A1841G	p.D614G			23403	S	S	MISSENSE	407	407						0	407	A	G	B.1.617.1	convalescent plasma escape	Wilhelm et al. (2021)	'G142D', 'E154K', 'L452R', 'E484Q', 'P681R', 'Q1071H'	Relative to B.1, Kappa (B.1.617.1) shows 5.71x decrease in neutralization efficiency by convalescent plasma [no cohort details provided]	False	True	Kappa	VUM	4-Apr-2021		20-Sep-2021
p.D614G	c.A1841G	p.D614G			23403	S	S	MISSENSE	407	407						0	407	A	G	B.1.617.1	convalescent plasma escape	Wilhelm et al. (2021)	'L452R'	Relative to B.1, Epsilon (B.1.417/429) shows 1.74x-2.35x decrease in neutralization efficiency by convalescent plasma [no cohort details provided]	False	True	Kappa	VUM	4-Apr-2021		20-Sep-2021
p.D614G	c.A1841G	p.D614G			23403	S	S	MISSENSE	407	407						0	407	A	G	B.1.617.1	immunosuppression variant emergence	Landis et al. (2021)		Studying 94 COVID-19 extended infection cases with genomics April 1 to October 17, 2020, one case developed 23 mutations in a 19 day period, including this combination in Spike.	False	True	Kappa	VUM	4-Apr-2021		20-Sep-2021
p.D614G	c.A1841G	p.D614G			23403	S	S	MISSENSE	407	407						0	407	A	G	B.1.617.1	syncytium formation	Kim et al. (2021)		Slight increase in Vero cell-cell membrane fusion assay under infection with VSV pseudotyped virus.	False	True	Kappa	VUM	4-Apr-2021		20-Sep-2021
p.D614G	c.A1841G	p.D614G			23403	S	S	MISSENSE	407	407						0	407	A	G	B.1.617.1	tissue specific neutralization	Planas et al. (2021)		The nasal mucosa of Pfizer vaccinees with time course collection was evaluated against VSV pseudotypes: results (only one nasal  swab from different previously infected vacinee neutralizing at weeks 3 and 6 against B.1.1.7 and D614G) suggest that vaccinees probably  do not elicit an early humoral response detectable at mucosal surfaces even though sera neutralization was observed. They strengthen the hypothesis that some vaccines may not protect against  viral acquisition and infection of the oral–nasal region, but may prevent severe disease associated with viral dissemination in the lower respiratory tract. 	False	True	Kappa	VUM	4-Apr-2021		20-Sep-2021
p.D614G	c.A1841G	p.D614G			23403	S	S	MISSENSE	407	407						0	407	A	G	B.1.617.1	trafficking	Barrett et al. (2021)		Circulating variant shown in vitro to not have major defects or enhancement of cell surface protein trafficking (i.e. Spike cleavage or fusion required for cell entry)	False	True	Kappa	VUM	4-Apr-2021		20-Sep-2021
p.D614G	c.A1841G	p.D614G			23403	S	S	MISSENSE	407	407						0	407	A	G	B.1.617.1	trafficking	Daniloski et al. (2021)		The increased transduction with Spike D614G ranged from 1.3- to 2.4-fold in Caco-2 and Calu-3 cells expressing  endogenous ACE2 and from 1.5- to 7.7-fold in A549ACE2 and Huh7.5ACE2 overexpressing ACE2.  Although there is minimal difference in ACE2 receptor binding between the D614 and G614 Spike variants,  the G614 variant is more resistant to proteolytic cleavage, suggesting a possible mechanism for the increased transduction.	False	True	Kappa	VUM	4-Apr-2021		20-Sep-2021
p.D614G	c.A1841G	p.D614G			23403	S	S	MISSENSE	407	407						0	407	A	G	B.1.617.1	trafficking	Esclera et al. (2021)	'G142D', 'E154K', 'L452R', 'E484Q', 'P681R', 'Q1071H'	~3.5x cleavage of S2 relative to WA1 (D614G) wildtype by Kappa (B.1.617.1) variant as measured by mass spectrometry of Vero-TMPRSS culture (compare to ~4.5x for closely related Delta B.1.617.2 also with P681R at the cleavage site). 	False	True	Kappa	VUM	4-Apr-2021		20-Sep-2021
p.D614G	c.A1841G	p.D614G			23403	S	S	MISSENSE	407	407						0	407	A	G	B.1.617.1	trafficking	Kim et al. (2021)		No change in infectivity (24h) relative to D614G alone in Caco-2 cells, Vero or Calu-3.	False	True	Kappa	VUM	4-Apr-2021		20-Sep-2021
p.D614G	c.A1841G	p.D614G			23403	S	S	MISSENSE	407	407						0	407	A	G	B.1.617.1	trafficking	Kim et al. (2021)		~4x more efficient S2 domain cleavage compared to wild type in Caco-2 cells, mid-range of three cell line tested (Vero and Calu-3).	False	True	Kappa	VUM	4-Apr-2021		20-Sep-2021
p.D614G	c.A1841G	p.D614G			23403	S	S	MISSENSE	407	407						0	407	A	G	B.1.617.1	trafficking	Ozono et al. (2020)		Among S variants tested, the D614G mutant shows the highest cell entry (~3.5x wild type), as supported by  structural and binding analyses. 	False	True	Kappa	VUM	4-Apr-2021		20-Sep-2021
p.D614G	c.A1841G	p.D614G			23403	S	S	MISSENSE	407	407						0	407	A	G	B.1.617.1	trafficking	Tada et al. (2021)	'P681R'	Quantification of the band intensities showed that the P681R mutation, which lies near the proteolytic processing site,  caused a small increase in proteolytic processing as measured by a 2-fold decrease in the ratio of S/S2.	False	True	Kappa	VUM	4-Apr-2021		20-Sep-2021
p.D614G	c.A1841G	p.D614G			23403	S	S	MISSENSE	407	407						0	407	A	G	B.1.617.1	trafficking	Zhang et l. (2020)		We report here pseudoviruses carrying SG614 enter ACE2-expressing cells more efficiently than wild type (~9-fold).  This increased entry correlates with less S1-domain shedding and higher S-protein incorporation into the virion.  D614G does not alter S-protein binding to ACE2 or neutralization sensitivity of pseudoviruses. Thus, D614G may  increase infectivity by assembling more functional S protein into the virion.	False	True	Kappa	VUM	4-Apr-2021		20-Sep-2021
p.D614G	c.A1841G	p.D614G			23403	S	S	MISSENSE	407	407						0	407	A	G	B.1.617.1	transmissibility	Tada et al. (2021)	'L452R'	Increased infectivity of the B.1.617 spike was attributed to L452R, which itself caused a 3.5-fold increase in infectivity relative to D614G wild type.  [In combination with E484Q caused a lower 3-fold increase]	False	True	Kappa	VUM	4-Apr-2021		20-Sep-2021
p.D614G	c.A1841G	p.D614G			23403	S	S	MISSENSE	407	407						0	407	A	G	B.1.617.1	transmissibility	Tada et al. (2021)	'L452R', 'E484Q'	The combination caused a 3-fold increase in infectivity relative to D614G wild type. [compare to 3.5x for L452R alone]	False	True	Kappa	VUM	4-Apr-2021		20-Sep-2021
p.D614G	c.A1841G	p.D614G			23403	S	S	MISSENSE	407	407						0	407	A	G	B.1.617.1	transmissibility	Tada et al. (2021)	'L452R', 'E484Q', 'P681R'	Normalized for particle number, on ACE2.293T cells showed that the B.1.617 spike protein was >2-fold increase in infectivity relative to D614G wild type.	False	True	Kappa	VUM	4-Apr-2021		20-Sep-2021
p.D614G	c.A1841G	p.D614G			23403	S	S	MISSENSE	407	407						0	407	A	G	B.1.617.1	vaccine neutralization efficacy	Choi et al. (2021)	'G142D', 'E154K', 'L452R', 'E484Q', 'P681R', 'Q1071H'	Inferring from two B.1.617.1 variants tested, estimate baseline 3.3x reduction in ID50 relative to D614G wildtype using pseudotyped VSV assay on 8 Moderna vaccinee sera one week post-booster.	False	True	Kappa	VUM	4-Apr-2021		20-Sep-2021
p.D614G	c.A1841G	p.D614G			23403	S	S	MISSENSE	407	407						0	407	A	G	B.1.617.1	vaccine neutralization efficacy	Choi et al. (2021)	'T95I', 'G142D', 'E154K', 'L452R', 'E484Q', 'P681R', 'Q1071H'	"Neutralization efficiency (ID50) against B.1.617.1-v1 (""Kappa"") reduced 3.4x relative to D614G wildtype using pseudotyped VSV assay on 8 Moderna vaccinee sera one week post-booster."	False	True	Kappa	VUM	4-Apr-2021		20-Sep-2021
p.D614G	c.A1841G	p.D614G			23403	S	S	MISSENSE	407	407						0	407	A	G	B.1.617.1	vaccine neutralization efficacy	Garcia-Beltran et al. (2021)		Pseudotyped D614G virus has reduced neutralization activity vs wild type: 1.2x (37 sera Pfizer median 9  days post 2nd dose, 37 sera Moderna median 18 days post 2nd dose). This was NOT significant by ANOVA.	False	True	Kappa	VUM	4-Apr-2021		20-Sep-2021
p.D614G	c.A1841G	p.D614G			23403	S	S	MISSENSE	407	407						0	407	A	G	B.1.617.1	vaccine neutralization efficacy	Gong et al. (2021)	'G142D', 'E154K', 'L452R', 'E484Q', 'P681R', 'Q1071H'	1.5x reduction in neutralization (ID50) in sera 3 weeks after one dose of Pfizer/BioNTech BNT162b2 (up to 5 naive and post infection vaccinees) [exact set of variants used is not listed in the manuscript]	False	True	Kappa	VUM	4-Apr-2021		20-Sep-2021
p.D614G	c.A1841G	p.D614G			23403	S	S	MISSENSE	407	407						0	407	A	G	B.1.617.1	vaccine neutralization efficacy	Gong et al. (2021)	'L452R', 'E484Q'	1.4x reduction in neutralization (ID50) in sera 3 weeks after one dose of Pfizer/BioNTech BNT162b2 (up to 5 naive and post infection vaccinees)	False	True	Kappa	VUM	4-Apr-2021		20-Sep-2021
p.D614G	c.A1841G	p.D614G			23403	S	S	MISSENSE	407	407						0	407	A	G	B.1.617.1	vaccine neutralization efficacy	Kuzmina et al. (2021)		Using a lentivirus virus pseudotyped with D614G Spike, sera from vaccinated individuals who received the second dose (9–11 days post-second dose of Pfizer) exhibited a robust  neutralizing potential, with a mean NT50 value of 99,000. This was an average of a 2-fold increase, relative to sera drawn from the  individuals who received one dose of vaccination—mean NT50 dilution of 51,300. Importantly, a 6-fold increase in mean NT50 dilution was  obtained when sera from the first vaccination dose was compared to convalescent sera from cohort with severe disease (NT50 51,000 vs 8,700)  21 to 63 days post-onset. 	False	True	Kappa	VUM	4-Apr-2021		20-Sep-2021
p.D614G	c.A1841G	p.D614G			23403	S	S	MISSENSE	407	407						0	407	A	G	B.1.617.1	vaccine neutralization efficacy	Tada et al. (2021)	'L452R', 'E484Q'	Pseudotyped viruses for B.1.617 was 4-fold resistant to neutralization by 6 BNT162b2 vaccine sera 28 days post-booster compared to wild type - a finding that was similar to that of the 3.4-fold resistance of the South Africa B.1.351 variant using the same assay. Neutralization by 3 Moderna vaccine sera 28 days post-booster was 5-fold resistant (vs. 2.2-fold for B.1.351). The resistance of B.1.617 was caused by the L452R and E484Q mutation, based on results from viruses pseudotyped for individual variants within B.1.617.	False	True	Kappa	VUM	4-Apr-2021		20-Sep-2021
p.D614G	c.A1841G	p.D614G			23403	S	S	MISSENSE	407	407						0	407	A	G	B.1.617.1	vaccine neutralization efficacy	Wilhelm et al. (2021)	'G142D', 'E154K', 'L452R', 'E484Q', 'P681R', 'Q1071H'	Relative to B.1, Kappa (B.1.617.1) shows mean 1.97x decrease in neutralization efficiency by 18 vaccinee sera (BNT162b2 and mRNA1273).	False	True	Kappa	VUM	4-Apr-2021		20-Sep-2021
p.D614G	c.A1841G	p.D614G			23403	S	S	MISSENSE	407	407						0	407	A	G	B.1.617.1	vaccine neutralization efficacy	Wilhelm et al. (2021)	'L452R'	Relative to B.1, Epsilon (B.1.417/429) shows 1.74x-2.35x decrease in neutralization efficiency by 18 vaccinee sera (BNT162b2 and mRNA1273).	False	True	Kappa	VUM	4-Apr-2021		20-Sep-2021
p.D614G	c.A1841G	p.D614G			23403	S	S	MISSENSE	407	407						0	407	A	G	B.1.617.1	vaccine neutralization efficacy	Yadav et al. (2021)	'G142D', 'E154K', 'L452R', 'E484Q', 'P681R', 'Q1071H'	Average 2x neutralization efficiency decrease against sera from 26 Phase II trial Covaxin (BBV152) vaccine recipents.  Very similar to B.1.1.7 (~2x) in the same study, and the neutralization from 17 sera of natural infections across B1 lineages.	False	True	Kappa	VUM	4-Apr-2021		20-Sep-2021
p.D614G	c.A1841G	p.D614G			23403	S	S	MISSENSE	407	407						0	407	A	G	B.1.617.1	vaccinee plasma binding	Gong et al. (2021)	'L452R'	1.05x decrease in Spike binding (relative to D614G alone) by 5 plasma collected 3 weeks after one dose of Pfizer/BioNtech BNT162b2 vaccine in previously non-seroconverted subjects. 1.16x decrease in Spike binding (relative to D614G alone) by 5 plasma collected 3 weeks after one dose of Pfizer/BioNtech BNT162b2 vaccine in post-infection vaccinees.	False	True	Kappa	VUM	4-Apr-2021		20-Sep-2021
p.D614G	c.A1841G	p.D614G			23403	S	S	MISSENSE	407	407						0	407	A	G	B.1.617.1	vaccinee plasma binding	Gong et al. (2021)	'L452R', 'E484Q'	This variant combination (representing lineage B.1.617) showed a 1.30x decrease in Spike binding (relative  to D614G alone) by 5 plasma collected 3 weeks after one dose of Pfizer/BioNtech BNT162b2 vaccine in previously non-seroconverted subjects.   1.18x decrease in Spike binding (relative to D614G alone) by 5 plasma collected 3 weeks after one dose of Pfizer/BioNtech BNT162b2 vaccine in post-infection vaccinees. [exact variant list not provided in manuscript, is inferred fro common knowledge]	False	True	Kappa	VUM	4-Apr-2021		20-Sep-2021
p.D614G	c.A1841G	p.D614G			23403	S	S	MISSENSE	407	407						0	407	A	G	B.1.617.1	vaccinee plasma binding	Gong et al. (2021)	'T95I'	1.16x increase in Spike binding (relative to D614G alone) by 5 plasma collected 3 weeks after one dose of Pfizer/BioNtech BNT162b2 vaccine in previously non-seroconverted subjects.  1.02x decrease in Spike binding (relative to D614G alone) by 5 plasma collected 3 weeks after one dose of Pfizer/BioNtech BNT162b2 vaccine in post-infection vaccinees.	False	True	Kappa	VUM	4-Apr-2021		20-Sep-2021
p.D614G	c.A1841G	p.D614G			23403	S	S	MISSENSE	407	407						0	407	A	G	B.1.617.1	viral load	Plante et al. (2020)		Hamsters infected with SARS-CoV-2 expressing spike(D614G) (G614 virus) produced higher infectious titres in nasal washes and the trachea, but not in the lungs,  supporting clinical evidence showing that the mutation enhances viral loads in the upper respiratory tract of COVID-19 patients and may increase transmission.	False	True	Kappa	VUM	4-Apr-2021		20-Sep-2021
p.D614G	c.A1841G	p.D614G			23403	S	S	MISSENSE	407	407						0	407	A	G	B.1.617.1	virion structure	Spratt et al. (2021)		Estimated free energy change (ddG) for this variant is 2.5 kcal/mol (i.e. stabilizing relative to wild type) 	False	True	Kappa	VUM	4-Apr-2021		20-Sep-2021
p.D614G	c.A1841G	p.D614G			23403	S	S	MISSENSE	407	407						0	407	A	G	B.1.617.1	virion structure	Weissman et al. (2020)		"Negative stain EM shows increased proportion of ""one-up"" trimer conformation of Spike proteins on the surface of virions, where the up  conformation is presumed to be more likely to bind ACE2."	False	True	Kappa	VUM	4-Apr-2021		20-Sep-2021
p.D614G	c.A1841G	p.D614G			23403	S	S	MISSENSE	407	407						0	407	A	G	B.1.617.1	virion structure	Yurkovetskiy et al. (2020)		"CryoEM shows increased proportion of ""one-up"" trimer conformation of Spike proteins on the surface of virions, where the up  conformation is presumed to be more likely to bind ACE2."	False	True	Kappa	VUM	4-Apr-2021		20-Sep-2021
p.D614G	c.A1841G	p.D614G			23403	S	S	MISSENSE	407	407						0	407	A	G	B.1.617.1	virion structure	Zhang et al. (2020)		Based on pseudotyped virus experiments, D614G may increase infectivity by assembling more functional S protein into the virion.	False	True	Kappa	VUM	4-Apr-2021		20-Sep-2021
p.E154K	c.G460A	p.E154K			22022	S	S	MISSENSE	405	407						0	405	G	A	B.1.617.1	ACE2 receptor binding affinity	Gong et al. (2021)	'G142D', 'L452R', 'E484Q', 'D614G', 'P681R', 'Q1071H'	"Using flow cytometry and ACE2 ectodomains-Fc portion IgG complex, this variant combination (representing lineage B.1.617.1) showed a 1.12x increase  in binding (KD) relative to D614G, but described as ""not significant"". [exact variant list not provided in manuscript, is inferred and  represents minimal set agreed upon commonly]"	False	True	Kappa	VUM	4-Apr-2021		20-Sep-2021
p.E154K	c.G460A	p.E154K			22022	S	S	MISSENSE	405	407						0	405	G	A	B.1.617.1	convalescent plasma escape	Schmidt et al. (2021)		Escape mutant found after in passage in plasma pool of 26 convalescents mean 1.5 post symptom onset.	False	True	Kappa	VUM	4-Apr-2021		20-Sep-2021
p.E154K	c.G460A	p.E154K			22022	S	S	MISSENSE	405	407						0	405	G	A	B.1.617.1	convalescent plasma escape	Wilhelm et al. (2021)	'G142D', 'L452R', 'E484Q', 'D614G', 'P681R', 'Q1071H'	Relative to B.1, Kappa (B.1.617.1) shows 5.71x decrease in neutralization efficiency by convalescent plasma [no cohort details provided]	False	True	Kappa	VUM	4-Apr-2021		20-Sep-2021
p.E154K	c.G460A	p.E154K			22022	S	S	MISSENSE	405	407						0	405	G	A	B.1.617.1	trafficking	Esclera et al. (2021)	'G142D', 'L452R', 'E484Q', 'D614G', 'P681R', 'Q1071H'	~3.5x cleavage of S2 relative to WA1 (D614G) wildtype by Kappa (B.1.617.1) variant as measured by mass spectrometry of Vero-TMPRSS culture (compare to ~4.5x for closely related Delta B.1.617.2 also with P681R at the cleavage site). 	False	True	Kappa	VUM	4-Apr-2021		20-Sep-2021
p.E154K	c.G460A	p.E154K			22022	S	S	MISSENSE	405	407						0	405	G	A	B.1.617.1	vaccine neutralization efficacy	Choi et al. (2021)	'G142D', 'L452R', 'E484Q', 'D614G', 'P681R', 'Q1071H'	Inferring from two B.1.617.1 variants tested, estimate baseline 3.3x reduction in ID50 relative to D614G wildtype using pseudotyped VSV assay on 8 Moderna vaccinee sera one week post-booster.	False	True	Kappa	VUM	4-Apr-2021		20-Sep-2021
p.E154K	c.G460A	p.E154K			22022	S	S	MISSENSE	405	407						0	405	G	A	B.1.617.1	vaccine neutralization efficacy	Choi et al. (2021)	'T95I', 'G142D', 'L452R', 'E484Q', 'D614G', 'P681R', 'Q1071H'	"Neutralization efficiency (ID50) against B.1.617.1-v1 (""Kappa"") reduced 3.4x relative to D614G wildtype using pseudotyped VSV assay on 8 Moderna vaccinee sera one week post-booster."	False	True	Kappa	VUM	4-Apr-2021		20-Sep-2021
p.E154K	c.G460A	p.E154K			22022	S	S	MISSENSE	405	407						0	405	G	A	B.1.617.1	vaccine neutralization efficacy	Gong et al. (2021)	'G142D', 'L452R', 'E484Q', 'D614G', 'P681R', 'Q1071H'	1.5x reduction in neutralization (ID50) in sera 3 weeks after one dose of Pfizer/BioNTech BNT162b2 (up to 5 naive and post infection vaccinees) [exact set of variants used is not listed in the manuscript]	False	True	Kappa	VUM	4-Apr-2021		20-Sep-2021
p.E154K	c.G460A	p.E154K			22022	S	S	MISSENSE	405	407						0	405	G	A	B.1.617.1	vaccine neutralization efficacy	Wilhelm et al. (2021)	'G142D', 'L452R', 'E484Q', 'D614G', 'P681R', 'Q1071H'	Relative to B.1, Kappa (B.1.617.1) shows mean 1.97x decrease in neutralization efficiency by 18 vaccinee sera (BNT162b2 and mRNA1273).	False	True	Kappa	VUM	4-Apr-2021		20-Sep-2021
p.E154K	c.G460A	p.E154K			22022	S	S	MISSENSE	405	407						0	405	G	A	B.1.617.1	vaccine neutralization efficacy	Yadav et al. (2021)	'G142D', 'L452R', 'E484Q', 'D614G', 'P681R', 'Q1071H'	Average 2x neutralization efficiency decrease against sera from 26 Phase II trial Covaxin (BBV152) vaccine recipents.  Very similar to B.1.1.7 (~2x) in the same study, and the neutralization from 17 sera of natural infections across B1 lineages.	False	True	Kappa	VUM	4-Apr-2021		20-Sep-2021
p.E2089D	c.G6267T	p.E2089D			6532	orf1ab	ORF1ab	MISSENSE	407	407			nsp3	former nsp1, conserved domains are: N-terminal acidic (Ac), predicted phosphoesterase, papain-like proteinase, Y-domain, transmembrane domain 1 (TM1), adenosine diphosphate-ribose 1''-phosphatase (ADRP), produced by both pp1a and pp1ab	YP_009725299.1	110	297	G	T	B.1.617.1					False	False	Kappa	VUM	4-Apr-2021		20-Sep-2021
p.E484Q	c.G1450C	p.E484Q			23012	S	S	MISSENSE	407	407						0	407	G	C	B.1.617.1	ACE2 receptor binding affinity	Gong et al. (2021)	'G142D', 'E154K', 'L452R', 'D614G', 'P681R', 'Q1071H'	"Using flow cytometry and ACE2 ectodomains-Fc portion IgG complex, this variant combination (representing lineage B.1.617.1) showed a 1.12x increase  in binding (KD) relative to D614G, but described as ""not significant"". [exact variant list not provided in manuscript, is inferred and  represents minimal set agreed upon commonly]"	False	True	Kappa	VUM	4-Apr-2021		20-Sep-2021
p.E484Q	c.G1450C	p.E484Q			23012	S	S	MISSENSE	407	407						0	407	G	C	B.1.617.1	ACE2 receptor binding affinity	Gong et al. (2021)	'L452R', 'D614G'	Using flow cytometry and ACE2 ectodomains-Fc portion IgG complex, this variant combination (representing lineage B.1.617) showed a 1.85x increase  in binding (KD) relative to D614G. [exact variant list not provided in manuscript, is inferred fro common knowledge]	False	True	Kappa	VUM	4-Apr-2021		20-Sep-2021
p.E484Q	c.G1450C	p.E484Q			23012	S	S	MISSENSE	407	407						0	407	G	C	B.1.617.1	antibody epitope effects	Sun et al. (2021)		>20% (ELISA significance threshold) drop in antibody binding by this variant against monoclonal antibody VH-Fc ab8.	False	True	Kappa	VUM	4-Apr-2021		20-Sep-2021
p.E484Q	c.G1450C	p.E484Q			23012	S	S	MISSENSE	407	407						0	407	G	C	B.1.617.1	convalescent plasma binding	Gong et al. (2021)	'L452R', 'D614G'	This variant combination (representing lineage B.1.617) showed a 1.22x decrease in Spike binding (relative  to D614G alone) by 5 plasma collected 8 months post-symptom-onset. [exact variant list not provided in manuscript, is inferred fro common knowledge]	False	True	Kappa	VUM	4-Apr-2021		20-Sep-2021
