name	nt_name	aa_name	multi_aa_name	multiaa_comb_mutation	start	vcf_gene	chrom_region	mutation_type	sequence_depth	sample_size	ps_filter	ps_exc	mat_pep_id	mat_pep_desc	mat_pep_acc	ro	ao	reference_seq	variant_seq	viral_lineages	function_category	citation	comb_mutation	function_description	heterozygosity	clade_defining	who_variant	status	voi_designation_date	voc_designation_date	vum_designation_date
p.E484Q	c.G1450C	p.E484Q			23012	S	S	MISSENSE	407	407						0	407	G	C	B.1.617.1	convalescent plasma escape	Greaney et al. (2021)		In 3 of 11 subjects' convalescent sera in an early+late mutational landscape analysis of the RBD,  E484Q shows a notably resistant profile, comparable to or even more resistant than E484K at  later time points (i.e. more resistant to immune cell somatic mutation evolution), see Figure 5a,b. Subject C 32 days post-infection showed >>10 fold reduction in neutralization, reducing to ~10-fold by day 104. Subject B 26 days post-infection showed ~10 fold reduction in neutralization, reducing to ~4x at day 113. Notably, Subject B also showed smaller than typical (~10 vs 30+ fold) reduction in one-month neutralization by E484K at day 32,  and no E484K immune escape at day 104. Subject I 26 days post-infection showed ~10 fold reduction in neutralization, with no reduction in escape at day 102. Notably, Subject I also showed smaller than typical (~10 vs 30+ fold) reduction in one-month neutralization by E484K at day 26,  and no E484K immune escape at day 102.	False	True	Kappa	VUM	4-Apr-2021		20-Sep-2021
p.E484Q	c.G1450C	p.E484Q			23012	S	S	MISSENSE	407	407						0	407	G	C	B.1.617.1	convalescent plasma escape	Tada et al. (2021)	'L452R', 'D614G'	Pseudotyped viruses for B.1.617 was 2.3-fold resistant to neutralization by convalescent sera compared to wild type - a finding that was similar to that of the 3-fold resistance of the South Africa B.1.351 variant using the same assay. The resistance of B.1.617 was caused by the L452R and E484Q mutation, based on results from viruses pseudotyped for individual variants within B.1.617. [details on the convalescent patient sera collection are not abundantly clear in the preprint]	False	True	Kappa	VUM	4-Apr-2021		20-Sep-2021
p.E484Q	c.G1450C	p.E484Q			23012	S	S	MISSENSE	407	407						0	407	G	C	B.1.617.1	convalescent plasma escape	Wilhelm et al. (2021)	'G142D', 'E154K', 'L452R', 'D614G', 'P681R', 'Q1071H'	Relative to B.1, Kappa (B.1.617.1) shows 5.71x decrease in neutralization efficiency by convalescent plasma [no cohort details provided]	False	True	Kappa	VUM	4-Apr-2021		20-Sep-2021
p.E484Q	c.G1450C	p.E484Q			23012	S	S	MISSENSE	407	407						0	407	G	C	B.1.617.1	monoclonal antibody serial passage escape	Starr et al. (2021)		Escape mutation against monoclonal antibody LY-CoV555 (antibody that forms the basis for Eli Lilly's bamlanivimab)	False	True	Kappa	VUM	4-Apr-2021		20-Sep-2021
p.E484Q	c.G1450C	p.E484Q			23012	S	S	MISSENSE	407	407						0	407	G	C	B.1.617.1	pharmaceutical effectiveness	Engelhart et al. (2021)		Bamlanivimab (LY-CoV555) lost ~20x binding against this isolated mutation. Casirivimab lost ~4x binding against this isolated mutation.	False	True	Kappa	VUM	4-Apr-2021		20-Sep-2021
p.E484Q	c.G1450C	p.E484Q			23012	S	S	MISSENSE	407	407						0	407	G	C	B.1.617.1	symptom prevalence	Yadav et al. (2021)	'L452R', 'P681R'	Gross examination of 3+3 hamster lung specimens showed pronounced congestion and hemorrhages on days 5 and 7 post-infection in the case of the B.1.617.1 as compared with the B.1. The lung lesions with  the B.1 variant were minimal to mild whereas with B.1.617.1 they were moderate. For B.1 pneumonic changes were minimal to mild (inflammatory cell infiltration, focal consolidation and mild congestion). The pronounced changes (moderate to severe) with mononuclear infiltration in the alveolar interstitial space, interstitial septal thickening, consolidation and pneumocyte hyperplasia were observed with B.1.617.1 variant consistently.	False	True	Kappa	VUM	4-Apr-2021		20-Sep-2021
p.E484Q	c.G1450C	p.E484Q			23012	S	S	MISSENSE	407	407						0	407	G	C	B.1.617.1	trafficking	Esclera et al. (2021)	'G142D', 'E154K', 'L452R', 'D614G', 'P681R', 'Q1071H'	~3.5x cleavage of S2 relative to WA1 (D614G) wildtype by Kappa (B.1.617.1) variant as measured by mass spectrometry of Vero-TMPRSS culture (compare to ~4.5x for closely related Delta B.1.617.2 also with P681R at the cleavage site). 	False	True	Kappa	VUM	4-Apr-2021		20-Sep-2021
p.E484Q	c.G1450C	p.E484Q			23012	S	S	MISSENSE	407	407						0	407	G	C	B.1.617.1	trafficking	Ferriera et al (2021)		This variant alone shows a 10x decrease in cell entry efficiency (RLU measurement in 293T cells) compared to D614G. 	False	True	Kappa	VUM	4-Apr-2021		20-Sep-2021
p.E484Q	c.G1450C	p.E484Q			23012	S	S	MISSENSE	407	407						0	407	G	C	B.1.617.1	transmissibility	Tada et al. (2021)	'L452R', 'D614G'	The combination caused a 3-fold increase in infectivity relative to D614G wild type. [compare to 3.5x for L452R alone]	False	True	Kappa	VUM	4-Apr-2021		20-Sep-2021
p.E484Q	c.G1450C	p.E484Q			23012	S	S	MISSENSE	407	407						0	407	G	C	B.1.617.1	transmissibility	Tada et al. (2021)	'L452R', 'P681R', 'D614G'	Normalized for particle number, on ACE2.293T cells showed that the B.1.617 spike protein was >2-fold increase in infectivity relative to D614G wild type.	False	True	Kappa	VUM	4-Apr-2021		20-Sep-2021
p.E484Q	c.G1450C	p.E484Q			23012	S	S	MISSENSE	407	407						0	407	G	C	B.1.617.1	vaccine neutralization efficacy	Choi et al. (2021)	'G142D', 'E154K', 'L452R', 'D614G', 'P681R', 'Q1071H'	Inferring from two B.1.617.1 variants tested, estimate baseline 3.3x reduction in ID50 relative to D614G wildtype using pseudotyped VSV assay on 8 Moderna vaccinee sera one week post-booster.	False	True	Kappa	VUM	4-Apr-2021		20-Sep-2021
p.E484Q	c.G1450C	p.E484Q			23012	S	S	MISSENSE	407	407						0	407	G	C	B.1.617.1	vaccine neutralization efficacy	Choi et al. (2021)	'T95I', 'G142D', 'E154K', 'L452R', 'D614G', 'P681R', 'Q1071H'	"Neutralization efficiency (ID50) against B.1.617.1-v1 (""Kappa"") reduced 3.4x relative to D614G wildtype using pseudotyped VSV assay on 8 Moderna vaccinee sera one week post-booster."	False	True	Kappa	VUM	4-Apr-2021		20-Sep-2021
p.E484Q	c.G1450C	p.E484Q			23012	S	S	MISSENSE	407	407						0	407	G	C	B.1.617.1	vaccine neutralization efficacy	Ferreira et al. (2021)	'L452R'	Nine stored sera from Pfizer BNT162b2 vaccinees were tested against a range of spike mutation bearing PV. E484Q had a ~5x drop in neutralization (vs ~10x for E484K). When E484Q and L452R were combined, the fold change was significant, but similar to that of L452R alone (~2x), suggesting no evidence for an additive effect [perhaps even E484Q effect dilution]. 	False	True	Kappa	VUM	4-Apr-2021		20-Sep-2021
p.E484Q	c.G1450C	p.E484Q			23012	S	S	MISSENSE	407	407						0	407	G	C	B.1.617.1	vaccine neutralization efficacy	Gong et al. (2021)	'G142D', 'E154K', 'L452R', 'D614G', 'P681R', 'Q1071H'	1.5x reduction in neutralization (ID50) in sera 3 weeks after one dose of Pfizer/BioNTech BNT162b2 (up to 5 naive and post infection vaccinees) [exact set of variants used is not listed in the manuscript]	False	True	Kappa	VUM	4-Apr-2021		20-Sep-2021
p.E484Q	c.G1450C	p.E484Q			23012	S	S	MISSENSE	407	407						0	407	G	C	B.1.617.1	vaccine neutralization efficacy	Gong et al. (2021)	'L452R', 'D614G'	1.4x reduction in neutralization (ID50) in sera 3 weeks after one dose of Pfizer/BioNTech BNT162b2 (up to 5 naive and post infection vaccinees)	False	True	Kappa	VUM	4-Apr-2021		20-Sep-2021
p.E484Q	c.G1450C	p.E484Q			23012	S	S	MISSENSE	407	407						0	407	G	C	B.1.617.1	vaccine neutralization efficacy	Tada et al. (2021)	'L452R', 'D614G'	Pseudotyped viruses for B.1.617 was 4-fold resistant to neutralization by 6 BNT162b2 vaccine sera 28 days post-booster compared to wild type - a finding that was similar to that of the 3.4-fold resistance of the South Africa B.1.351 variant using the same assay. Neutralization by 3 Moderna vaccine sera 28 days post-booster was 5-fold resistant (vs. 2.2-fold for B.1.351). The resistance of B.1.617 was caused by the L452R and E484Q mutation, based on results from viruses pseudotyped for individual variants within B.1.617.	False	True	Kappa	VUM	4-Apr-2021		20-Sep-2021
p.E484Q	c.G1450C	p.E484Q			23012	S	S	MISSENSE	407	407						0	407	G	C	B.1.617.1	vaccine neutralization efficacy	Wilhelm et al. (2021)	'G142D', 'E154K', 'L452R', 'D614G', 'P681R', 'Q1071H'	Relative to B.1, Kappa (B.1.617.1) shows mean 1.97x decrease in neutralization efficiency by 18 vaccinee sera (BNT162b2 and mRNA1273).	False	True	Kappa	VUM	4-Apr-2021		20-Sep-2021
p.E484Q	c.G1450C	p.E484Q			23012	S	S	MISSENSE	407	407						0	407	G	C	B.1.617.1	vaccine neutralization efficacy	Yadav et al. (2021)	'G142D', 'E154K', 'L452R', 'D614G', 'P681R', 'Q1071H'	Average 2x neutralization efficiency decrease against sera from 26 Phase II trial Covaxin (BBV152) vaccine recipents.  Very similar to B.1.1.7 (~2x) in the same study, and the neutralization from 17 sera of natural infections across B1 lineages.	False	True	Kappa	VUM	4-Apr-2021		20-Sep-2021
p.E484Q	c.G1450C	p.E484Q			23012	S	S	MISSENSE	407	407						0	407	G	C	B.1.617.1	vaccinee plasma binding	Gong et al. (2021)	'L452R', 'D614G'	This variant combination (representing lineage B.1.617) showed a 1.30x decrease in Spike binding (relative  to D614G alone) by 5 plasma collected 3 weeks after one dose of Pfizer/BioNtech BNT162b2 vaccine in previously non-seroconverted subjects.   1.18x decrease in Spike binding (relative to D614G alone) by 5 plasma collected 3 weeks after one dose of Pfizer/BioNtech BNT162b2 vaccine in post-infection vaccinees. [exact variant list not provided in manuscript, is inferred fro common knowledge]	False	True	Kappa	VUM	4-Apr-2021		20-Sep-2021
p.E484Q	c.G1450C	p.E484Q			23012	S	S	MISSENSE	407	407						0	407	G	C	B.1.617.1	viral load	Yadav et al. (2021)	'L452R', 'P681R'	In 9 infected hamsters each for B.1 and B.1.617.1, no significant change in viral load or subgenomic RNA levels were detected. 	False	True	Kappa	VUM	4-Apr-2021		20-Sep-2021
p.F53F	c.C159T	p.F53F			26681	M	M	SILENT	407	407						27	380	C	T	B.1.617.1					False	True	Kappa	VUM	4-Apr-2021		20-Sep-2021
p.F924F	c.C2772T	p.F924F			3037	orf1ab	ORF1ab	SILENT	407	407			nsp3	former nsp1, conserved domains are: N-terminal acidic (Ac), predicted phosphoesterase, papain-like proteinase, Y-domain, transmembrane domain 1 (TM1), adenosine diphosphate-ribose 1''-phosphatase (ADRP), produced by both pp1a and pp1ab	YP_009725299.1	0	407	C	T	B.1.617.1					False	True	Kappa	VUM	4-Apr-2021		20-Sep-2021
p.G142D	c.G425A	p.G142D			21987	S	S	MISSENSE	388	407	mask	amplicon_drop_or_primer_artefact,back_to_ref				0	388	G	A	B.1.617.1	ACE2 receptor binding affinity	Gong et al. (2021)	'E154K', 'L452R', 'E484Q', 'D614G', 'P681R', 'Q1071H'	"Using flow cytometry and ACE2 ectodomains-Fc portion IgG complex, this variant combination (representing lineage B.1.617.1) showed a 1.12x increase  in binding (KD) relative to D614G, but described as ""not significant"". [exact variant list not provided in manuscript, is inferred and  represents minimal set agreed upon commonly]"	False	True	Kappa	VUM	4-Apr-2021		20-Sep-2021
p.G142D	c.G425A	p.G142D			21987	S	S	MISSENSE	388	407	mask	amplicon_drop_or_primer_artefact,back_to_ref				0	388	G	A	B.1.617.1	convalescent plasma escape	Wilhelm et al. (2021)	'E154K', 'L452R', 'E484Q', 'D614G', 'P681R', 'Q1071H'	Relative to B.1, Kappa (B.1.617.1) shows 5.71x decrease in neutralization efficiency by convalescent plasma [no cohort details provided]	False	True	Kappa	VUM	4-Apr-2021		20-Sep-2021
p.G142D	c.G425A	p.G142D			21987	S	S	MISSENSE	388	407	mask	amplicon_drop_or_primer_artefact,back_to_ref				0	388	G	A	B.1.617.1	monoclonal antibody serial passage escape	McCallum et al. (2021)		Escape mutation against Spike N terminal domain antigenic supersite i mAbs S2M28, S2X28, S2X333	False	True	Kappa	VUM	4-Apr-2021		20-Sep-2021
p.G142D	c.G425A	p.G142D			21987	S	S	MISSENSE	388	407	mask	amplicon_drop_or_primer_artefact,back_to_ref				0	388	G	A	B.1.617.1	monoclonal antibody serial passage escape	Suryadevara et al. (2021)		Selected twice in passage with mAb COV2-2489.	False	True	Kappa	VUM	4-Apr-2021		20-Sep-2021
p.G142D	c.G425A	p.G142D			21987	S	S	MISSENSE	388	407	mask	amplicon_drop_or_primer_artefact,back_to_ref				0	388	G	A	B.1.617.1	trafficking	Esclera et al. (2021)	'E154K', 'L452R', 'E484Q', 'D614G', 'P681R', 'Q1071H'	~3.5x cleavage of S2 relative to WA1 (D614G) wildtype by Kappa (B.1.617.1) variant as measured by mass spectrometry of Vero-TMPRSS culture (compare to ~4.5x for closely related Delta B.1.617.2 also with P681R at the cleavage site). 	False	True	Kappa	VUM	4-Apr-2021		20-Sep-2021
p.G142D	c.G425A	p.G142D			21987	S	S	MISSENSE	388	407	mask	amplicon_drop_or_primer_artefact,back_to_ref				0	388	G	A	B.1.617.1	vaccine neutralization efficacy	Choi et al. (2021)	'E154K', 'L452R', 'E484Q', 'D614G', 'P681R', 'Q1071H'	Inferring from two B.1.617.1 variants tested, estimate baseline 3.3x reduction in ID50 relative to D614G wildtype using pseudotyped VSV assay on 8 Moderna vaccinee sera one week post-booster.	False	True	Kappa	VUM	4-Apr-2021		20-Sep-2021
p.G142D	c.G425A	p.G142D			21987	S	S	MISSENSE	388	407	mask	amplicon_drop_or_primer_artefact,back_to_ref				0	388	G	A	B.1.617.1	vaccine neutralization efficacy	Choi et al. (2021)	'T95I', 'E154K', 'L452R', 'E484Q', 'D614G', 'P681R', 'Q1071H'	"Neutralization efficiency (ID50) against B.1.617.1-v1 (""Kappa"") reduced 3.4x relative to D614G wildtype using pseudotyped VSV assay on 8 Moderna vaccinee sera one week post-booster."	False	True	Kappa	VUM	4-Apr-2021		20-Sep-2021
p.G142D	c.G425A	p.G142D			21987	S	S	MISSENSE	388	407	mask	amplicon_drop_or_primer_artefact,back_to_ref				0	388	G	A	B.1.617.1	vaccine neutralization efficacy	Gong et al. (2021)	'E154K', 'L452R', 'E484Q', 'D614G', 'P681R', 'Q1071H'	1.5x reduction in neutralization (ID50) in sera 3 weeks after one dose of Pfizer/BioNTech BNT162b2 (up to 5 naive and post infection vaccinees) [exact set of variants used is not listed in the manuscript]	False	True	Kappa	VUM	4-Apr-2021		20-Sep-2021
p.G142D	c.G425A	p.G142D			21987	S	S	MISSENSE	388	407	mask	amplicon_drop_or_primer_artefact,back_to_ref				0	388	G	A	B.1.617.1	vaccine neutralization efficacy	Wilhelm et al. (2021)	'E154K', 'L452R', 'E484Q', 'D614G', 'P681R', 'Q1071H'	Relative to B.1, Kappa (B.1.617.1) shows mean 1.97x decrease in neutralization efficiency by 18 vaccinee sera (BNT162b2 and mRNA1273).	False	True	Kappa	VUM	4-Apr-2021		20-Sep-2021
p.G142D	c.G425A	p.G142D			21987	S	S	MISSENSE	388	407	mask	amplicon_drop_or_primer_artefact,back_to_ref				0	388	G	A	B.1.617.1	vaccine neutralization efficacy	Yadav et al. (2021)	'E154K', 'L452R', 'E484Q', 'D614G', 'P681R', 'Q1071H'	Average 2x neutralization efficiency decrease against sera from 26 Phase II trial Covaxin (BBV152) vaccine recipents.  Very similar to B.1.1.7 (~2x) in the same study, and the neutralization from 17 sera of natural infections across B1 lineages.	False	True	Kappa	VUM	4-Apr-2021		20-Sep-2021
p.G5530C	c.G16588T	p.G5530C			16852	orf1ab	ORF1ab	MISSENSE	407	407			helicase	nsp13_ZBD, nsp13_TB, and nsp_HEL1core, zinc-binding domain (ZD), NTPase/helicase domain (HEL), RNA 5'-triphosphatase, produced by pp1ab only	YP_009725308.1	28	379	G	T	B.1.617.1					False	True	Kappa	VUM	4-Apr-2021		20-Sep-2021
p.H5290H	c.C15870T	p.H5290H			16134	orf1ab	ORF1ab	SILENT	407	407			RNA-dependent RNA polymerase	nsp12, NiRAN and RdRp, produced by pp1ab only	YP_009725307.1	69	338	C	T	B.1.617.1					False	True	Kappa	VUM	4-Apr-2021		20-Sep-2021
p.I82S	c.T245G	p.I82S			26767	M	M	MISSENSE	407	407						28	379	T	G	B.1.617.1					False	True	Kappa	VUM	4-Apr-2021		20-Sep-2021
p.K6711R	c.A20132G	p.K6711R			20396	orf1ab	ORF1ab	MISSENSE	407	407			endoRNAse	nsp15-A1 and nsp15B-NendoU, produced by pp1ab only	YP_009725310.1	1	406	A	G	B.1.617.1					False	True	Kappa	VUM	4-Apr-2021		20-Sep-2021
p.L2742L	c.G8226A	p.L2742L			8491	orf1ab	ORF1ab	SILENT	407	407			nsp3	former nsp1, conserved domains are: N-terminal acidic (Ac), predicted phosphoesterase, papain-like proteinase, Y-domain, transmembrane domain 1 (TM1), adenosine diphosphate-ribose 1''-phosphatase (ADRP), produced by both pp1a and pp1ab	YP_009725299.1	69	338	G	A	B.1.617.1					False	True	Kappa	VUM	4-Apr-2021		20-Sep-2021
p.L452R	c.T1355G	p.L452R			22917	S	S	MISSENSE	407	407						0	407	T	G	B.1.617.1	ACE2 receptor binding affinity	Gong et al. (2021)	'D614G'	Using flow cytometry and ACE2 ectodomains-Fc portion IgG complex, this variant showed a 2.66x increase in binding (KD) relative to D614G.	False	True	Kappa	VUM	4-Apr-2021		20-Sep-2021
p.L452R	c.T1355G	p.L452R			22917	S	S	MISSENSE	407	407						0	407	T	G	B.1.617.1	ACE2 receptor binding affinity	Gong et al. (2021)	'E484Q', 'D614G'	Using flow cytometry and ACE2 ectodomains-Fc portion IgG complex, this variant combination (representing lineage B.1.617) showed a 1.85x increase  in binding (KD) relative to D614G. [exact variant list not provided in manuscript, is inferred fro common knowledge]	False	True	Kappa	VUM	4-Apr-2021		20-Sep-2021
p.L452R	c.T1355G	p.L452R			22917	S	S	MISSENSE	407	407						0	407	T	G	B.1.617.1	ACE2 receptor binding affinity	Gong et al. (2021)	'G142D', 'E154K', 'E484Q', 'D614G', 'P681R', 'Q1071H'	"Using flow cytometry and ACE2 ectodomains-Fc portion IgG complex, this variant combination (representing lineage B.1.617.1) showed a 1.12x increase  in binding (KD) relative to D614G, but described as ""not significant"". [exact variant list not provided in manuscript, is inferred and  represents minimal set agreed upon commonly]"	False	True	Kappa	VUM	4-Apr-2021		20-Sep-2021
p.L452R	c.T1355G	p.L452R			22917	S	S	MISSENSE	407	407						0	407	T	G	B.1.617.1	ACE2 receptor binding affinity	Motozono et al. (2021)		~1.7-fold increase in binding affinity vs wild type.	False	True	Kappa	VUM	4-Apr-2021		20-Sep-2021
p.L452R	c.T1355G	p.L452R			22917	S	S	MISSENSE	407	407						0	407	T	G	B.1.617.1	T cell evasion	Motozono et al. (2021)		L452R derivative virus did not induce IFN-gamma expression even at the highest concentration tested (10 nM) in two different A*24:02 convalescent sera  donor plasma (linear epitope NYNYLYRLF 448,456).	False	True	Kappa	VUM	4-Apr-2021		20-Sep-2021
p.L452R	c.T1355G	p.L452R			22917	S	S	MISSENSE	407	407						0	407	T	G	B.1.617.1	antibody epitope effects	Li et al. (2020)		Resistent to some neutralizing antibodies: mAbs X593 and P2B-2F6	False	True	Kappa	VUM	4-Apr-2021		20-Sep-2021
p.L452R	c.T1355G	p.L452R			22917	S	S	MISSENSE	407	407						0	407	T	G	B.1.617.1	antibody epitope effects	Liu et al. (2021)		Mutant screen in neutralization assay with a broad range of monoclonal antibodies shows resistence to more than one antibody.	False	True	Kappa	VUM	4-Apr-2021		20-Sep-2021
p.L452R	c.T1355G	p.L452R			22917	S	S	MISSENSE	407	407						0	407	T	G	B.1.617.1	antibody epitope effects	McCallum et al. (2021)		10 of 14 RBD-specific mAbs that showed at least 10-fold reduced neutralization of B.1.427/B.1.429 variant pseudotype (S13I, W152C, and L452R) were also found to poorly bind to just a L452R RBD mutant, demonstrating a role for this mutation as an escape mechanism for certain RBD-targeting mAbs.	False	True	Kappa	VUM	4-Apr-2021		20-Sep-2021
p.L452R	c.T1355G	p.L452R			22917	S	S	MISSENSE	407	407						0	407	T	G	B.1.617.1	antibody epitope effects	Sun et al. (2021)		~20% (ELISA significance threshold) drop in antibody binding (ELISA) by this variant against monoclonal antibody VH ab6.	False	True	Kappa	VUM	4-Apr-2021		20-Sep-2021
p.L452R	c.T1355G	p.L452R			22917	S	S	MISSENSE	407	407						0	407	T	G	B.1.617.1	convalescent plasma binding	Gong et al. (2021)	'D614G'	2.15x increase in Spike binding (relative to D614G alone) by 5 plasma collected 8 months post-symptom-onset.	False	True	Kappa	VUM	4-Apr-2021		20-Sep-2021
p.L452R	c.T1355G	p.L452R			22917	S	S	MISSENSE	407	407						0	407	T	G	B.1.617.1	convalescent plasma binding	Gong et al. (2021)	'E484Q', 'D614G'	This variant combination (representing lineage B.1.617) showed a 1.22x decrease in Spike binding (relative  to D614G alone) by 5 plasma collected 8 months post-symptom-onset. [exact variant list not provided in manuscript, is inferred fro common knowledge]	False	True	Kappa	VUM	4-Apr-2021		20-Sep-2021
p.L452R	c.T1355G	p.L452R			22917	S	S	MISSENSE	407	407						0	407	T	G	B.1.617.1	convalescent plasma escape	Alenquer et al. (2021)		Observed ~2x decrease on average in 16 health workers' convalescent sera.	False	True	Kappa	VUM	4-Apr-2021		20-Sep-2021
p.L452R	c.T1355G	p.L452R			22917	S	S	MISSENSE	407	407						0	407	T	G	B.1.617.1	convalescent plasma escape	Liu et al. (2021)		Ablation of neutralization capability of 3 of 4 convalescent sera tested, the other is significantly hindered.	False	True	Kappa	VUM	4-Apr-2021		20-Sep-2021
p.L452R	c.T1355G	p.L452R			22917	S	S	MISSENSE	407	407						0	407	T	G	B.1.617.1	convalescent plasma escape	Tada et al. (2021)	'E484Q', 'D614G'	Pseudotyped viruses for B.1.617 was 2.3-fold resistant to neutralization by convalescent sera compared to wild type - a finding that was similar to that of the 3-fold resistance of the South Africa B.1.351 variant using the same assay. The resistance of B.1.617 was caused by the L452R and E484Q mutation, based on results from viruses pseudotyped for individual variants within B.1.617. [details on the convalescent patient sera collection are not abundantly clear in the preprint]	False	True	Kappa	VUM	4-Apr-2021		20-Sep-2021
p.L452R	c.T1355G	p.L452R			22917	S	S	MISSENSE	407	407						0	407	T	G	B.1.617.1	convalescent plasma escape	Wilhelm et al. (2021)	'D614G'	Relative to B.1, Epsilon (B.1.417/429) shows 1.74x-2.35x decrease in neutralization efficiency by convalescent plasma [no cohort details provided]	False	True	Kappa	VUM	4-Apr-2021		20-Sep-2021
p.L452R	c.T1355G	p.L452R			22917	S	S	MISSENSE	407	407						0	407	T	G	B.1.617.1	convalescent plasma escape	Wilhelm et al. (2021)	'G142D', 'E154K', 'E484Q', 'D614G', 'P681R', 'Q1071H'	Relative to B.1, Kappa (B.1.617.1) shows 5.71x decrease in neutralization efficiency by convalescent plasma [no cohort details provided]	False	True	Kappa	VUM	4-Apr-2021		20-Sep-2021
p.L452R	c.T1355G	p.L452R			22917	S	S	MISSENSE	407	407						0	407	T	G	B.1.617.1	gene expression increase	Starr et al. (2020)		Experimentally, Spike gene expression increased 0.32 fold	False	True	Kappa	VUM	4-Apr-2021		20-Sep-2021
p.L452R	c.T1355G	p.L452R			22917	S	S	MISSENSE	407	407						0	407	T	G	B.1.617.1	monoclonal antibody serial passage escape	Greaney et al. (2020)		Ranked effective mutant against this position in the RBD for highly neutralizing COV2-2096	False	True	Kappa	VUM	4-Apr-2021		20-Sep-2021
p.L452R	c.T1355G	p.L452R			22917	S	S	MISSENSE	407	407						0	407	T	G	B.1.617.1	monoclonal antibody serial passage escape	Starr et al. (2021)		Escape mutation against monoclonal antibody LY-CoV555 (antibody that forms the basis for Eli Lilly's bamlanivimab)	False	True	Kappa	VUM	4-Apr-2021		20-Sep-2021
p.L452R	c.T1355G	p.L452R			22917	S	S	MISSENSE	407	407						0	407	T	G	B.1.617.1	monoclonal antibody serial passage escape	Wang et al. (2021)		Class 2/3 antibody C628 and class 2 antibody C643 selected for the emergence of the L452R mutation in vitro.	False	True	Kappa	VUM	4-Apr-2021		20-Sep-2021
p.L452R	c.T1355G	p.L452R			22917	S	S	MISSENSE	407	407						0	407	T	G	B.1.617.1	pharmaceutical effectiveness	Engelhart et al. (2021)		Bamlanivimab (LY-CoV555) lost ~5x binding against this isolated mutation. Cligavimab lost ~4x binding against this isolated mutation. Regdanvimab lost ~4x binding against this isolated mutation.	False	True	Kappa	VUM	4-Apr-2021		20-Sep-2021
p.L452R	c.T1355G	p.L452R			22917	S	S	MISSENSE	407	407						0	407	T	G	B.1.617.1	pharmaceutical effectiveness	McCallum et al. (2021)		Bamlanivimab (LY-CoV555) entirely lost its neutralizing activity due to the central location of L452R in the epitopes recognized by this mAb. Regdanvimab (CT-P59), and to a smaller extent etesevimab, showed a reduction in neutralization potency.	False	True	Kappa	VUM	4-Apr-2021		20-Sep-2021
p.L452R	c.T1355G	p.L452R			22917	S	S	MISSENSE	407	407						0	407	T	G	B.1.617.1	symptom prevalence	Yadav et al. (2021)	'E484Q', 'P681R'	Gross examination of 3+3 hamster lung specimens showed pronounced congestion and hemorrhages on days 5 and 7 post-infection in the case of the B.1.617.1 as compared with the B.1. The lung lesions with  the B.1 variant were minimal to mild whereas with B.1.617.1 they were moderate. For B.1 pneumonic changes were minimal to mild (inflammatory cell infiltration, focal consolidation and mild congestion). The pronounced changes (moderate to severe) with mononuclear infiltration in the alveolar interstitial space, interstitial septal thickening, consolidation and pneumocyte hyperplasia were observed with B.1.617.1 variant consistently.	False	True	Kappa	VUM	4-Apr-2021		20-Sep-2021
p.L452R	c.T1355G	p.L452R			22917	S	S	MISSENSE	407	407						0	407	T	G	B.1.617.1	trafficking	Deng et al. (2021)		We observed increased entry by pseudoviruses carrying the L452R mutation compared to D614G alone,  with a 6.7 to 22.5-fold increase in 293T cells and a 5.8 to 14.7-fold increase in human airway organoids.	False	True	Kappa	VUM	4-Apr-2021		20-Sep-2021
p.L452R	c.T1355G	p.L452R			22917	S	S	MISSENSE	407	407						0	407	T	G	B.1.617.1	trafficking	Esclera et al. (2021)	'G142D', 'E154K', 'E484Q', 'D614G', 'P681R', 'Q1071H'	~3.5x cleavage of S2 relative to WA1 (D614G) wildtype by Kappa (B.1.617.1) variant as measured by mass spectrometry of Vero-TMPRSS culture (compare to ~4.5x for closely related Delta B.1.617.2 also with P681R at the cleavage site). 	False	True	Kappa	VUM	4-Apr-2021		20-Sep-2021
