name	nt_name	aa_name	multi_aa_name	multiaa_comb_mutation	start	vcf_gene	chrom_region	mutation_type	sequence_depth	sample_size	ps_filter	ps_exc	mat_pep_id	mat_pep_desc	mat_pep_acc	ro	ao	reference_seq	variant_seq	viral_lineages	function_category	citation	comb_mutation	function_description	heterozygosity	clade_defining	who_variant	status	voi_designation_date	voc_designation_date	vum_designation_date
p.T345T	c.C1035T	p.T345T			22597	S	S	SILENT	14	14						11	3.0,0.0	C	T	B.1.427					False	False	Epsilon	VUM	5-Mar-2021		06-Jul-2021
p.T4304I	c.C12911T	p.T4304I			13176	orf1ab	ORF1ab	MISSENSE	14	14			nsp10	nsp10_CysHis, formerly known as growth-factor-like protein (GFL), produced by both pp1a and pp1ab	YP_009725306.1	12	2.0,0.0	C	T	B.1.427					False	False	Epsilon	VUM	5-Mar-2021		06-Jul-2021
p.T5131I	c.C15392T	p.T5131I			15656	orf1ab	ORF1ab	MISSENSE	14	14			RNA-dependent RNA polymerase	nsp12, NiRAN and RdRp, produced by pp1ab only	YP_009725307.1	12	2.0,0.0	C	T	B.1.427					False	False	Epsilon	VUM	5-Mar-2021		06-Jul-2021
p.T531T	c.T1593C	p.T531T			23155	S	S	SILENT	408	408						354	54.0,0.0	T	C	B.1.429					False	False	Epsilon	VUM	5-Mar-2021		06-Jul-2021
p.V100L	c.G298T	p.V100L			28191	ORF8	ORF8	MISSENSE	407	408						346	61.0,0.0	G	T	B.1.429					False	False	Epsilon	VUM	5-Mar-2021		06-Jul-2021
p.V1118V	c.C3354A	p.V1118V			3619	orf1ab	ORF1ab	SILENT	14	14			nsp3	former nsp1, conserved domains are: N-terminal acidic (Ac), predicted phosphoesterase, papain-like proteinase, Y-domain, transmembrane domain 1 (TM1), adenosine diphosphate-ribose 1''-phosphatase (ADRP), produced by both pp1a and pp1ab	YP_009725299.1	12	2.0,0.0	C	A	B.1.427					False	False	Epsilon	VUM	5-Mar-2021		06-Jul-2021
p.V225A	c.T674C	p.V225A			26066	ORF3a	ORF3a	MISSENSE	14	14						12	2.0,0.0	T	C	B.1.427					False	False	Epsilon	VUM	5-Mar-2021		06-Jul-2021
p.V710V	c.C2130T	p.V710V			2395	orf1ab	ORF1ab	SILENT	408	408			nsp2	produced by both pp1a and pp1ab	YP_009725298.1	0	408.0,0.0	C	T	B.1.429					False	True	Epsilon	VUM	5-Mar-2021		06-Jul-2021
p.W152C	c.G456T	p.W152C			22018	S	S	MISSENSE	422	14						1	421.0,0.0	G	T	B.1.427, B.1.429	ACE2 receptor binding affinity	Gong et al. (2021)	'D614G'	Using flow cytometry and ACE2 ectodomains-Fc portion IgG complex, this variant showed a 1.33x increase in binding (KD) relative to D614G.	False	True, True	Epsilon	VUM	5-Mar-2021		06-Jul-2021
p.W152C	c.G456T	p.W152C			22018	S	S	MISSENSE	422	14						1	421.0,0.0	G	T	B.1.427, B.1.429	ACE2 receptor binding affinity	Gong et al. (2021)	'D614G', 'S13I', 'L452R'	Using flow cytometry and ACE2 ectodomains-Fc portion IgG complex, this variant combination (representing lineage B.1.429 aka Epsilon) showed a 2.82x increase  in binding (KD) relative to D614G, indicating a strong marginal effect for L452R.	False	True, True	Epsilon	VUM	5-Mar-2021		06-Jul-2021
p.W152C	c.G456T	p.W152C			22018	S	S	MISSENSE	422	14						1	421.0,0.0	G	T	B.1.427, B.1.429	antibody epitope effects	McCallum et al. (2021)		The W152C mutation reduced recognition of six NTD neutralizing mAbs, including a complete loss of binding for two of them, with a complementary pattern to that observed for S13I (also found in lineage B.1.427/B.1.429) out of 11 neutralizing mAbs evaluated.	False	True, True	Epsilon	VUM	5-Mar-2021		06-Jul-2021
p.W152C	c.G456T	p.W152C			22018	S	S	MISSENSE	422	14						1	421.0,0.0	G	T	B.1.427, B.1.429	antibody epitope effects	McCallum et al. (2021)	'S13I'	The B.1.427/B.1.429 S13I/W152C NTD did not bind to any NTD-directed neutralizing mAbs, which are known to target a single antigenic site (antigenic site i), whereas binding of the non-neutralizing S2L20 mAb to the NTD antigenic site iv was not affected by any mutants, confirming proper retention of folding.	False	True, True	Epsilon	VUM	5-Mar-2021		06-Jul-2021
p.W152C	c.G456T	p.W152C			22018	S	S	MISSENSE	422	14						1	421.0,0.0	G	T	B.1.427, B.1.429	antibody epitope effects	McCallum et al. (2021)	'S13I', 'L452R'	14 of 34 RBD-specific mAbs showed reduced neutralization to the B.1.427/B.1.429 variant pseudotype.	False	True, True	Epsilon	VUM	5-Mar-2021		06-Jul-2021
p.W152C	c.G456T	p.W152C			22018	S	S	MISSENSE	422	14						1	421.0,0.0	G	T	B.1.427, B.1.429	convalescent plasma binding	Gong et al. (2021)	'D614G'	1.15x decrease in Spike binding (relative to D614G alone) by 5 plasma collected 8 months post-symptom-onset.	False	True, True	Epsilon	VUM	5-Mar-2021		06-Jul-2021
p.W152C	c.G456T	p.W152C			22018	S	S	MISSENSE	422	14						1	421.0,0.0	G	T	B.1.427, B.1.429	convalescent plasma binding	Gong et al. (2021)	'D614G', 'S13I', 'L452R'	This variant combination (representing lineage B.1.429 aka Epsilon) showed a 1.1x decrease in Spike binding  (relative to D614G alone) by 5 plasma collected 8 months post-symptom-onset, indicating ablated marginal effect from L452R.	False	True, True	Epsilon	VUM	5-Mar-2021		06-Jul-2021
p.W152C	c.G456T	p.W152C			22018	S	S	MISSENSE	422	14						1	421.0,0.0	G	T	B.1.427, B.1.429	convalescent plasma escape	Deng et al. (2021)	'S13I', 'L452R'	Antibody neutralization assays showed 6.7-fold resistence against 7/8 convalescent plasma.	False	True, True	Epsilon	VUM	5-Mar-2021		06-Jul-2021
p.W152C	c.G456T	p.W152C			22018	S	S	MISSENSE	422	14						1	421.0,0.0	G	T	B.1.427, B.1.429	convalescent plasma escape	McCallum et al. (2021)	'S13I', 'L452R'	In 9 plasma collected 15 to 28 days after early 2020 infections, neutralization reduced 4.9-fold for B.1.427/B.1.429 compared to wildtype (D614G). In 13 plasma collected ~1mo after B.1.1.7 infection (nursing home in Ticino, Switzerland), neutralization  reduced to undetectable levels in many plasma for B.1.427/B.1.429 pseudotyped virus, as well as WT and other VOCs. 	False	True, True	Epsilon	VUM	5-Mar-2021		06-Jul-2021
p.W152C	c.G456T	p.W152C			22018	S	S	MISSENSE	422	14						1	421.0,0.0	G	T	B.1.427, B.1.429	convalescent plasma escape	Tang et al. (2021)	'S13I', 'L452R'	Loss of neutralizing activity (PsVNA50 assay) using 6 hyperimmune immunoglobulin preparations from convalescent plasma was minimal against B.1.249 (1.7-fold). Neutralization against 10 convalescent plasma was somewhat poorer (3.1-fold).	False	True, True	Epsilon	VUM	5-Mar-2021		06-Jul-2021
p.W152C	c.G456T	p.W152C			22018	S	S	MISSENSE	422	14						1	421.0,0.0	G	T	B.1.427, B.1.429	trafficking	Deng et al. (2021)		Pseudoviruses carrying the W152C mutation demonstrated small increases in cell entry compared to  D614G alone in 293T cells and human airway organoids.	False	True, True	Epsilon	VUM	5-Mar-2021		06-Jul-2021
p.W152C	c.G456T	p.W152C			22018	S	S	MISSENSE	422	14						1	421.0,0.0	G	T	B.1.427, B.1.429	transmissibility	Deng et al. (2021)	'S13I', 'L452R'	Exhibits an estimated 18.6-24% increase in transmissibility relative to wild-type circulating strains. a.k.a. 20C/L452R or B.1.427/B.1.429.	False	True, True	Epsilon	VUM	5-Mar-2021		06-Jul-2021
p.W152C	c.G456T	p.W152C			22018	S	S	MISSENSE	422	14						1	421.0,0.0	G	T	B.1.427, B.1.429	transmissibility	Peng et al. (2021)	'S13I', 'L452R'	"Lineages bearing these spike mutations comprised 54.4% of the total sequences from January, compared to 15.7% in November. Household  contacts exposed to the ""California"" or ""West Coast"" variants (B.1.427 and B.1.429) were at higher risk of infection compared  to household contacts exposed to lineages lacking these variants (0.36 vs 0.29, RR"	False	True, True	Epsilon	VUM	5-Mar-2021		06-Jul-2021
p.W152C	c.G456T	p.W152C			22018	S	S	MISSENSE	422	14						1	421.0,0.0	G	T	B.1.427, B.1.429	vaccine neutralization efficacy	Choi et al. (2021)	'S13I', 'L452R', 'D614G'	Neutralization efficiency (ID50) against B.1.1.427/429 reduced 2.1x relative to D614G wildtype using pseudotyped VSV assay on 8 Moderna vaccinee sera one week post-booster.	False	True, True	Epsilon	VUM	5-Mar-2021		06-Jul-2021
p.W152C	c.G456T	p.W152C			22018	S	S	MISSENSE	422	14						1	421.0,0.0	G	T	B.1.427, B.1.429	vaccine neutralization efficacy	Deng et al. (2021)	'S13I', 'L452R', 'D614G'	6 of 11 (55%) vaccine recipients (Moderna or Pfizer), showed 2x reduction in neutralization to a B.1.429 lineage virus.	False	True, True	Epsilon	VUM	5-Mar-2021		06-Jul-2021
p.W152C	c.G456T	p.W152C			22018	S	S	MISSENSE	422	14						1	421.0,0.0	G	T	B.1.427, B.1.429	vaccine neutralization efficacy	Garcia-Beltran et al. (2021)	'S13I', 'L452R', 'D614G'	Pseudotyped B.1.1.429 virus has reduced neutralization activity vs wild type: 2.0x (30 sera Pfizer median 9  days post 2nd dose, 35 sera Moderna median 18 days post 2nd dose). This was NOT significant by ANOVA.	False	True, True	Epsilon	VUM	5-Mar-2021		06-Jul-2021
p.W152C	c.G456T	p.W152C			22018	S	S	MISSENSE	422	14						1	421.0,0.0	G	T	B.1.427, B.1.429	vaccine neutralization efficacy	McCallum et al. (2021)	'S13I', 'L452R'	Using HIV pseudotype: Neutralization potency of 11 Moderna mRNA1273-elicited plasma (7-27 days post-2nd dose) was reduced ~2.8-fold compared to wildtype (D614G) S.  It was reduced ~4-fold in 14 Pfizer/BioNtech BNT162b2-elicited plasma (7-27 days post-2nd dose).  Using VSV pseudotype: we observed a 3-fold average reduction of Pfizer/BioNtech BNT162b2-elicited plasma neutralizing activity.	False	True, True	Epsilon	VUM	5-Mar-2021		06-Jul-2021
p.W152C	c.G456T	p.W152C			22018	S	S	MISSENSE	422	14						1	421.0,0.0	G	T	B.1.427, B.1.429	vaccine neutralization efficacy	Pegu et al (2021)	'S13I', 'L452R', 'D614G'	Detectable antibodies against B.1.1.7 in all samples at Day 43 and Day 209 using pseudotyped lentivirus neutralization in Moderna vaccinee cohort.	False	True, True	Epsilon	VUM	5-Mar-2021		06-Jul-2021
p.W152C	c.G456T	p.W152C			22018	S	S	MISSENSE	422	14						1	421.0,0.0	G	T	B.1.427, B.1.429	vaccinee plasma binding	Gong et al. (2021)	'D614G'	1.03x decrease in Spike binding (relative to D614G alone) by 5 plasma collected 3 weeks after one dose of Pfizer/BioNtech BNT162b2 vaccine in previously non-seroconverted subjects.  1.32x decrease in Spike binding (relative to D614G alone) by 5 plasma collected 3 weeks after one dose of Pfizer/BioNtech BNT162b2 vaccine in post-infection vaccinees.	False	True, True	Epsilon	VUM	5-Mar-2021		06-Jul-2021
p.W152C	c.G456T	p.W152C			22018	S	S	MISSENSE	422	14						1	421.0,0.0	G	T	B.1.427, B.1.429	vaccinee plasma binding	Gong et al. (2021)	'D614G', 'S13I', 'L452R'	This variant combination (representing lineage B.1.429 aka Epsilon) showed a 1.1x decrease in Spike binding  (relative to D614G alone) by 5 plasma collected 3 weeks after one dose of Pfizer/BioNtech BNT162b2 vaccine in previously non-seroconverted subjects. [Stark contrast to 2.15x increase in binding by convalescent plasma 8 months post infection, presumably via memory B cell affinity maturation  against L452R effects] 1.12x decrease in Spike binding (relative to D614G alone) by 5 plasma collected 3 weeks after one dose of Pfizer/BioNtech BNT162b2 vaccine in post-infection vaccinees.	False	True, True	Epsilon	VUM	5-Mar-2021		06-Jul-2021
p.W152C	c.G456T	p.W152C			22018	S	S	MISSENSE	422	14						1	421.0,0.0	G	T	B.1.427, B.1.429	viral load	Deng et al. (2021)	'S13I', 'L452R'	Swab samples N/NP viral RNA is approximately 2-fold higher in B.1.427/B.1.429 than in non-variant viruses.	False	True, True	Epsilon	VUM	5-Mar-2021		06-Jul-2021
p.Y113Y	c.C339T	p.Y113Y			25731	ORF3a	ORF3a	SILENT	408	408						284	124.0,0.0	C	T	B.1.429					False	False	Epsilon	VUM	5-Mar-2021		06-Jul-2021
p.Y3098Y	c.C9294T	p.Y3098Y			9559	orf1ab	ORF1ab	SILENT	14	14			nsp4	nsp4B_TM, contains transmembrane domain 2 (TM2), produced by both pp1a and pp1ab	YP_009725300.1	12	2.0,0.0	C	T	B.1.427					False	False	Epsilon	VUM	5-Mar-2021		06-Jul-2021
